{
	"final_summary" : "EmailNotificationListener.java: observer: EmailNotificationListener acts as an observer, which updates String parameter of eventType, File parameter of file. It is a public class that implements EventListener. The only method of EmailNotificationListener is update (void). No methods call update and update calls 2 methods : getName method of class File and println method of class PrintStream.\n\n\nEventManager.java: observer: EventManager acts as a publisher for observer EventListener, which is inherited by, which subscribes String parameter of eventType, EventListener parameter of listener, which unsubscribes String parameter of eventType, EventListener parameter of listener, which notifies String parameter of eventType, File parameter of file. It is a public class. The 3 methods of EventManager are subscribe (void), unsubscribe (void) and notify (void). No methods call subscribe and subscribe calls 2 methods : get method of class Map and add method of class List. No methods call unsubscribe and unsubscribe calls 2 methods : get method of class Map and remove method of class List. 2 methods ( saveFile method of class Editor and openFile method of class Editor ) call notify and notify calls 2 methods : get method of class Map and update method of class EventListener.\n\n facade: EventManager acts as a subsystem for facade Editor, which openFile method of Editor, saveFile method of Editor calls notify. It is a public class. The 3 methods of EventManager are subscribe (void), unsubscribe (void) and notify (void). No methods call subscribe and subscribe calls 2 methods : get method of class Map and add method of class List. No methods call unsubscribe and unsubscribe calls 2 methods : get method of class Map and remove method of class List. 2 methods ( saveFile method of class Editor and openFile method of class Editor ) call notify and notify calls 2 methods : get method of class Map and update method of class EventListener.\n\n\nEventListener.java: observer: EventListener acts as an observer for publisher EventManager, which is inherited by EmailNotificationListener, LogOpenListener, which updates String parameter of eventType, File parameter of file. It is a public interface. The only method of EventListener is update (void). Only one method ( notify method of class EventManager ) calls update and update calls no methods.\n\n\nLogOpenListener.java: observer: LogOpenListener acts as an observer, which updates String parameter of eventType, File parameter of file. It is a public class that implements EventListener. The only method of LogOpenListener is update (void). No methods call update and update calls 2 methods : getName method of class File and println method of class PrintStream.\n\n\nEditor.java: facade: Editor acts as a facade for subsystem EventManager, which openFile calls notify method of EventManager, which saveFile calls notify method of EventManager. It is a public class. The 2 methods of Editor are openFile (void) and saveFile (void). No methods call openFile and openFile calls only one method : notify method of class EventManager. No methods call saveFile and saveFile calls only one method : notify method of class EventManager.\n\n\n",
	"design_pattern" : [ {
		"facade" : {
			"Editor" : [ "EventManager" ]
		}
	}, {
		"observer" : {
			"EventListener" : {
				"concrete_observer" : [ "EmailNotificationListener", "LogOpenListener" ],
				"publisher" : {
					"EventManager" : [ ]
				}
			}
		}
	} ],
	"summary_NLG" : {
		"observer" : {
			"EmailNotificationListener" : [ "EmailNotificationListener acts as an observer, which updates String parameter of eventType, File parameter of file." ],
			"EventManager" : [ "EventManager acts as a publisher for observer EventListener, which is inherited by, which subscribes String parameter of eventType, EventListener parameter of listener, which unsubscribes String parameter of eventType, EventListener parameter of listener, which notifies String parameter of eventType, File parameter of file." ],
			"EventListener" : [ "EventListener acts as an observer for publisher EventManager, which is inherited by EmailNotificationListener, LogOpenListener, which updates String parameter of eventType, File parameter of file." ],
			"LogOpenListener" : [ "LogOpenListener acts as an observer, which updates String parameter of eventType, File parameter of file." ]
		},
		"facade" : {
			"EventManager" : [ "EventManager acts as a subsystem for facade Editor, which openFile method of Editor, saveFile method of Editor calls notify." ],
			"Editor" : [ "Editor acts as a facade for subsystem EventManager, which openFile calls notify method of EventManager, which saveFile calls notify method of EventManager." ]
		}
	},
	"AbdurRKhalid-Observer" : {
		"EmailNotificationListener" : {
			"FIELDDETAIL" : [ {
				"FIELDCOMMONTYPE" : "String",
				"FIELDMODIFIERTYPE" : [ "private" ],
				"FIELDDECLARATION" : [ "email" ],
				"FIELDDATATYPE" : "String",
				"FIELDACCESSSPECIFIER" : "PRIVATE"
			} ],
			"CLASSORINTERFACEDETAIL" : [ {
				"CLASSACCESSSPECIFIER" : "PUBLIC",
				"NUMBEROFMETHODCALLS" : 2,
				"EXTENDSFROM" : [ ],
				"IMPLEMENTSFROM" : [ "EventListener" ],
				"CLASSNAME" : "EmailNotificationListener",
				"ISINTERFACEORNOT" : false,
				"CLASSTYPEPARAMS" : [ ],
				"ISABSTRACTORNOT" : false,
				"CLASSMODIFIERTYPE" : [ "public" ]
			} ],
			"CONSTRUCTORDETAIL" : [ {
				"CONSTRUCTORMODIFIER" : [ "public" ],
				"CONSTRUCTORPARAMETER" : [ {
					"PARAMETERNAME" : "email",
					"PARAMETERTYPE" : "String"
				} ]
			} ],
			"VARIABLEDETAIL" : [ ],
			"METHODDETAIL" : [ {
				"METHODNAME" : "update",
				"NUMBEROFINCOMINGMETHODS" : 0,
				"INCOMINGMETHOD" : [ ],
				"METHODMODIFIERTYPE" : [ "public" ],
				"METHODBODYLINETYPE" : [ "EXPRESSION" ],
				"NUMBEROFMETHODVARIABLES" : 0,
				"NUMBEROFOUTGOINGMETHODS" : 2,
				"METHODRETURNTYPE" : "void",
				"METHODOVERRIDE" : [ "@Override" ],
				"OUTGOINGMETHOD" : [ {
					"CALLEECLASS" : "PrintStream",
					"CALLEEMETHODNAME" : "println"
				}, {
					"CALLEECLASS" : "File",
					"CALLEEMETHODNAME" : "getName"
				} ],
				"NUMBEROFMETHODLINES" : 1,
				"METHODPARAMETER" : [ {
					"PARAMETERNAME" : "eventType",
					"PARAMETERTYPE" : "String"
				}, {
					"PARAMETERNAME" : "file",
					"PARAMETERTYPE" : "File"
				} ]
			} ]
		},
		"EventManager" : {
			"FIELDDETAIL" : [ {
				"FIELDCOMMONTYPE" : "Map<String, List<EventListener>>",
				"FIELDMODIFIERTYPE" : [ ],
				"FIELDDECLARATION" : [ "listeners = new HashMap<>()" ],
				"FIELDDATATYPE" : "Map<String, List<EventListener>>",
				"FIELDACCESSSPECIFIER" : "NONE"
			} ],
			"CLASSORINTERFACEDETAIL" : [ {
				"CLASSACCESSSPECIFIER" : "PUBLIC",
				"NUMBEROFMETHODCALLS" : 7,
				"EXTENDSFROM" : [ ],
				"IMPLEMENTSFROM" : [ ],
				"CLASSNAME" : "EventManager",
				"ISINTERFACEORNOT" : false,
				"CLASSTYPEPARAMS" : [ ],
				"ISABSTRACTORNOT" : false,
				"CLASSMODIFIERTYPE" : [ "public" ]
			} ],
			"CONSTRUCTORDETAIL" : [ {
				"CONSTRUCTORMODIFIER" : [ "public" ],
				"CONSTRUCTORPARAMETER" : [ {
					"PARAMETERNAME" : "operations",
					"PARAMETERTYPE" : "String..."
				} ]
			} ],
			"VARIABLEDETAIL" : [ {
				"VARIABLEDECLARATION" : [ "operation" ],
				"VARIABLECOMMONTYPE" : "String",
				"VARIABLEELEMENTTYPE" : "String"
			}, {
				"VARIABLEDECLARATION" : [ "users = listeners.get(eventType)" ],
				"VARIABLECOMMONTYPE" : "List<EventListener>",
				"VARIABLEELEMENTTYPE" : "List<EventListener>"
			}, {
				"VARIABLEDECLARATION" : [ "users = listeners.get(eventType)" ],
				"VARIABLECOMMONTYPE" : "List<EventListener>",
				"VARIABLEELEMENTTYPE" : "List<EventListener>"
			}, {
				"VARIABLEDECLARATION" : [ "users = listeners.get(eventType)" ],
				"VARIABLECOMMONTYPE" : "List<EventListener>",
				"VARIABLEELEMENTTYPE" : "List<EventListener>"
			}, {
				"VARIABLEDECLARATION" : [ "listener" ],
				"VARIABLECOMMONTYPE" : "EventListener",
				"VARIABLEELEMENTTYPE" : "EventListener"
			} ],
			"METHODDETAIL" : [ {
				"METHODNAME" : "subscribe",
				"NUMBEROFINCOMINGMETHODS" : 0,
				"INCOMINGMETHOD" : [ ],
				"METHODMODIFIERTYPE" : [ "public" ],
				"METHODBODYLINETYPE" : [ "EXPRESSION", "EXPRESSION" ],
				"NUMBEROFMETHODVARIABLES" : 1,
				"NUMBEROFOUTGOINGMETHODS" : 2,
				"METHODRETURNTYPE" : "void",
				"METHODOVERRIDE" : [ ],
				"OUTGOINGMETHOD" : [ {
					"CALLEECLASS" : "Map",
					"CALLEEMETHODNAME" : "get"
				}, {
					"CALLEECLASS" : "List",
					"CALLEEMETHODNAME" : "add"
				} ],
				"NUMBEROFMETHODLINES" : 2,
				"METHODPARAMETER" : [ {
					"PARAMETERNAME" : "eventType",
					"PARAMETERTYPE" : "String"
				}, {
					"PARAMETERNAME" : "listener",
					"PARAMETERTYPE" : "EventListener"
				} ]
			}, {
				"METHODNAME" : "unsubscribe",
				"NUMBEROFINCOMINGMETHODS" : 0,
				"INCOMINGMETHOD" : [ ],
				"METHODMODIFIERTYPE" : [ "public" ],
				"METHODBODYLINETYPE" : [ "EXPRESSION", "EXPRESSION" ],
				"NUMBEROFMETHODVARIABLES" : 1,
				"NUMBEROFOUTGOINGMETHODS" : 2,
				"METHODRETURNTYPE" : "void",
				"METHODOVERRIDE" : [ ],
				"OUTGOINGMETHOD" : [ {
					"CALLEECLASS" : "Map",
					"CALLEEMETHODNAME" : "get"
				}, {
					"CALLEECLASS" : "List",
					"CALLEEMETHODNAME" : "remove"
				} ],
				"NUMBEROFMETHODLINES" : 2,
				"METHODPARAMETER" : [ {
					"PARAMETERNAME" : "eventType",
					"PARAMETERTYPE" : "String"
				}, {
					"PARAMETERNAME" : "listener",
					"PARAMETERTYPE" : "EventListener"
				} ]
			}, {
				"METHODNAME" : "notify",
				"NUMBEROFINCOMINGMETHODS" : 4,
				"INCOMINGMETHOD" : [ {
					"CALLEDMETHODNAME" : "openFile",
					"CALLEDCLASS" : "Editor"
				}, {
					"CALLEDMETHODNAME" : "saveFile",
					"CALLEDCLASS" : "Editor"
				}, {
					"CALLEDMETHODNAME" : "openFile",
					"CALLEDCLASS" : "Editor"
				}, {
					"CALLEDMETHODNAME" : "saveFile",
					"CALLEDCLASS" : "Editor"
				} ],
				"METHODMODIFIERTYPE" : [ "public" ],
				"METHODBODYLINETYPE" : [ "EXPRESSION", "LOOP" ],
				"NUMBEROFMETHODVARIABLES" : 1,
				"NUMBEROFOUTGOINGMETHODS" : 2,
				"METHODRETURNTYPE" : "void",
				"METHODOVERRIDE" : [ ],
				"OUTGOINGMETHOD" : [ {
					"CALLEECLASS" : "EventListener",
					"CALLEEMETHODNAME" : "update"
				}, {
					"CALLEECLASS" : "Map",
					"CALLEEMETHODNAME" : "get"
				}, {
					"CALLEECLASS" : "EventListener",
					"CALLEEMETHODNAME" : "update"
				} ],
				"NUMBEROFMETHODLINES" : 2,
				"METHODPARAMETER" : [ {
					"PARAMETERNAME" : "eventType",
					"PARAMETERTYPE" : "String"
				}, {
					"PARAMETERNAME" : "file",
					"PARAMETERTYPE" : "File"
				} ]
			} ]
		},
		"EventListener" : {
			"FIELDDETAIL" : [ ],
			"CLASSORINTERFACEDETAIL" : [ {
				"CLASSACCESSSPECIFIER" : "PUBLIC",
				"NUMBEROFMETHODCALLS" : 0,
				"EXTENDSFROM" : [ ],
				"IMPLEMENTSFROM" : [ ],
				"CLASSNAME" : "EventListener",
				"ISINTERFACEORNOT" : true,
				"CLASSTYPEPARAMS" : [ ],
				"ISABSTRACTORNOT" : false,
				"CLASSMODIFIERTYPE" : [ "public" ]
			} ],
			"CONSTRUCTORDETAIL" : [ ],
			"VARIABLEDETAIL" : [ ],
			"METHODDETAIL" : [ {
				"METHODNAME" : "update",
				"NUMBEROFINCOMINGMETHODS" : 2,
				"INCOMINGMETHOD" : [ {
					"CALLEDMETHODNAME" : "notify",
					"CALLEDCLASS" : "EventManager"
				}, {
					"CALLEDMETHODNAME" : "notify",
					"CALLEDCLASS" : "EventManager"
				} ],
				"METHODMODIFIERTYPE" : [ ],
				"METHODBODYLINETYPE" : [ ],
				"NUMBEROFMETHODVARIABLES" : 0,
				"NUMBEROFOUTGOINGMETHODS" : 0,
				"METHODRETURNTYPE" : "void",
				"METHODOVERRIDE" : [ ],
				"OUTGOINGMETHOD" : [ ],
				"NUMBEROFMETHODLINES" : 0,
				"METHODPARAMETER" : [ {
					"PARAMETERNAME" : "eventType",
					"PARAMETERTYPE" : "String"
				}, {
					"PARAMETERNAME" : "file",
					"PARAMETERTYPE" : "File"
				} ]
			} ]
		},
		"LogOpenListener" : {
			"FIELDDETAIL" : [ {
				"FIELDCOMMONTYPE" : "File",
				"FIELDMODIFIERTYPE" : [ "private" ],
				"FIELDDECLARATION" : [ "log" ],
				"FIELDDATATYPE" : "File",
				"FIELDACCESSSPECIFIER" : "PRIVATE"
			} ],
			"CLASSORINTERFACEDETAIL" : [ {
				"CLASSACCESSSPECIFIER" : "PUBLIC",
				"NUMBEROFMETHODCALLS" : 2,
				"EXTENDSFROM" : [ ],
				"IMPLEMENTSFROM" : [ "EventListener" ],
				"CLASSNAME" : "LogOpenListener",
				"ISINTERFACEORNOT" : false,
				"CLASSTYPEPARAMS" : [ ],
				"ISABSTRACTORNOT" : false,
				"CLASSMODIFIERTYPE" : [ "public" ]
			} ],
			"CONSTRUCTORDETAIL" : [ {
				"CONSTRUCTORMODIFIER" : [ "public" ],
				"CONSTRUCTORPARAMETER" : [ {
					"PARAMETERNAME" : "fileName",
					"PARAMETERTYPE" : "String"
				} ]
			} ],
			"VARIABLEDETAIL" : [ ],
			"METHODDETAIL" : [ {
				"METHODNAME" : "update",
				"NUMBEROFINCOMINGMETHODS" : 0,
				"INCOMINGMETHOD" : [ ],
				"METHODMODIFIERTYPE" : [ "public" ],
				"METHODBODYLINETYPE" : [ "EXPRESSION" ],
				"NUMBEROFMETHODVARIABLES" : 0,
				"NUMBEROFOUTGOINGMETHODS" : 2,
				"METHODRETURNTYPE" : "void",
				"METHODOVERRIDE" : [ "@Override" ],
				"OUTGOINGMETHOD" : [ {
					"CALLEECLASS" : "PrintStream",
					"CALLEEMETHODNAME" : "println"
				}, {
					"CALLEECLASS" : "File",
					"CALLEEMETHODNAME" : "getName"
				} ],
				"NUMBEROFMETHODLINES" : 1,
				"METHODPARAMETER" : [ {
					"PARAMETERNAME" : "eventType",
					"PARAMETERTYPE" : "String"
				}, {
					"PARAMETERNAME" : "file",
					"PARAMETERTYPE" : "File"
				} ]
			} ]
		},
		"Editor" : {
			"FIELDDETAIL" : [ {
				"FIELDCOMMONTYPE" : "EventManager",
				"FIELDMODIFIERTYPE" : [ "public" ],
				"FIELDDECLARATION" : [ "events" ],
				"FIELDDATATYPE" : "EventManager",
				"FIELDACCESSSPECIFIER" : "PUBLIC"
			}, {
				"FIELDCOMMONTYPE" : "File",
				"FIELDMODIFIERTYPE" : [ "private" ],
				"FIELDDECLARATION" : [ "file" ],
				"FIELDDATATYPE" : "File",
				"FIELDACCESSSPECIFIER" : "PRIVATE"
			} ],
			"CLASSORINTERFACEDETAIL" : [ {
				"CLASSACCESSSPECIFIER" : "PUBLIC",
				"NUMBEROFMETHODCALLS" : 2,
				"EXTENDSFROM" : [ ],
				"IMPLEMENTSFROM" : [ ],
				"CLASSNAME" : "Editor",
				"ISINTERFACEORNOT" : false,
				"CLASSTYPEPARAMS" : [ ],
				"ISABSTRACTORNOT" : false,
				"CLASSMODIFIERTYPE" : [ "public" ]
			} ],
			"CONSTRUCTORDETAIL" : [ {
				"CONSTRUCTORMODIFIER" : [ "public" ],
				"CONSTRUCTORPARAMETER" : [ ]
			} ],
			"VARIABLEDETAIL" : [ ],
			"METHODDETAIL" : [ {
				"METHODNAME" : "openFile",
				"NUMBEROFINCOMINGMETHODS" : 0,
				"INCOMINGMETHOD" : [ ],
				"METHODMODIFIERTYPE" : [ "public" ],
				"METHODBODYLINETYPE" : [ "EXPRESSION", "EXPRESSION" ],
				"NUMBEROFMETHODVARIABLES" : 0,
				"NUMBEROFOUTGOINGMETHODS" : 1,
				"METHODRETURNTYPE" : "void",
				"METHODOVERRIDE" : [ ],
				"OUTGOINGMETHOD" : [ {
					"CALLEECLASS" : "EventManager",
					"CALLEEMETHODNAME" : "notify"
				}, {
					"CALLEECLASS" : "EventManager",
					"CALLEEMETHODNAME" : "notify"
				} ],
				"NUMBEROFMETHODLINES" : 2,
				"METHODPARAMETER" : [ {
					"PARAMETERNAME" : "filePath",
					"PARAMETERTYPE" : "String"
				} ]
			}, {
				"METHODNAME" : "saveFile",
				"NUMBEROFINCOMINGMETHODS" : 0,
				"INCOMINGMETHOD" : [ ],
				"METHODMODIFIERTYPE" : [ "public" ],
				"METHODBODYLINETYPE" : [ "IF" ],
				"NUMBEROFMETHODVARIABLES" : 0,
				"NUMBEROFOUTGOINGMETHODS" : 1,
				"METHODRETURNTYPE" : "void",
				"METHODOVERRIDE" : [ ],
				"OUTGOINGMETHOD" : [ {
					"CALLEECLASS" : "EventManager",
					"CALLEEMETHODNAME" : "notify"
				}, {
					"CALLEECLASS" : "EventManager",
					"CALLEEMETHODNAME" : "notify"
				} ],
				"NUMBEROFMETHODLINES" : 1,
				"METHODPARAMETER" : [ ]
			} ]
		}
	}
}