{
	"final_summary" : "WindowsOSFactory.java: abstract_factory: WindowsOSFactory acts as a factory for GUIFactory, which overrides createButton method of GUIFactory, createCheckBox method of GUIFactory. It is a public class that implements GUIFactory. The 2 methods of WindowsOSFactory are createButton (Button) and createCheckBox (CheckBox). No methods call createButton and createButton calls no methods. No methods call createCheckBox and createCheckBox calls no methods.\n\n memento: WindowsOSFactory acts as an originator for memento CheckBox, which creates a CheckBox Check Box to. WindowsOSFactory acts as an originator for memento Button, which creates a Button Button to. It is a public class that implements GUIFactory. The 2 methods of WindowsOSFactory are createButton (Button) and createCheckBox (CheckBox). No methods call createButton and createButton calls no methods. No methods call createCheckBox and createCheckBox calls no methods.\n\n factory_method: WindowsOSFactory acts as a factory method for CheckBox, which is inherited by GUIFactory, GUIFactory. It is a public class that implements GUIFactory. The 2 methods of WindowsOSFactory are createButton (Button) and createCheckBox (CheckBox). No methods call createButton and createButton calls no methods. No methods call createCheckBox and createCheckBox calls no methods.\n\n\nWindowsButton.java: abstract_factory: WindowsButton acts as a product for GUIFactory, which overrides paint method of Button. It is a public class that implements Button. The only method of WindowsButton is paint (void). No methods call paint and paint calls only one method : println method of class PrintStream.\n\n memento: WindowsButton acts as a memento, which paints. It is a public class that implements Button. The only method of WindowsButton is paint (void). No methods call paint and paint calls only one method : println method of class PrintStream.\n\n\nButton.java: abstract_factory: Button acts as an abstract product for Button, which is inherited by WindowsButton, MacOSButton. It is a public interface. The only method of Button is paint (void). Only one method ( paint method of class Application ) calls paint and paint calls no methods.\n\n facade: Button acts as a subsystem for facade Application, which paint method of Application calls paint. It is a public interface. The only method of Button is paint (void). Only one method ( paint method of class Application ) calls paint and paint calls no methods.\n\n memento: Button acts as a memento, which is inherited by WindowsButton, MacOSButton, which paints. It is a public interface. The only method of Button is paint (void). Only one method ( paint method of class Application ) calls paint and paint calls no methods.\n\n\nTest.java: Test does not have any design pattern.  It is a public class. The only method of Test is main (void). No methods call main and main calls only one method : paint method of class Application.\n\n\nCheckBox.java: abstract_factory: CheckBox acts as an abstract product for CheckBox, which is inherited by WindowsCheckBox, MacOSCheckBox. It is a public interface. The only method of CheckBox is paint (void). Only one method ( paint method of class Application ) calls paint and paint calls no methods.\n\n facade: CheckBox acts as a subsystem for facade Application, which paint method of Application calls paint. It is a public interface. The only method of CheckBox is paint (void). Only one method ( paint method of class Application ) calls paint and paint calls no methods.\n\n memento: CheckBox acts as a memento, which is inherited by WindowsCheckBox, MacOSCheckBox, which paints. It is a public interface. The only method of CheckBox is paint (void). Only one method ( paint method of class Application ) calls paint and paint calls no methods.\n\n factory_method: CheckBox acts as an abstract product for WindowsOSFactory, which is inherited by WindowsCheckBox, MacOSCheckBox. It is a public interface. The only method of CheckBox is paint (void). Only one method ( paint method of class Application ) calls paint and paint calls no methods.\n\n\nMacOSFactory.java: abstract_factory: MacOSFactory acts as a factory for GUIFactory, which overrides createButton method of GUIFactory, createCheckBox method of GUIFactory. It is a public class that implements GUIFactory. The 2 methods of MacOSFactory are createButton (Button) and createCheckBox (CheckBox). No methods call createButton and createButton calls no methods. No methods call createCheckBox and createCheckBox calls no methods.\n\n memento: MacOSFactory acts as an originator for memento Button, which creates a Button Button to. MacOSFactory acts as an originator for memento CheckBox, which creates a CheckBox Check Box to. It is a public class that implements GUIFactory. The 2 methods of MacOSFactory are createButton (Button) and createCheckBox (CheckBox). No methods call createButton and createButton calls no methods. No methods call createCheckBox and createCheckBox calls no methods.\n\n\nMacOSButton.java: abstract_factory: MacOSButton acts as a product for GUIFactory, which overrides paint method of Button. It is a public class that implements Button. The only method of MacOSButton is paint (void). No methods call paint and paint calls only one method : println method of class PrintStream.\n\n memento: MacOSButton acts as a memento, which paints. It is a public class that implements Button. The only method of MacOSButton is paint (void). No methods call paint and paint calls only one method : println method of class PrintStream.\n\n\nWindowsCheckBox.java: abstract_factory: WindowsCheckBox acts as a product for GUIFactory, which overrides paint method of CheckBox. It is a public class that implements CheckBox. The only method of WindowsCheckBox is paint (void). No methods call paint and paint calls only one method : println method of class PrintStream.\n\n memento: WindowsCheckBox acts as a memento, which paints. It is a public class that implements CheckBox. The only method of WindowsCheckBox is paint (void). No methods call paint and paint calls only one method : println method of class PrintStream.\n\n factory_method: WindowsCheckBox acts as a product for WindowsOSFactory, which overrides paint method of CheckBox. It is a public class that implements CheckBox. The only method of WindowsCheckBox is paint (void). No methods call paint and paint calls only one method : println method of class PrintStream.\n\n\nApplication.java: facade: Application acts as a facade for subsystem Button, CheckBox, which paint calls paint method of Button, paint method of CheckBox. It is a public class. The only method of Application is paint (void). Only one method ( main method of class Test ) calls paint and paint calls 2 methods : paint method of class Button and paint method of class CheckBox.\n\n memento: Application acts as a caretaker for memento CheckBox, which paints. Application acts as a caretaker for memento Button, which paints. It is a public class. The only method of Application is paint (void). Only one method ( main method of class Test ) calls paint and paint calls 2 methods : paint method of class Button and paint method of class CheckBox.\n\n\nMacOSCheckBox.java: abstract_factory: MacOSCheckBox acts as a product for GUIFactory, which overrides paint method of CheckBox. It is a public class that implements CheckBox. The only method of MacOSCheckBox is paint (void). No methods call paint and paint calls only one method : println method of class PrintStream.\n\n memento: MacOSCheckBox acts as a memento, which paints. It is a public class that implements CheckBox. The only method of MacOSCheckBox is paint (void). No methods call paint and paint calls only one method : println method of class PrintStream.\n\n factory_method: MacOSCheckBox acts as a product for WindowsOSFactory, which overrides paint method of CheckBox. It is a public class that implements CheckBox. The only method of MacOSCheckBox is paint (void). No methods call paint and paint calls only one method : println method of class PrintStream.\n\n\nGUIFactory.java: abstract_factory: GUIFactory acts as an abstract factory for Button, CheckBox, which is inherited by WindowsOSFactory, MacOSFactory. It is a public interface. The 2 methods of GUIFactory are createButton (Button) and createCheckBox (CheckBox). No methods call createButton and createButton calls no methods. No methods call createCheckBox and createCheckBox calls no methods.\n\n memento: GUIFactory acts as an originator for memento Button, which is inherited by, which creates a Button Button to. GUIFactory acts as an originator for memento CheckBox, which is inherited by, which creates a CheckBox Check Box to. It is a public interface. The 2 methods of GUIFactory are createButton (Button) and createCheckBox (CheckBox). No methods call createButton and createButton calls no methods. No methods call createCheckBox and createCheckBox calls no methods.\n\n factory_method: GUIFactory acts as a factory for WindowsOSFactory, which overrides. It is a public interface. The 2 methods of GUIFactory are createButton (Button) and createCheckBox (CheckBox). No methods call createButton and createButton calls no methods. No methods call createCheckBox and createCheckBox calls no methods.\n\n\n",
	"design_pattern" : [ {
		"factory_method" : {
			"WindowsOSFactory" : {
				"concrete_product" : [ "WindowsCheckBox", "MacOSCheckBox" ],
				"abstract_product" : "CheckBox",
				"concrete_factory" : [ "GUIFactory", "GUIFactory" ]
			}
		}
	}, {
		"abstract_factory" : {
			"GUIFactory" : {
				"abstract_product" : {
					"Button" : [ "WindowsButton", "MacOSButton" ],
					"CheckBox" : [ "WindowsCheckBox", "MacOSCheckBox" ]
				},
				"concrete_factory" : [ "WindowsOSFactory", "MacOSFactory" ]
			}
		}
	}, {
		"facade" : {
			"Application" : [ "Button", "CheckBox" ]
		}
	}, {
		"memento" : {
			"Button" : {
				"caretaker" : {
					"Application" : [ ]
				},
				"originator" : {
					"GUIFactory" : [ "WindowsOSFactory", "MacOSFactory" ]
				},
				"concrete_memento" : [ "WindowsButton", "MacOSButton" ]
			},
			"CheckBox" : {
				"caretaker" : {
					"Application" : [ ]
				},
				"originator" : {
					"GUIFactory" : [ "WindowsOSFactory", "MacOSFactory" ]
				},
				"concrete_memento" : [ "WindowsCheckBox", "MacOSCheckBox" ]
			}
		}
	} ],
	"AbdurRKhalid-Abstract Factory" : {
		"WindowsOSFactory" : {
			"FIELDDETAIL" : [ ],
			"CLASSORINTERFACEDETAIL" : [ {
				"CLASSACCESSSPECIFIER" : "PUBLIC",
				"NUMBEROFMETHODCALLS" : 0,
				"EXTENDSFROM" : [ ],
				"IMPLEMENTSFROM" : [ "GUIFactory" ],
				"CLASSNAME" : "WindowsOSFactory",
				"ISINTERFACEORNOT" : false,
				"CLASSTYPEPARAMS" : [ ],
				"ISABSTRACTORNOT" : false,
				"CLASSMODIFIERTYPE" : [ "public" ]
			} ],
			"CONSTRUCTORDETAIL" : [ ],
			"VARIABLEDETAIL" : [ ],
			"METHODDETAIL" : [ {
				"METHODNAME" : "createButton",
				"NUMBEROFINCOMINGMETHODS" : 0,
				"INCOMINGMETHOD" : [ ],
				"METHODMODIFIERTYPE" : [ "public" ],
				"METHODBODYLINETYPE" : [ "RETURN" ],
				"NUMBEROFMETHODVARIABLES" : 0,
				"NUMBEROFOUTGOINGMETHODS" : 0,
				"METHODRETURNTYPE" : "Button",
				"METHODOVERRIDE" : [ "@Override" ],
				"OUTGOINGMETHOD" : [ ],
				"NUMBEROFMETHODLINES" : 1,
				"METHODPARAMETER" : [ ]
			}, {
				"METHODNAME" : "createCheckBox",
				"NUMBEROFINCOMINGMETHODS" : 0,
				"INCOMINGMETHOD" : [ ],
				"METHODMODIFIERTYPE" : [ "public" ],
				"METHODBODYLINETYPE" : [ "RETURN" ],
				"NUMBEROFMETHODVARIABLES" : 0,
				"NUMBEROFOUTGOINGMETHODS" : 0,
				"METHODRETURNTYPE" : "CheckBox",
				"METHODOVERRIDE" : [ "@Override" ],
				"OUTGOINGMETHOD" : [ ],
				"NUMBEROFMETHODLINES" : 1,
				"METHODPARAMETER" : [ ]
			} ]
		},
		"WindowsButton" : {
			"FIELDDETAIL" : [ ],
			"CLASSORINTERFACEDETAIL" : [ {
				"CLASSACCESSSPECIFIER" : "PUBLIC",
				"NUMBEROFMETHODCALLS" : 1,
				"EXTENDSFROM" : [ ],
				"IMPLEMENTSFROM" : [ "Button" ],
				"CLASSNAME" : "WindowsButton",
				"ISINTERFACEORNOT" : false,
				"CLASSTYPEPARAMS" : [ ],
				"ISABSTRACTORNOT" : false,
				"CLASSMODIFIERTYPE" : [ "public" ]
			} ],
			"CONSTRUCTORDETAIL" : [ ],
			"VARIABLEDETAIL" : [ ],
			"METHODDETAIL" : [ {
				"METHODNAME" : "paint",
				"NUMBEROFINCOMINGMETHODS" : 0,
				"INCOMINGMETHOD" : [ ],
				"METHODMODIFIERTYPE" : [ "public" ],
				"METHODBODYLINETYPE" : [ "EXPRESSION" ],
				"NUMBEROFMETHODVARIABLES" : 0,
				"NUMBEROFOUTGOINGMETHODS" : 1,
				"METHODRETURNTYPE" : "void",
				"METHODOVERRIDE" : [ "@Override" ],
				"OUTGOINGMETHOD" : [ {
					"CALLEECLASS" : "PrintStream",
					"CALLEEMETHODNAME" : "println"
				} ],
				"NUMBEROFMETHODLINES" : 1,
				"METHODPARAMETER" : [ ]
			} ]
		},
		"Button" : {
			"FIELDDETAIL" : [ ],
			"CLASSORINTERFACEDETAIL" : [ {
				"CLASSACCESSSPECIFIER" : "PUBLIC",
				"NUMBEROFMETHODCALLS" : 0,
				"EXTENDSFROM" : [ ],
				"IMPLEMENTSFROM" : [ ],
				"CLASSNAME" : "Button",
				"ISINTERFACEORNOT" : true,
				"CLASSTYPEPARAMS" : [ ],
				"ISABSTRACTORNOT" : false,
				"CLASSMODIFIERTYPE" : [ "public" ]
			} ],
			"CONSTRUCTORDETAIL" : [ ],
			"VARIABLEDETAIL" : [ ],
			"METHODDETAIL" : [ {
				"METHODNAME" : "paint",
				"NUMBEROFINCOMINGMETHODS" : 2,
				"INCOMINGMETHOD" : [ {
					"CALLEDMETHODNAME" : "paint",
					"CALLEDCLASS" : "Application"
				}, {
					"CALLEDMETHODNAME" : "paint",
					"CALLEDCLASS" : "Application"
				} ],
				"METHODMODIFIERTYPE" : [ ],
				"METHODBODYLINETYPE" : [ ],
				"NUMBEROFMETHODVARIABLES" : 0,
				"NUMBEROFOUTGOINGMETHODS" : 0,
				"METHODRETURNTYPE" : "void",
				"METHODOVERRIDE" : [ ],
				"OUTGOINGMETHOD" : [ ],
				"NUMBEROFMETHODLINES" : 0,
				"METHODPARAMETER" : [ ]
			} ]
		},
		"Test" : {
			"FIELDDETAIL" : [ ],
			"CLASSORINTERFACEDETAIL" : [ {
				"CLASSACCESSSPECIFIER" : "PUBLIC",
				"NUMBEROFMETHODCALLS" : 1,
				"EXTENDSFROM" : [ ],
				"IMPLEMENTSFROM" : [ ],
				"CLASSNAME" : "Test",
				"ISINTERFACEORNOT" : false,
				"CLASSTYPEPARAMS" : [ ],
				"ISABSTRACTORNOT" : false,
				"CLASSMODIFIERTYPE" : [ "public" ]
			} ],
			"CONSTRUCTORDETAIL" : [ ],
			"VARIABLEDETAIL" : [ {
				"VARIABLEDECLARATION" : [ "app" ],
				"VARIABLECOMMONTYPE" : "Application",
				"VARIABLEELEMENTTYPE" : "Application"
			}, {
				"VARIABLEDECLARATION" : [ "factory" ],
				"VARIABLECOMMONTYPE" : "GUIFactory",
				"VARIABLEELEMENTTYPE" : "GUIFactory"
			} ],
			"METHODDETAIL" : [ {
				"METHODNAME" : "main",
				"NUMBEROFINCOMINGMETHODS" : 0,
				"INCOMINGMETHOD" : [ ],
				"METHODMODIFIERTYPE" : [ "public", "static" ],
				"METHODBODYLINETYPE" : [ "EXPRESSION", "EXPRESSION", "EXPRESSION", "EXPRESSION", "EXPRESSION" ],
				"NUMBEROFMETHODVARIABLES" : 2,
				"NUMBEROFOUTGOINGMETHODS" : 1,
				"METHODRETURNTYPE" : "void",
				"METHODOVERRIDE" : [ ],
				"OUTGOINGMETHOD" : [ {
					"CALLEECLASS" : "Application",
					"CALLEEMETHODNAME" : "paint"
				}, {
					"CALLEECLASS" : "Application",
					"CALLEEMETHODNAME" : "paint"
				} ],
				"NUMBEROFMETHODLINES" : 5,
				"METHODPARAMETER" : [ {
					"PARAMETERNAME" : "args",
					"PARAMETERTYPE" : "String[]"
				} ]
			} ]
		},
		"CheckBox" : {
			"FIELDDETAIL" : [ ],
			"CLASSORINTERFACEDETAIL" : [ {
				"CLASSACCESSSPECIFIER" : "PUBLIC",
				"NUMBEROFMETHODCALLS" : 0,
				"EXTENDSFROM" : [ ],
				"IMPLEMENTSFROM" : [ ],
				"CLASSNAME" : "CheckBox",
				"ISINTERFACEORNOT" : true,
				"CLASSTYPEPARAMS" : [ ],
				"ISABSTRACTORNOT" : false,
				"CLASSMODIFIERTYPE" : [ "public" ]
			} ],
			"CONSTRUCTORDETAIL" : [ ],
			"VARIABLEDETAIL" : [ ],
			"METHODDETAIL" : [ {
				"METHODNAME" : "paint",
				"NUMBEROFINCOMINGMETHODS" : 2,
				"INCOMINGMETHOD" : [ {
					"CALLEDMETHODNAME" : "paint",
					"CALLEDCLASS" : "Application"
				}, {
					"CALLEDMETHODNAME" : "paint",
					"CALLEDCLASS" : "Application"
				} ],
				"METHODMODIFIERTYPE" : [ ],
				"METHODBODYLINETYPE" : [ ],
				"NUMBEROFMETHODVARIABLES" : 0,
				"NUMBEROFOUTGOINGMETHODS" : 0,
				"METHODRETURNTYPE" : "void",
				"METHODOVERRIDE" : [ ],
				"OUTGOINGMETHOD" : [ ],
				"NUMBEROFMETHODLINES" : 0,
				"METHODPARAMETER" : [ ]
			} ]
		},
		"MacOSFactory" : {
			"FIELDDETAIL" : [ ],
			"CLASSORINTERFACEDETAIL" : [ {
				"CLASSACCESSSPECIFIER" : "PUBLIC",
				"NUMBEROFMETHODCALLS" : 0,
				"EXTENDSFROM" : [ ],
				"IMPLEMENTSFROM" : [ "GUIFactory" ],
				"CLASSNAME" : "MacOSFactory",
				"ISINTERFACEORNOT" : false,
				"CLASSTYPEPARAMS" : [ ],
				"ISABSTRACTORNOT" : false,
				"CLASSMODIFIERTYPE" : [ "public" ]
			} ],
			"CONSTRUCTORDETAIL" : [ ],
			"VARIABLEDETAIL" : [ ],
			"METHODDETAIL" : [ {
				"METHODNAME" : "createButton",
				"NUMBEROFINCOMINGMETHODS" : 0,
				"INCOMINGMETHOD" : [ ],
				"METHODMODIFIERTYPE" : [ "public" ],
				"METHODBODYLINETYPE" : [ "RETURN" ],
				"NUMBEROFMETHODVARIABLES" : 0,
				"NUMBEROFOUTGOINGMETHODS" : 0,
				"METHODRETURNTYPE" : "Button",
				"METHODOVERRIDE" : [ "@Override" ],
				"OUTGOINGMETHOD" : [ ],
				"NUMBEROFMETHODLINES" : 1,
				"METHODPARAMETER" : [ ]
			}, {
				"METHODNAME" : "createCheckBox",
				"NUMBEROFINCOMINGMETHODS" : 0,
				"INCOMINGMETHOD" : [ ],
				"METHODMODIFIERTYPE" : [ "public" ],
				"METHODBODYLINETYPE" : [ "RETURN" ],
				"NUMBEROFMETHODVARIABLES" : 0,
				"NUMBEROFOUTGOINGMETHODS" : 0,
				"METHODRETURNTYPE" : "CheckBox",
				"METHODOVERRIDE" : [ "@Override" ],
				"OUTGOINGMETHOD" : [ ],
				"NUMBEROFMETHODLINES" : 1,
				"METHODPARAMETER" : [ ]
			} ]
		},
		"MacOSButton" : {
			"FIELDDETAIL" : [ ],
			"CLASSORINTERFACEDETAIL" : [ {
				"CLASSACCESSSPECIFIER" : "PUBLIC",
				"NUMBEROFMETHODCALLS" : 1,
				"EXTENDSFROM" : [ ],
				"IMPLEMENTSFROM" : [ "Button" ],
				"CLASSNAME" : "MacOSButton",
				"ISINTERFACEORNOT" : false,
				"CLASSTYPEPARAMS" : [ ],
				"ISABSTRACTORNOT" : false,
				"CLASSMODIFIERTYPE" : [ "public" ]
			} ],
			"CONSTRUCTORDETAIL" : [ ],
			"VARIABLEDETAIL" : [ ],
			"METHODDETAIL" : [ {
				"METHODNAME" : "paint",
				"NUMBEROFINCOMINGMETHODS" : 0,
				"INCOMINGMETHOD" : [ ],
				"METHODMODIFIERTYPE" : [ "public" ],
				"METHODBODYLINETYPE" : [ "EXPRESSION" ],
				"NUMBEROFMETHODVARIABLES" : 0,
				"NUMBEROFOUTGOINGMETHODS" : 1,
				"METHODRETURNTYPE" : "void",
				"METHODOVERRIDE" : [ "@Override" ],
				"OUTGOINGMETHOD" : [ {
					"CALLEECLASS" : "PrintStream",
					"CALLEEMETHODNAME" : "println"
				} ],
				"NUMBEROFMETHODLINES" : 1,
				"METHODPARAMETER" : [ ]
			} ]
		},
		"WindowsCheckBox" : {
			"FIELDDETAIL" : [ ],
			"CLASSORINTERFACEDETAIL" : [ {
				"CLASSACCESSSPECIFIER" : "PUBLIC",
				"NUMBEROFMETHODCALLS" : 1,
				"EXTENDSFROM" : [ ],
				"IMPLEMENTSFROM" : [ "CheckBox" ],
				"CLASSNAME" : "WindowsCheckBox",
				"ISINTERFACEORNOT" : false,
				"CLASSTYPEPARAMS" : [ ],
				"ISABSTRACTORNOT" : false,
				"CLASSMODIFIERTYPE" : [ "public" ]
			} ],
			"CONSTRUCTORDETAIL" : [ ],
			"VARIABLEDETAIL" : [ ],
			"METHODDETAIL" : [ {
				"METHODNAME" : "paint",
				"NUMBEROFINCOMINGMETHODS" : 0,
				"INCOMINGMETHOD" : [ ],
				"METHODMODIFIERTYPE" : [ "public" ],
				"METHODBODYLINETYPE" : [ "EXPRESSION" ],
				"NUMBEROFMETHODVARIABLES" : 0,
				"NUMBEROFOUTGOINGMETHODS" : 1,
				"METHODRETURNTYPE" : "void",
				"METHODOVERRIDE" : [ "@Override" ],
				"OUTGOINGMETHOD" : [ {
					"CALLEECLASS" : "PrintStream",
					"CALLEEMETHODNAME" : "println"
				} ],
				"NUMBEROFMETHODLINES" : 1,
				"METHODPARAMETER" : [ ]
			} ]
		},
		"Application" : {
			"FIELDDETAIL" : [ {
				"FIELDCOMMONTYPE" : "Button",
				"FIELDMODIFIERTYPE" : [ "private" ],
				"FIELDDECLARATION" : [ "button" ],
				"FIELDDATATYPE" : "Button",
				"FIELDACCESSSPECIFIER" : "PRIVATE"
			}, {
				"FIELDCOMMONTYPE" : "CheckBox",
				"FIELDMODIFIERTYPE" : [ "private" ],
				"FIELDDECLARATION" : [ "checkBox" ],
				"FIELDDATATYPE" : "CheckBox",
				"FIELDACCESSSPECIFIER" : "PRIVATE"
			} ],
			"CLASSORINTERFACEDETAIL" : [ {
				"CLASSACCESSSPECIFIER" : "PUBLIC",
				"NUMBEROFMETHODCALLS" : 4,
				"EXTENDSFROM" : [ ],
				"IMPLEMENTSFROM" : [ ],
				"CLASSNAME" : "Application",
				"ISINTERFACEORNOT" : false,
				"CLASSTYPEPARAMS" : [ ],
				"ISABSTRACTORNOT" : false,
				"CLASSMODIFIERTYPE" : [ "public" ]
			} ],
			"CONSTRUCTORDETAIL" : [ {
				"CONSTRUCTORMODIFIER" : [ "public" ],
				"CONSTRUCTORPARAMETER" : [ {
					"PARAMETERNAME" : "factory",
					"PARAMETERTYPE" : "GUIFactory"
				} ]
			} ],
			"VARIABLEDETAIL" : [ ],
			"METHODDETAIL" : [ {
				"METHODNAME" : "paint",
				"NUMBEROFINCOMINGMETHODS" : 2,
				"INCOMINGMETHOD" : [ {
					"CALLEDMETHODNAME" : "main",
					"CALLEDCLASS" : "Test"
				}, {
					"CALLEDMETHODNAME" : "main",
					"CALLEDCLASS" : "Test"
				} ],
				"METHODMODIFIERTYPE" : [ "public" ],
				"METHODBODYLINETYPE" : [ "EXPRESSION", "EXPRESSION" ],
				"NUMBEROFMETHODVARIABLES" : 0,
				"NUMBEROFOUTGOINGMETHODS" : 2,
				"METHODRETURNTYPE" : "void",
				"METHODOVERRIDE" : [ ],
				"OUTGOINGMETHOD" : [ {
					"CALLEECLASS" : "Button",
					"CALLEEMETHODNAME" : "paint"
				}, {
					"CALLEECLASS" : "CheckBox",
					"CALLEEMETHODNAME" : "paint"
				}, {
					"CALLEECLASS" : "Button",
					"CALLEEMETHODNAME" : "paint"
				}, {
					"CALLEECLASS" : "CheckBox",
					"CALLEEMETHODNAME" : "paint"
				} ],
				"NUMBEROFMETHODLINES" : 2,
				"METHODPARAMETER" : [ ]
			} ]
		},
		"MacOSCheckBox" : {
			"FIELDDETAIL" : [ ],
			"CLASSORINTERFACEDETAIL" : [ {
				"CLASSACCESSSPECIFIER" : "PUBLIC",
				"NUMBEROFMETHODCALLS" : 1,
				"EXTENDSFROM" : [ ],
				"IMPLEMENTSFROM" : [ "CheckBox" ],
				"CLASSNAME" : "MacOSCheckBox",
				"ISINTERFACEORNOT" : false,
				"CLASSTYPEPARAMS" : [ ],
				"ISABSTRACTORNOT" : false,
				"CLASSMODIFIERTYPE" : [ "public" ]
			} ],
			"CONSTRUCTORDETAIL" : [ ],
			"VARIABLEDETAIL" : [ ],
			"METHODDETAIL" : [ {
				"METHODNAME" : "paint",
				"NUMBEROFINCOMINGMETHODS" : 0,
				"INCOMINGMETHOD" : [ ],
				"METHODMODIFIERTYPE" : [ "public" ],
				"METHODBODYLINETYPE" : [ "EXPRESSION" ],
				"NUMBEROFMETHODVARIABLES" : 0,
				"NUMBEROFOUTGOINGMETHODS" : 1,
				"METHODRETURNTYPE" : "void",
				"METHODOVERRIDE" : [ "@Override" ],
				"OUTGOINGMETHOD" : [ {
					"CALLEECLASS" : "PrintStream",
					"CALLEEMETHODNAME" : "println"
				} ],
				"NUMBEROFMETHODLINES" : 1,
				"METHODPARAMETER" : [ ]
			} ]
		},
		"GUIFactory" : {
			"FIELDDETAIL" : [ ],
			"CLASSORINTERFACEDETAIL" : [ {
				"CLASSACCESSSPECIFIER" : "PUBLIC",
				"NUMBEROFMETHODCALLS" : 0,
				"EXTENDSFROM" : [ ],
				"IMPLEMENTSFROM" : [ ],
				"CLASSNAME" : "GUIFactory",
				"ISINTERFACEORNOT" : true,
				"CLASSTYPEPARAMS" : [ ],
				"ISABSTRACTORNOT" : false,
				"CLASSMODIFIERTYPE" : [ "public" ]
			} ],
			"CONSTRUCTORDETAIL" : [ ],
			"VARIABLEDETAIL" : [ ],
			"METHODDETAIL" : [ {
				"METHODNAME" : "createButton",
				"NUMBEROFINCOMINGMETHODS" : 0,
				"INCOMINGMETHOD" : [ ],
				"METHODMODIFIERTYPE" : [ ],
				"METHODBODYLINETYPE" : [ ],
				"NUMBEROFMETHODVARIABLES" : 0,
				"NUMBEROFOUTGOINGMETHODS" : 0,
				"METHODRETURNTYPE" : "Button",
				"METHODOVERRIDE" : [ ],
				"OUTGOINGMETHOD" : [ ],
				"NUMBEROFMETHODLINES" : 0,
				"METHODPARAMETER" : [ ]
			}, {
				"METHODNAME" : "createCheckBox",
				"NUMBEROFINCOMINGMETHODS" : 0,
				"INCOMINGMETHOD" : [ ],
				"METHODMODIFIERTYPE" : [ ],
				"METHODBODYLINETYPE" : [ ],
				"NUMBEROFMETHODVARIABLES" : 0,
				"NUMBEROFOUTGOINGMETHODS" : 0,
				"METHODRETURNTYPE" : "CheckBox",
				"METHODOVERRIDE" : [ ],
				"OUTGOINGMETHOD" : [ ],
				"NUMBEROFMETHODLINES" : 0,
				"METHODPARAMETER" : [ ]
			} ]
		}
	},
	"summary_NLG" : {
		"abstract_factory" : {
			"WindowsOSFactory" : [ "WindowsOSFactory acts as a factory for GUIFactory, which overrides createButton method of GUIFactory, createCheckBox method of GUIFactory." ],
			"WindowsButton" : [ "WindowsButton acts as a product for GUIFactory, which overrides paint method of Button." ],
			"Button" : [ "Button acts as an abstract product for Button, which is inherited by WindowsButton, MacOSButton." ],
			"CheckBox" : [ "CheckBox acts as an abstract product for CheckBox, which is inherited by WindowsCheckBox, MacOSCheckBox." ],
			"MacOSFactory" : [ "MacOSFactory acts as a factory for GUIFactory, which overrides createButton method of GUIFactory, createCheckBox method of GUIFactory." ],
			"MacOSButton" : [ "MacOSButton acts as a product for GUIFactory, which overrides paint method of Button." ],
			"WindowsCheckBox" : [ "WindowsCheckBox acts as a product for GUIFactory, which overrides paint method of CheckBox." ],
			"MacOSCheckBox" : [ "MacOSCheckBox acts as a product for GUIFactory, which overrides paint method of CheckBox." ],
			"GUIFactory" : [ "GUIFactory acts as an abstract factory for Button, CheckBox, which is inherited by WindowsOSFactory, MacOSFactory." ]
		},
		"facade" : {
			"Button" : [ "Button acts as a subsystem for facade Application, which paint method of Application calls paint." ],
			"CheckBox" : [ "CheckBox acts as a subsystem for facade Application, which paint method of Application calls paint." ],
			"Application" : [ "Application acts as a facade for subsystem Button, CheckBox, which paint calls paint method of Button, paint method of CheckBox." ]
		},
		"memento" : {
			"WindowsOSFactory" : [ "WindowsOSFactory acts as an originator for memento CheckBox, which creates a CheckBox Check Box to.", "WindowsOSFactory acts as an originator for memento Button, which creates a Button Button to." ],
			"WindowsButton" : [ "WindowsButton acts as a memento, which paints." ],
			"Button" : [ "Button acts as a memento, which is inherited by WindowsButton, MacOSButton, which paints." ],
			"CheckBox" : [ "CheckBox acts as a memento, which is inherited by WindowsCheckBox, MacOSCheckBox, which paints." ],
			"MacOSFactory" : [ "MacOSFactory acts as an originator for memento Button, which creates a Button Button to.", "MacOSFactory acts as an originator for memento CheckBox, which creates a CheckBox Check Box to." ],
			"MacOSButton" : [ "MacOSButton acts as a memento, which paints." ],
			"WindowsCheckBox" : [ "WindowsCheckBox acts as a memento, which paints." ],
			"Application" : [ "Application acts as a caretaker for memento CheckBox, which paints.", "Application acts as a caretaker for memento Button, which paints." ],
			"MacOSCheckBox" : [ "MacOSCheckBox acts as a memento, which paints." ],
			"GUIFactory" : [ "GUIFactory acts as an originator for memento Button, which is inherited by, which creates a Button Button to.", "GUIFactory acts as an originator for memento CheckBox, which is inherited by, which creates a CheckBox Check Box to." ]
		},
		"factory_method" : {
			"WindowsOSFactory" : [ "WindowsOSFactory acts as a factory method for CheckBox, which is inherited by GUIFactory, GUIFactory." ],
			"CheckBox" : [ "CheckBox acts as an abstract product for WindowsOSFactory, which is inherited by WindowsCheckBox, MacOSCheckBox." ],
			"WindowsCheckBox" : [ "WindowsCheckBox acts as a product for WindowsOSFactory, which overrides paint method of CheckBox." ],
			"MacOSCheckBox" : [ "MacOSCheckBox acts as a product for WindowsOSFactory, which overrides paint method of CheckBox." ],
			"GUIFactory" : [ "GUIFactory acts as a factory for WindowsOSFactory, which overrides." ]
		}
	}
}