{
	"AbdurRKhalid-Visitor" : {
		"ComputerPart" : {
			"FIELDDETAIL" : [ ],
			"CLASSORINTERFACEDETAIL" : [ {
				"CLASSACCESSSPECIFIER" : "PUBLIC",
				"NUMBEROFMETHODCALLS" : 0,
				"EXTENDSFROM" : [ ],
				"IMPLEMENTSFROM" : [ ],
				"CLASSNAME" : "ComputerPart",
				"ISINTERFACEORNOT" : true,
				"CLASSTYPEPARAMS" : [ ],
				"ISABSTRACTORNOT" : false,
				"CLASSMODIFIERTYPE" : [ "public" ]
			} ],
			"CONSTRUCTORDETAIL" : [ ],
			"VARIABLEDETAIL" : [ ],
			"METHODDETAIL" : [ {
				"METHODNAME" : "accept",
				"NUMBEROFINCOMINGMETHODS" : 4,
				"INCOMINGMETHOD" : [ {
					"CALLEDMETHODNAME" : "main",
					"CALLEDCLASS" : "Test"
				}, {
					"CALLEDMETHODNAME" : "accept",
					"CALLEDCLASS" : "Computer"
				}, {
					"CALLEDMETHODNAME" : "main",
					"CALLEDCLASS" : "Test"
				}, {
					"CALLEDMETHODNAME" : "accept",
					"CALLEDCLASS" : "Computer"
				} ],
				"METHODMODIFIERTYPE" : [ "public" ],
				"METHODBODYLINETYPE" : [ ],
				"NUMBEROFMETHODVARIABLES" : 0,
				"NUMBEROFOUTGOINGMETHODS" : 0,
				"METHODRETURNTYPE" : "void",
				"METHODOVERRIDE" : [ ],
				"OUTGOINGMETHOD" : [ ],
				"NUMBEROFMETHODLINES" : 0,
				"METHODPARAMETER" : [ {
					"PARAMETERNAME" : "computerPartVisitor",
					"PARAMETERTYPE" : "ComputerPartVisitor"
				} ]
			} ]
		},
		"Monitor" : {
			"FIELDDETAIL" : [ ],
			"CLASSORINTERFACEDETAIL" : [ {
				"CLASSACCESSSPECIFIER" : "PUBLIC",
				"NUMBEROFMETHODCALLS" : 1,
				"EXTENDSFROM" : [ "ComputerPart" ],
				"IMPLEMENTSFROM" : [ "ComputerPart" ],
				"CLASSNAME" : "Monitor",
				"ISINTERFACEORNOT" : false,
				"CLASSTYPEPARAMS" : [ ],
				"ISABSTRACTORNOT" : false,
				"CLASSMODIFIERTYPE" : [ "public" ]
			} ],
			"CONSTRUCTORDETAIL" : [ ],
			"VARIABLEDETAIL" : [ ],
			"METHODDETAIL" : [ {
				"METHODNAME" : "accept",
				"NUMBEROFINCOMINGMETHODS" : 0,
				"INCOMINGMETHOD" : [ ],
				"METHODMODIFIERTYPE" : [ "public" ],
				"METHODBODYLINETYPE" : [ "EXPRESSION" ],
				"NUMBEROFMETHODVARIABLES" : 0,
				"NUMBEROFOUTGOINGMETHODS" : 1,
				"METHODRETURNTYPE" : "void",
				"METHODOVERRIDE" : [ "@Override" ],
				"OUTGOINGMETHOD" : [ {
					"CALLEECLASS" : "ComputerPartVisitor",
					"CALLEEMETHODNAME" : "visit"
				}, {
					"CALLEECLASS" : "ComputerPartVisitor",
					"CALLEEMETHODNAME" : "visit"
				} ],
				"NUMBEROFMETHODLINES" : 1,
				"METHODPARAMETER" : [ {
					"PARAMETERNAME" : "computerPartVisitor",
					"PARAMETERTYPE" : "ComputerPartVisitor"
				} ]
			} ]
		},
		"Mouse" : {
			"FIELDDETAIL" : [ ],
			"CLASSORINTERFACEDETAIL" : [ {
				"CLASSACCESSSPECIFIER" : "PUBLIC",
				"NUMBEROFMETHODCALLS" : 1,
				"EXTENDSFROM" : [ "ComputerPart" ],
				"IMPLEMENTSFROM" : [ "ComputerPart" ],
				"CLASSNAME" : "Mouse",
				"ISINTERFACEORNOT" : false,
				"CLASSTYPEPARAMS" : [ ],
				"ISABSTRACTORNOT" : false,
				"CLASSMODIFIERTYPE" : [ "public" ]
			} ],
			"CONSTRUCTORDETAIL" : [ ],
			"VARIABLEDETAIL" : [ ],
			"METHODDETAIL" : [ {
				"METHODNAME" : "accept",
				"NUMBEROFINCOMINGMETHODS" : 0,
				"INCOMINGMETHOD" : [ ],
				"METHODMODIFIERTYPE" : [ "public" ],
				"METHODBODYLINETYPE" : [ "EXPRESSION" ],
				"NUMBEROFMETHODVARIABLES" : 0,
				"NUMBEROFOUTGOINGMETHODS" : 1,
				"METHODRETURNTYPE" : "void",
				"METHODOVERRIDE" : [ "@Override" ],
				"OUTGOINGMETHOD" : [ {
					"CALLEECLASS" : "ComputerPartVisitor",
					"CALLEEMETHODNAME" : "visit"
				}, {
					"CALLEECLASS" : "ComputerPartVisitor",
					"CALLEEMETHODNAME" : "visit"
				} ],
				"NUMBEROFMETHODLINES" : 1,
				"METHODPARAMETER" : [ {
					"PARAMETERNAME" : "computerPartVisitor",
					"PARAMETERTYPE" : "ComputerPartVisitor"
				} ]
			} ]
		},
		"ComputerPartDisplayVisitor" : {
			"FIELDDETAIL" : [ ],
			"CLASSORINTERFACEDETAIL" : [ {
				"CLASSACCESSSPECIFIER" : "PUBLIC",
				"NUMBEROFMETHODCALLS" : 4,
				"EXTENDSFROM" : [ "ComputerPartVisitor" ],
				"IMPLEMENTSFROM" : [ "ComputerPartVisitor" ],
				"CLASSNAME" : "ComputerPartDisplayVisitor",
				"ISINTERFACEORNOT" : false,
				"CLASSTYPEPARAMS" : [ ],
				"ISABSTRACTORNOT" : false,
				"CLASSMODIFIERTYPE" : [ "public" ]
			} ],
			"CONSTRUCTORDETAIL" : [ ],
			"VARIABLEDETAIL" : [ ],
			"METHODDETAIL" : [ {
				"METHODNAME" : "visit",
				"NUMBEROFINCOMINGMETHODS" : 0,
				"INCOMINGMETHOD" : [ ],
				"METHODMODIFIERTYPE" : [ "public" ],
				"METHODBODYLINETYPE" : [ "EXPRESSION" ],
				"NUMBEROFMETHODVARIABLES" : 0,
				"NUMBEROFOUTGOINGMETHODS" : 1,
				"METHODRETURNTYPE" : "void",
				"METHODOVERRIDE" : [ "@Override" ],
				"OUTGOINGMETHOD" : [ {
					"CALLEECLASS" : "PrintStream",
					"CALLEEMETHODNAME" : "println"
				} ],
				"NUMBEROFMETHODLINES" : 1,
				"METHODPARAMETER" : [ {
					"PARAMETERNAME" : "computer",
					"PARAMETERTYPE" : "Computer"
				} ]
			}, {
				"METHODNAME" : "visit",
				"NUMBEROFINCOMINGMETHODS" : 0,
				"INCOMINGMETHOD" : [ ],
				"METHODMODIFIERTYPE" : [ "public" ],
				"METHODBODYLINETYPE" : [ "EXPRESSION" ],
				"NUMBEROFMETHODVARIABLES" : 0,
				"NUMBEROFOUTGOINGMETHODS" : 1,
				"METHODRETURNTYPE" : "void",
				"METHODOVERRIDE" : [ "@Override" ],
				"OUTGOINGMETHOD" : [ {
					"CALLEECLASS" : "PrintStream",
					"CALLEEMETHODNAME" : "println"
				} ],
				"NUMBEROFMETHODLINES" : 1,
				"METHODPARAMETER" : [ {
					"PARAMETERNAME" : "mouse",
					"PARAMETERTYPE" : "Mouse"
				} ]
			}, {
				"METHODNAME" : "visit",
				"NUMBEROFINCOMINGMETHODS" : 0,
				"INCOMINGMETHOD" : [ ],
				"METHODMODIFIERTYPE" : [ "public" ],
				"METHODBODYLINETYPE" : [ "EXPRESSION" ],
				"NUMBEROFMETHODVARIABLES" : 0,
				"NUMBEROFOUTGOINGMETHODS" : 1,
				"METHODRETURNTYPE" : "void",
				"METHODOVERRIDE" : [ "@Override" ],
				"OUTGOINGMETHOD" : [ {
					"CALLEECLASS" : "PrintStream",
					"CALLEEMETHODNAME" : "println"
				} ],
				"NUMBEROFMETHODLINES" : 1,
				"METHODPARAMETER" : [ {
					"PARAMETERNAME" : "keyboard",
					"PARAMETERTYPE" : "Keyboard"
				} ]
			}, {
				"METHODNAME" : "visit",
				"NUMBEROFINCOMINGMETHODS" : 0,
				"INCOMINGMETHOD" : [ ],
				"METHODMODIFIERTYPE" : [ "public" ],
				"METHODBODYLINETYPE" : [ "EXPRESSION" ],
				"NUMBEROFMETHODVARIABLES" : 0,
				"NUMBEROFOUTGOINGMETHODS" : 1,
				"METHODRETURNTYPE" : "void",
				"METHODOVERRIDE" : [ "@Override" ],
				"OUTGOINGMETHOD" : [ {
					"CALLEECLASS" : "PrintStream",
					"CALLEEMETHODNAME" : "println"
				} ],
				"NUMBEROFMETHODLINES" : 1,
				"METHODPARAMETER" : [ {
					"PARAMETERNAME" : "monitor",
					"PARAMETERTYPE" : "Monitor"
				} ]
			} ]
		},
		"Test" : {
			"FIELDDETAIL" : [ ],
			"CLASSORINTERFACEDETAIL" : [ {
				"CLASSACCESSSPECIFIER" : "PUBLIC",
				"NUMBEROFMETHODCALLS" : 1,
				"EXTENDSFROM" : [ ],
				"IMPLEMENTSFROM" : [ ],
				"CLASSNAME" : "Test",
				"ISINTERFACEORNOT" : false,
				"CLASSTYPEPARAMS" : [ ],
				"ISABSTRACTORNOT" : false,
				"CLASSMODIFIERTYPE" : [ "public" ]
			} ],
			"CONSTRUCTORDETAIL" : [ ],
			"VARIABLEDETAIL" : [ {
				"VARIABLEDECLARATION" : [ "computer = new Computer()" ],
				"VARIABLECOMMONTYPE" : "ComputerPart",
				"VARIABLEELEMENTTYPE" : "ComputerPart"
			} ],
			"METHODDETAIL" : [ {
				"METHODNAME" : "main",
				"NUMBEROFINCOMINGMETHODS" : 0,
				"INCOMINGMETHOD" : [ ],
				"METHODMODIFIERTYPE" : [ "public", "static" ],
				"METHODBODYLINETYPE" : [ "EXPRESSION", "EXPRESSION" ],
				"NUMBEROFMETHODVARIABLES" : 1,
				"NUMBEROFOUTGOINGMETHODS" : 1,
				"METHODRETURNTYPE" : "void",
				"METHODOVERRIDE" : [ ],
				"OUTGOINGMETHOD" : [ {
					"CALLEECLASS" : "ComputerPart",
					"CALLEEMETHODNAME" : "accept"
				}, {
					"CALLEECLASS" : "ComputerPart",
					"CALLEEMETHODNAME" : "accept"
				} ],
				"NUMBEROFMETHODLINES" : 2,
				"METHODPARAMETER" : [ {
					"PARAMETERNAME" : "args",
					"PARAMETERTYPE" : "String[]"
				} ]
			} ]
		},
		"Keyboard" : {
			"FIELDDETAIL" : [ ],
			"CLASSORINTERFACEDETAIL" : [ {
				"CLASSACCESSSPECIFIER" : "PUBLIC",
				"NUMBEROFMETHODCALLS" : 1,
				"EXTENDSFROM" : [ "ComputerPart" ],
				"IMPLEMENTSFROM" : [ "ComputerPart" ],
				"CLASSNAME" : "Keyboard",
				"ISINTERFACEORNOT" : false,
				"CLASSTYPEPARAMS" : [ ],
				"ISABSTRACTORNOT" : false,
				"CLASSMODIFIERTYPE" : [ "public" ]
			} ],
			"CONSTRUCTORDETAIL" : [ ],
			"VARIABLEDETAIL" : [ ],
			"METHODDETAIL" : [ {
				"METHODNAME" : "accept",
				"NUMBEROFINCOMINGMETHODS" : 0,
				"INCOMINGMETHOD" : [ ],
				"METHODMODIFIERTYPE" : [ "public" ],
				"METHODBODYLINETYPE" : [ "EXPRESSION" ],
				"NUMBEROFMETHODVARIABLES" : 0,
				"NUMBEROFOUTGOINGMETHODS" : 1,
				"METHODRETURNTYPE" : "void",
				"METHODOVERRIDE" : [ "@Override" ],
				"OUTGOINGMETHOD" : [ {
					"CALLEECLASS" : "ComputerPartVisitor",
					"CALLEEMETHODNAME" : "visit"
				}, {
					"CALLEECLASS" : "ComputerPartVisitor",
					"CALLEEMETHODNAME" : "visit"
				} ],
				"NUMBEROFMETHODLINES" : 1,
				"METHODPARAMETER" : [ {
					"PARAMETERNAME" : "computerPartVisitor",
					"PARAMETERTYPE" : "ComputerPartVisitor"
				} ]
			} ]
		},
		"Computer" : {
			"FIELDDETAIL" : [ {
				"FIELDCOMMONTYPE" : "ComputerPart[]",
				"FIELDMODIFIERTYPE" : [ ],
				"FIELDDECLARATION" : [ "parts" ],
				"FIELDDATATYPE" : "ComputerPart",
				"FIELDACCESSSPECIFIER" : "NONE"
			} ],
			"CLASSORINTERFACEDETAIL" : [ {
				"CLASSACCESSSPECIFIER" : "PUBLIC",
				"NUMBEROFMETHODCALLS" : 2,
				"EXTENDSFROM" : [ "ComputerPart" ],
				"IMPLEMENTSFROM" : [ "ComputerPart" ],
				"CLASSNAME" : "Computer",
				"ISINTERFACEORNOT" : false,
				"CLASSTYPEPARAMS" : [ ],
				"ISABSTRACTORNOT" : false,
				"CLASSMODIFIERTYPE" : [ "public" ]
			} ],
			"CONSTRUCTORDETAIL" : [ {
				"CONSTRUCTORMODIFIER" : [ "public" ],
				"CONSTRUCTORPARAMETER" : [ ]
			} ],
			"VARIABLEDETAIL" : [ {
				"VARIABLEDECLARATION" : [ "i = 0" ],
				"VARIABLECOMMONTYPE" : "int",
				"VARIABLEELEMENTTYPE" : "int"
			} ],
			"METHODDETAIL" : [ {
				"METHODNAME" : "accept",
				"NUMBEROFINCOMINGMETHODS" : 0,
				"INCOMINGMETHOD" : [ ],
				"METHODMODIFIERTYPE" : [ "public" ],
				"METHODBODYLINETYPE" : [ "LOOP", "EXPRESSION" ],
				"NUMBEROFMETHODVARIABLES" : 0,
				"NUMBEROFOUTGOINGMETHODS" : 2,
				"METHODRETURNTYPE" : "void",
				"METHODOVERRIDE" : [ "@Override" ],
				"OUTGOINGMETHOD" : [ {
					"CALLEECLASS" : "ComputerPart",
					"CALLEEMETHODNAME" : "accept"
				}, {
					"CALLEECLASS" : "ComputerPartVisitor",
					"CALLEEMETHODNAME" : "visit"
				}, {
					"CALLEECLASS" : "ComputerPart",
					"CALLEEMETHODNAME" : "accept"
				}, {
					"CALLEECLASS" : "ComputerPartVisitor",
					"CALLEEMETHODNAME" : "visit"
				} ],
				"NUMBEROFMETHODLINES" : 2,
				"METHODPARAMETER" : [ {
					"PARAMETERNAME" : "computerPartVisitor",
					"PARAMETERTYPE" : "ComputerPartVisitor"
				} ]
			} ]
		},
		"ComputerPartVisitor" : {
			"FIELDDETAIL" : [ ],
			"CLASSORINTERFACEDETAIL" : [ {
				"CLASSACCESSSPECIFIER" : "PUBLIC",
				"NUMBEROFMETHODCALLS" : 0,
				"EXTENDSFROM" : [ ],
				"IMPLEMENTSFROM" : [ ],
				"CLASSNAME" : "ComputerPartVisitor",
				"ISINTERFACEORNOT" : true,
				"CLASSTYPEPARAMS" : [ ],
				"ISABSTRACTORNOT" : false,
				"CLASSMODIFIERTYPE" : [ "public" ]
			} ],
			"CONSTRUCTORDETAIL" : [ ],
			"VARIABLEDETAIL" : [ ],
			"METHODDETAIL" : [ {
				"METHODNAME" : "visit",
				"NUMBEROFINCOMINGMETHODS" : 8,
				"INCOMINGMETHOD" : [ {
					"CALLEDMETHODNAME" : "accept",
					"CALLEDCLASS" : "Mouse"
				}, {
					"CALLEDMETHODNAME" : "accept",
					"CALLEDCLASS" : "Keyboard"
				}, {
					"CALLEDMETHODNAME" : "accept",
					"CALLEDCLASS" : "Computer"
				}, {
					"CALLEDMETHODNAME" : "accept",
					"CALLEDCLASS" : "Monitor"
				}, {
					"CALLEDMETHODNAME" : "accept",
					"CALLEDCLASS" : "Mouse"
				}, {
					"CALLEDMETHODNAME" : "accept",
					"CALLEDCLASS" : "Computer"
				}, {
					"CALLEDMETHODNAME" : "accept",
					"CALLEDCLASS" : "Keyboard"
				}, {
					"CALLEDMETHODNAME" : "accept",
					"CALLEDCLASS" : "Monitor"
				} ],
				"METHODMODIFIERTYPE" : [ "public" ],
				"METHODBODYLINETYPE" : [ ],
				"NUMBEROFMETHODVARIABLES" : 0,
				"NUMBEROFOUTGOINGMETHODS" : 0,
				"METHODRETURNTYPE" : "void",
				"METHODOVERRIDE" : [ ],
				"OUTGOINGMETHOD" : [ ],
				"NUMBEROFMETHODLINES" : 0,
				"METHODPARAMETER" : [ {
					"PARAMETERNAME" : "computer",
					"PARAMETERTYPE" : "Computer"
				} ]
			}, {
				"METHODNAME" : "visit",
				"NUMBEROFINCOMINGMETHODS" : 8,
				"INCOMINGMETHOD" : [ {
					"CALLEDMETHODNAME" : "accept",
					"CALLEDCLASS" : "Mouse"
				}, {
					"CALLEDMETHODNAME" : "accept",
					"CALLEDCLASS" : "Keyboard"
				}, {
					"CALLEDMETHODNAME" : "accept",
					"CALLEDCLASS" : "Computer"
				}, {
					"CALLEDMETHODNAME" : "accept",
					"CALLEDCLASS" : "Monitor"
				}, {
					"CALLEDMETHODNAME" : "accept",
					"CALLEDCLASS" : "Mouse"
				}, {
					"CALLEDMETHODNAME" : "accept",
					"CALLEDCLASS" : "Computer"
				}, {
					"CALLEDMETHODNAME" : "accept",
					"CALLEDCLASS" : "Keyboard"
				}, {
					"CALLEDMETHODNAME" : "accept",
					"CALLEDCLASS" : "Monitor"
				} ],
				"METHODMODIFIERTYPE" : [ "public" ],
				"METHODBODYLINETYPE" : [ ],
				"NUMBEROFMETHODVARIABLES" : 0,
				"NUMBEROFOUTGOINGMETHODS" : 0,
				"METHODRETURNTYPE" : "void",
				"METHODOVERRIDE" : [ ],
				"OUTGOINGMETHOD" : [ ],
				"NUMBEROFMETHODLINES" : 0,
				"METHODPARAMETER" : [ {
					"PARAMETERNAME" : "mouse",
					"PARAMETERTYPE" : "Mouse"
				} ]
			}, {
				"METHODNAME" : "visit",
				"NUMBEROFINCOMINGMETHODS" : 8,
				"INCOMINGMETHOD" : [ {
					"CALLEDMETHODNAME" : "accept",
					"CALLEDCLASS" : "Mouse"
				}, {
					"CALLEDMETHODNAME" : "accept",
					"CALLEDCLASS" : "Keyboard"
				}, {
					"CALLEDMETHODNAME" : "accept",
					"CALLEDCLASS" : "Computer"
				}, {
					"CALLEDMETHODNAME" : "accept",
					"CALLEDCLASS" : "Monitor"
				}, {
					"CALLEDMETHODNAME" : "accept",
					"CALLEDCLASS" : "Mouse"
				}, {
					"CALLEDMETHODNAME" : "accept",
					"CALLEDCLASS" : "Computer"
				}, {
					"CALLEDMETHODNAME" : "accept",
					"CALLEDCLASS" : "Keyboard"
				}, {
					"CALLEDMETHODNAME" : "accept",
					"CALLEDCLASS" : "Monitor"
				} ],
				"METHODMODIFIERTYPE" : [ "public" ],
				"METHODBODYLINETYPE" : [ ],
				"NUMBEROFMETHODVARIABLES" : 0,
				"NUMBEROFOUTGOINGMETHODS" : 0,
				"METHODRETURNTYPE" : "void",
				"METHODOVERRIDE" : [ ],
				"OUTGOINGMETHOD" : [ ],
				"NUMBEROFMETHODLINES" : 0,
				"METHODPARAMETER" : [ {
					"PARAMETERNAME" : "keyboard",
					"PARAMETERTYPE" : "Keyboard"
				} ]
			}, {
				"METHODNAME" : "visit",
				"NUMBEROFINCOMINGMETHODS" : 8,
				"INCOMINGMETHOD" : [ {
					"CALLEDMETHODNAME" : "accept",
					"CALLEDCLASS" : "Mouse"
				}, {
					"CALLEDMETHODNAME" : "accept",
					"CALLEDCLASS" : "Keyboard"
				}, {
					"CALLEDMETHODNAME" : "accept",
					"CALLEDCLASS" : "Computer"
				}, {
					"CALLEDMETHODNAME" : "accept",
					"CALLEDCLASS" : "Monitor"
				}, {
					"CALLEDMETHODNAME" : "accept",
					"CALLEDCLASS" : "Mouse"
				}, {
					"CALLEDMETHODNAME" : "accept",
					"CALLEDCLASS" : "Computer"
				}, {
					"CALLEDMETHODNAME" : "accept",
					"CALLEDCLASS" : "Keyboard"
				}, {
					"CALLEDMETHODNAME" : "accept",
					"CALLEDCLASS" : "Monitor"
				} ],
				"METHODMODIFIERTYPE" : [ "public" ],
				"METHODBODYLINETYPE" : [ ],
				"NUMBEROFMETHODVARIABLES" : 0,
				"NUMBEROFOUTGOINGMETHODS" : 0,
				"METHODRETURNTYPE" : "void",
				"METHODOVERRIDE" : [ ],
				"OUTGOINGMETHOD" : [ ],
				"NUMBEROFMETHODLINES" : 0,
				"METHODPARAMETER" : [ {
					"PARAMETERNAME" : "monitor",
					"PARAMETERTYPE" : "Monitor"
				} ]
			} ]
		}
	},
	"final_summary" : "ComputerPart.java: visitor: ComputerPart acts as an element for visitor ComputerPart, which is inherited by Monitor, Mouse, Keyboard, Computer, which accepts ComputerPartVisitor parameter of computerPartVisitor. ComputerPart acts as a visitor for element ComputerPart, which is inherited by ComputerPartDisplayVisitor, which accepts ComputerPartVisitor parameter of computerPartVisitor. It is a public interface. The only method of ComputerPart is accept (void). 2 methods ( main method of class Test and accept method of class Computer ) call accept and accept calls no methods.\n\n\nMonitor.java: Monitor does not have any design pattern.  It is a public class that extends ComputerPart and that implements ComputerPart. The only method of Monitor is accept (void). No methods call accept and accept calls only one method : visit method of class ComputerPartVisitor.\n\n\nMouse.java: Mouse does not have any design pattern.  It is a public class that extends ComputerPart and that implements ComputerPart. The only method of Mouse is accept (void). No methods call accept and accept calls only one method : visit method of class ComputerPartVisitor.\n\n\nComputerPartDisplayVisitor.java: visitor: ComputerPartDisplayVisitor acts as a visitor for element ComputerPart, which overrides, which visits Computer parameter of computer, which visits Mouse parameter of mouse, which visits Keyboard parameter of keyboard, which visits Monitor parameter of monitor. It is a public class that extends ComputerPartVisitor and that implements ComputerPartVisitor. The 4 methods of ComputerPartDisplayVisitor are visit (void), visit (void), visit (void) and visit (void). No methods call visit and visit calls only one method : println method of class PrintStream. No methods call visit and visit calls only one method : println method of class PrintStream. No methods call visit and visit calls only one method : println method of class PrintStream. No methods call visit and visit calls only one method : println method of class PrintStream.\n\n\nTest.java: Test does not have any design pattern.  It is a public class. The only method of Test is main (void). No methods call main and main calls only one method : accept method of class ComputerPart.\n\n\nKeyboard.java: Keyboard does not have any design pattern.  It is a public class that extends ComputerPart and that implements ComputerPart. The only method of Keyboard is accept (void). No methods call accept and accept calls only one method : visit method of class ComputerPartVisitor.\n\n\nComputer.java: Computer does not have any design pattern.  It is a public class that extends ComputerPart and that implements ComputerPart. The only method of Computer is accept (void). No methods call accept and accept calls 2 methods : visit method of class ComputerPartVisitor and accept method of class ComputerPart.\n\n\nComputerPartVisitor.java: ComputerPartVisitor does not have any design pattern.  It is a public interface. The 4 methods of ComputerPartVisitor are visit (void), visit (void), visit (void) and visit (void). 4 methods ( accept method of class Keyboard, accept method of class Mouse, accept method of class Monitor and accept method of class Computer ) call visit and visit calls no methods. 4 methods ( accept method of class Keyboard, accept method of class Mouse, accept method of class Monitor and accept method of class Computer ) call visit and visit calls no methods. 4 methods ( accept method of class Keyboard, accept method of class Mouse, accept method of class Monitor and accept method of class Computer ) call visit and visit calls no methods. 4 methods ( accept method of class Keyboard, accept method of class Mouse, accept method of class Monitor and accept method of class Computer ) call visit and visit calls no methods.\n\n\n",
	"design_pattern" : [ {
		"visitor" : {
			"ComputerPart" : {
				"concrete_element" : [ "Monitor", "Mouse", "Keyboard", "Computer" ],
				"visitor" : {
					"ComputerPartVisitor" : [ "ComputerPartDisplayVisitor" ]
				}
			}
		}
	} ],
	"summary_NLG" : {
		"visitor" : {
			"ComputerPart" : [ "ComputerPart acts as an element for visitor ComputerPart, which is inherited by Monitor, Mouse, Keyboard, Computer, which accepts ComputerPartVisitor parameter of computerPartVisitor.", "ComputerPart acts as a visitor for element ComputerPart, which is inherited by ComputerPartDisplayVisitor, which accepts ComputerPartVisitor parameter of computerPartVisitor." ],
			"ComputerPartDisplayVisitor" : [ "ComputerPartDisplayVisitor acts as a visitor for element ComputerPart, which overrides, which visits Computer parameter of computer, which visits Mouse parameter of mouse, which visits Keyboard parameter of keyboard, which visits Monitor parameter of monitor." ]
		}
	}
}