{
	"final_summary" : "App.java: App does not have any design pattern.  It is a public class. The only method of App is main (void). No methods call main and main calls 3 methods : endDay method of class facade, digOutGold method of class facade and startNewDay method of class facade.\n\n\nDwarvenGoldDigger.java: DwarvenGoldDigger does not have any design pattern.  It is a public class that extends DwarvenMineWorker. The 2 methods of DwarvenGoldDigger are work (void) and name (String). No methods call work and work calls 2 methods : name method of class DwarvenGoldDigger and info method of class LOGGER. Only one method ( work method of class DwarvenGoldDigger ) calls name and name calls no methods.\n\n\nDwarvenMineWorker.java: DwarvenMineWorker does not have any design pattern.  It is a public abstract class. The 8 methods of DwarvenMineWorker are goToSleep (void), wakeUp (void), goHome (void), goToMine (void), action (void), action (void), work (void) and name (String). Only one method ( action method of class DwarvenMineWorker ) calls goToSleep and goToSleep calls 2 methods : name method of class DwarvenMineWorker and info method of class LOGGER. Only one method ( action method of class DwarvenMineWorker ) calls wakeUp and wakeUp calls 2 methods : name method of class DwarvenMineWorker and info method of class LOGGER. Only one method ( action method of class DwarvenMineWorker ) calls goHome and goHome calls 2 methods : name method of class DwarvenMineWorker and info method of class LOGGER. Only one method ( action method of class DwarvenMineWorker ) calls goToMine and goToMine calls 2 methods : name method of class DwarvenMineWorker and info method of class LOGGER. No methods call action and action calls 7 methods : goToMine method of class DwarvenMineWorker, forEach method of class Stream, goToSleep method of class DwarvenMineWorker, wakeUp method of class DwarvenMineWorker, goHome method of class DwarvenMineWorker, work method of class DwarvenMineWorker and stream method of class Arrays. No methods call action and action calls 7 methods : goToMine method of class DwarvenMineWorker, forEach method of class Stream, goToSleep method of class DwarvenMineWorker, wakeUp method of class DwarvenMineWorker, goHome method of class DwarvenMineWorker, work method of class DwarvenMineWorker and stream method of class Arrays. Only one method ( action method of class DwarvenMineWorker ) calls work and work calls no methods. 4 methods ( wakeUp method of class DwarvenMineWorker, goHome method of class DwarvenMineWorker, goToMine method of class DwarvenMineWorker and goToSleep method of class DwarvenMineWorker ) call name and name calls no methods.\n\n\nDwarvenTunnelDigger.java: DwarvenTunnelDigger does not have any design pattern.  It is a public class that extends DwarvenMineWorker. The 2 methods of DwarvenTunnelDigger are work (void) and name (String). No methods call work and work calls 2 methods : name method of class DwarvenTunnelDigger and info method of class LOGGER. Only one method ( work method of class DwarvenTunnelDigger ) calls name and name calls no methods.\n\n\nDwarvenCartOperator.java: DwarvenCartOperator does not have any design pattern.  It is a public class that extends DwarvenMineWorker. The 2 methods of DwarvenCartOperator are work (void) and name (String). No methods call work and work calls 2 methods : name method of class DwarvenCartOperator and info method of class LOGGER. Only one method ( work method of class DwarvenCartOperator ) calls name and name calls no methods.\n\n\nDwarvenGoldmineFacade.java: DwarvenGoldmineFacade does not have any design pattern.  It is a public class. The 4 methods of DwarvenGoldmineFacade are startNewDay (void), digOutGold (void), endDay (void) and makeActions (void). No methods call startNewDay and startNewDay calls only one method : makeActions method of class UNKNOWN. No methods call digOutGold and digOutGold calls only one method : makeActions method of class UNKNOWN. No methods call endDay and endDay calls only one method : makeActions method of class UNKNOWN. No methods call makeActions and makeActions calls 2 methods : action method of class worker and forEach method of class workers.\n\n\n",
	"design_pattern" : [ ],
	"iluwatar-facade" : {
		"App" : {
			"FIELDDETAIL" : [ ],
			"CLASSORINTERFACEDETAIL" : [ {
				"CLASSACCESSSPECIFIER" : "PUBLIC",
				"NUMBEROFMETHODCALLS" : 3,
				"EXTENDSFROM" : [ ],
				"IMPLEMENTSFROM" : [ ],
				"CLASSNAME" : "App",
				"ISINTERFACEORNOT" : false,
				"CLASSTYPEPARAMS" : [ ],
				"ISABSTRACTORNOT" : false,
				"CLASSMODIFIERTYPE" : [ "public" ]
			} ],
			"CONSTRUCTORDETAIL" : [ ],
			"VARIABLEDETAIL" : [ {
				"VARIABLEDECLARATION" : [ "facade = new DwarvenGoldmineFacade()" ],
				"VARIABLECOMMONTYPE" : "var",
				"VARIABLEELEMENTTYPE" : "var"
			} ],
			"METHODDETAIL" : [ {
				"METHODNAME" : "main",
				"NUMBEROFINCOMINGMETHODS" : 0,
				"INCOMINGMETHOD" : [ ],
				"METHODMODIFIERTYPE" : [ "public", "static" ],
				"METHODBODYLINETYPE" : [ "EXPRESSION", "EXPRESSION", "EXPRESSION", "EXPRESSION" ],
				"NUMBEROFMETHODVARIABLES" : 1,
				"NUMBEROFOUTGOINGMETHODS" : 3,
				"METHODRETURNTYPE" : "void",
				"METHODOVERRIDE" : [ ],
				"OUTGOINGMETHOD" : [ {
					"CALLEECLASS" : "facade",
					"CALLEEMETHODNAME" : "startNewDay"
				}, {
					"CALLEECLASS" : "facade",
					"CALLEEMETHODNAME" : "digOutGold"
				}, {
					"CALLEECLASS" : "facade",
					"CALLEEMETHODNAME" : "endDay"
				} ],
				"NUMBEROFMETHODLINES" : 4,
				"METHODPARAMETER" : [ {
					"PARAMETERNAME" : "args",
					"PARAMETERTYPE" : "String[]"
				} ]
			} ]
		},
		"DwarvenGoldDigger" : {
			"FIELDDETAIL" : [ ],
			"CLASSORINTERFACEDETAIL" : [ {
				"CLASSACCESSSPECIFIER" : "PUBLIC",
				"NUMBEROFMETHODCALLS" : 2,
				"EXTENDSFROM" : [ "DwarvenMineWorker" ],
				"IMPLEMENTSFROM" : [ ],
				"CLASSNAME" : "DwarvenGoldDigger",
				"ISINTERFACEORNOT" : false,
				"CLASSTYPEPARAMS" : [ ],
				"ISABSTRACTORNOT" : false,
				"CLASSMODIFIERTYPE" : [ "public" ]
			} ],
			"CONSTRUCTORDETAIL" : [ ],
			"VARIABLEDETAIL" : [ ],
			"METHODDETAIL" : [ {
				"METHODNAME" : "work",
				"NUMBEROFINCOMINGMETHODS" : 0,
				"INCOMINGMETHOD" : [ ],
				"METHODMODIFIERTYPE" : [ "public" ],
				"METHODBODYLINETYPE" : [ "EXPRESSION" ],
				"NUMBEROFMETHODVARIABLES" : 0,
				"NUMBEROFOUTGOINGMETHODS" : 2,
				"METHODRETURNTYPE" : "void",
				"METHODOVERRIDE" : [ "@Override" ],
				"OUTGOINGMETHOD" : [ {
					"CALLEECLASS" : "LOGGER",
					"CALLEEMETHODNAME" : "info"
				}, {
					"CALLEECLASS" : "DwarvenGoldDigger",
					"CALLEEMETHODNAME" : "name"
				} ],
				"NUMBEROFMETHODLINES" : 1,
				"METHODPARAMETER" : [ ]
			}, {
				"METHODNAME" : "name",
				"NUMBEROFINCOMINGMETHODS" : 1,
				"INCOMINGMETHOD" : [ {
					"CALLEDMETHODNAME" : "work",
					"CALLEDCLASS" : "DwarvenGoldDigger"
				} ],
				"METHODMODIFIERTYPE" : [ "public" ],
				"METHODBODYLINETYPE" : [ "RETURN" ],
				"NUMBEROFMETHODVARIABLES" : 0,
				"NUMBEROFOUTGOINGMETHODS" : 0,
				"METHODRETURNTYPE" : "String",
				"METHODOVERRIDE" : [ "@Override" ],
				"OUTGOINGMETHOD" : [ ],
				"NUMBEROFMETHODLINES" : 1,
				"METHODPARAMETER" : [ ]
			} ]
		},
		"DwarvenMineWorker" : {
			"FIELDDETAIL" : [ ],
			"CLASSORINTERFACEDETAIL" : [ {
				"CLASSACCESSSPECIFIER" : "PUBLIC",
				"NUMBEROFMETHODCALLS" : 16,
				"EXTENDSFROM" : [ ],
				"IMPLEMENTSFROM" : [ ],
				"CLASSNAME" : "DwarvenMineWorker",
				"ISINTERFACEORNOT" : false,
				"CLASSTYPEPARAMS" : [ ],
				"ISABSTRACTORNOT" : true,
				"CLASSMODIFIERTYPE" : [ "public", "abstract" ]
			} ],
			"CONSTRUCTORDETAIL" : [ ],
			"VARIABLEDETAIL" : [ ],
			"METHODDETAIL" : [ {
				"METHODNAME" : "goToSleep",
				"NUMBEROFINCOMINGMETHODS" : 2,
				"INCOMINGMETHOD" : [ {
					"CALLEDMETHODNAME" : "action",
					"CALLEDCLASS" : "DwarvenMineWorker"
				}, {
					"CALLEDMETHODNAME" : "action",
					"CALLEDCLASS" : "DwarvenMineWorker"
				} ],
				"METHODMODIFIERTYPE" : [ "public" ],
				"METHODBODYLINETYPE" : [ "EXPRESSION" ],
				"NUMBEROFMETHODVARIABLES" : 0,
				"NUMBEROFOUTGOINGMETHODS" : 2,
				"METHODRETURNTYPE" : "void",
				"METHODOVERRIDE" : [ ],
				"OUTGOINGMETHOD" : [ {
					"CALLEECLASS" : "LOGGER",
					"CALLEEMETHODNAME" : "info"
				}, {
					"CALLEECLASS" : "DwarvenMineWorker",
					"CALLEEMETHODNAME" : "name"
				} ],
				"NUMBEROFMETHODLINES" : 1,
				"METHODPARAMETER" : [ ]
			}, {
				"METHODNAME" : "wakeUp",
				"NUMBEROFINCOMINGMETHODS" : 2,
				"INCOMINGMETHOD" : [ {
					"CALLEDMETHODNAME" : "action",
					"CALLEDCLASS" : "DwarvenMineWorker"
				}, {
					"CALLEDMETHODNAME" : "action",
					"CALLEDCLASS" : "DwarvenMineWorker"
				} ],
				"METHODMODIFIERTYPE" : [ "public" ],
				"METHODBODYLINETYPE" : [ "EXPRESSION" ],
				"NUMBEROFMETHODVARIABLES" : 0,
				"NUMBEROFOUTGOINGMETHODS" : 2,
				"METHODRETURNTYPE" : "void",
				"METHODOVERRIDE" : [ ],
				"OUTGOINGMETHOD" : [ {
					"CALLEECLASS" : "LOGGER",
					"CALLEEMETHODNAME" : "info"
				}, {
					"CALLEECLASS" : "DwarvenMineWorker",
					"CALLEEMETHODNAME" : "name"
				} ],
				"NUMBEROFMETHODLINES" : 1,
				"METHODPARAMETER" : [ ]
			}, {
				"METHODNAME" : "goHome",
				"NUMBEROFINCOMINGMETHODS" : 2,
				"INCOMINGMETHOD" : [ {
					"CALLEDMETHODNAME" : "action",
					"CALLEDCLASS" : "DwarvenMineWorker"
				}, {
					"CALLEDMETHODNAME" : "action",
					"CALLEDCLASS" : "DwarvenMineWorker"
				} ],
				"METHODMODIFIERTYPE" : [ "public" ],
				"METHODBODYLINETYPE" : [ "EXPRESSION" ],
				"NUMBEROFMETHODVARIABLES" : 0,
				"NUMBEROFOUTGOINGMETHODS" : 2,
				"METHODRETURNTYPE" : "void",
				"METHODOVERRIDE" : [ ],
				"OUTGOINGMETHOD" : [ {
					"CALLEECLASS" : "LOGGER",
					"CALLEEMETHODNAME" : "info"
				}, {
					"CALLEECLASS" : "DwarvenMineWorker",
					"CALLEEMETHODNAME" : "name"
				} ],
				"NUMBEROFMETHODLINES" : 1,
				"METHODPARAMETER" : [ ]
			}, {
				"METHODNAME" : "goToMine",
				"NUMBEROFINCOMINGMETHODS" : 2,
				"INCOMINGMETHOD" : [ {
					"CALLEDMETHODNAME" : "action",
					"CALLEDCLASS" : "DwarvenMineWorker"
				}, {
					"CALLEDMETHODNAME" : "action",
					"CALLEDCLASS" : "DwarvenMineWorker"
				} ],
				"METHODMODIFIERTYPE" : [ "public" ],
				"METHODBODYLINETYPE" : [ "EXPRESSION" ],
				"NUMBEROFMETHODVARIABLES" : 0,
				"NUMBEROFOUTGOINGMETHODS" : 2,
				"METHODRETURNTYPE" : "void",
				"METHODOVERRIDE" : [ ],
				"OUTGOINGMETHOD" : [ {
					"CALLEECLASS" : "LOGGER",
					"CALLEEMETHODNAME" : "info"
				}, {
					"CALLEECLASS" : "DwarvenMineWorker",
					"CALLEEMETHODNAME" : "name"
				} ],
				"NUMBEROFMETHODLINES" : 1,
				"METHODPARAMETER" : [ ]
			}, {
				"METHODNAME" : "action",
				"NUMBEROFINCOMINGMETHODS" : 0,
				"INCOMINGMETHOD" : [ ],
				"METHODMODIFIERTYPE" : [ "private" ],
				"METHODBODYLINETYPE" : [ "SWITCH" ],
				"NUMBEROFMETHODVARIABLES" : 0,
				"NUMBEROFOUTGOINGMETHODS" : 6,
				"METHODRETURNTYPE" : "void",
				"METHODOVERRIDE" : [ ],
				"OUTGOINGMETHOD" : [ {
					"CALLEECLASS" : "DwarvenMineWorker",
					"CALLEEMETHODNAME" : "goToSleep"
				}, {
					"CALLEECLASS" : "DwarvenMineWorker",
					"CALLEEMETHODNAME" : "wakeUp"
				}, {
					"CALLEECLASS" : "DwarvenMineWorker",
					"CALLEEMETHODNAME" : "goHome"
				}, {
					"CALLEECLASS" : "DwarvenMineWorker",
					"CALLEEMETHODNAME" : "goToMine"
				}, {
					"CALLEECLASS" : "DwarvenMineWorker",
					"CALLEEMETHODNAME" : "work"
				}, {
					"CALLEECLASS" : "Stream",
					"CALLEEMETHODNAME" : "forEach"
				}, {
					"CALLEECLASS" : "Arrays",
					"CALLEEMETHODNAME" : "stream"
				} ],
				"NUMBEROFMETHODLINES" : 1,
				"METHODPARAMETER" : [ {
					"PARAMETERNAME" : "action",
					"PARAMETERTYPE" : "Action"
				} ]
			}, {
				"METHODNAME" : "action",
				"NUMBEROFINCOMINGMETHODS" : 0,
				"INCOMINGMETHOD" : [ ],
				"METHODMODIFIERTYPE" : [ "public" ],
				"METHODBODYLINETYPE" : [ "EXPRESSION" ],
				"NUMBEROFMETHODVARIABLES" : 0,
				"NUMBEROFOUTGOINGMETHODS" : 2,
				"METHODRETURNTYPE" : "void",
				"METHODOVERRIDE" : [ ],
				"OUTGOINGMETHOD" : [ {
					"CALLEECLASS" : "DwarvenMineWorker",
					"CALLEEMETHODNAME" : "goToSleep"
				}, {
					"CALLEECLASS" : "DwarvenMineWorker",
					"CALLEEMETHODNAME" : "wakeUp"
				}, {
					"CALLEECLASS" : "DwarvenMineWorker",
					"CALLEEMETHODNAME" : "goHome"
				}, {
					"CALLEECLASS" : "DwarvenMineWorker",
					"CALLEEMETHODNAME" : "goToMine"
				}, {
					"CALLEECLASS" : "DwarvenMineWorker",
					"CALLEEMETHODNAME" : "work"
				}, {
					"CALLEECLASS" : "Stream",
					"CALLEEMETHODNAME" : "forEach"
				}, {
					"CALLEECLASS" : "Arrays",
					"CALLEEMETHODNAME" : "stream"
				} ],
				"NUMBEROFMETHODLINES" : 1,
				"METHODPARAMETER" : [ {
					"PARAMETERNAME" : "actions",
					"PARAMETERTYPE" : "Action..."
				} ]
			}, {
				"METHODNAME" : "work",
				"NUMBEROFINCOMINGMETHODS" : 2,
				"INCOMINGMETHOD" : [ {
					"CALLEDMETHODNAME" : "action",
					"CALLEDCLASS" : "DwarvenMineWorker"
				}, {
					"CALLEDMETHODNAME" : "action",
					"CALLEDCLASS" : "DwarvenMineWorker"
				} ],
				"METHODMODIFIERTYPE" : [ "public", "abstract" ],
				"METHODBODYLINETYPE" : [ ],
				"NUMBEROFMETHODVARIABLES" : 0,
				"NUMBEROFOUTGOINGMETHODS" : 0,
				"METHODRETURNTYPE" : "void",
				"METHODOVERRIDE" : [ ],
				"OUTGOINGMETHOD" : [ ],
				"NUMBEROFMETHODLINES" : 0,
				"METHODPARAMETER" : [ ]
			}, {
				"METHODNAME" : "name",
				"NUMBEROFINCOMINGMETHODS" : 4,
				"INCOMINGMETHOD" : [ {
					"CALLEDMETHODNAME" : "wakeUp",
					"CALLEDCLASS" : "DwarvenMineWorker"
				}, {
					"CALLEDMETHODNAME" : "goToMine",
					"CALLEDCLASS" : "DwarvenMineWorker"
				}, {
					"CALLEDMETHODNAME" : "goToSleep",
					"CALLEDCLASS" : "DwarvenMineWorker"
				}, {
					"CALLEDMETHODNAME" : "goHome",
					"CALLEDCLASS" : "DwarvenMineWorker"
				} ],
				"METHODMODIFIERTYPE" : [ "public", "abstract" ],
				"METHODBODYLINETYPE" : [ ],
				"NUMBEROFMETHODVARIABLES" : 0,
				"NUMBEROFOUTGOINGMETHODS" : 0,
				"METHODRETURNTYPE" : "String",
				"METHODOVERRIDE" : [ ],
				"OUTGOINGMETHOD" : [ ],
				"NUMBEROFMETHODLINES" : 0,
				"METHODPARAMETER" : [ ]
			} ]
		},
		"DwarvenTunnelDigger" : {
			"FIELDDETAIL" : [ ],
			"CLASSORINTERFACEDETAIL" : [ {
				"CLASSACCESSSPECIFIER" : "PUBLIC",
				"NUMBEROFMETHODCALLS" : 2,
				"EXTENDSFROM" : [ "DwarvenMineWorker" ],
				"IMPLEMENTSFROM" : [ ],
				"CLASSNAME" : "DwarvenTunnelDigger",
				"ISINTERFACEORNOT" : false,
				"CLASSTYPEPARAMS" : [ ],
				"ISABSTRACTORNOT" : false,
				"CLASSMODIFIERTYPE" : [ "public" ]
			} ],
			"CONSTRUCTORDETAIL" : [ ],
			"VARIABLEDETAIL" : [ ],
			"METHODDETAIL" : [ {
				"METHODNAME" : "work",
				"NUMBEROFINCOMINGMETHODS" : 0,
				"INCOMINGMETHOD" : [ ],
				"METHODMODIFIERTYPE" : [ "public" ],
				"METHODBODYLINETYPE" : [ "EXPRESSION" ],
				"NUMBEROFMETHODVARIABLES" : 0,
				"NUMBEROFOUTGOINGMETHODS" : 2,
				"METHODRETURNTYPE" : "void",
				"METHODOVERRIDE" : [ "@Override" ],
				"OUTGOINGMETHOD" : [ {
					"CALLEECLASS" : "LOGGER",
					"CALLEEMETHODNAME" : "info"
				}, {
					"CALLEECLASS" : "DwarvenTunnelDigger",
					"CALLEEMETHODNAME" : "name"
				} ],
				"NUMBEROFMETHODLINES" : 1,
				"METHODPARAMETER" : [ ]
			}, {
				"METHODNAME" : "name",
				"NUMBEROFINCOMINGMETHODS" : 1,
				"INCOMINGMETHOD" : [ {
					"CALLEDMETHODNAME" : "work",
					"CALLEDCLASS" : "DwarvenTunnelDigger"
				} ],
				"METHODMODIFIERTYPE" : [ "public" ],
				"METHODBODYLINETYPE" : [ "RETURN" ],
				"NUMBEROFMETHODVARIABLES" : 0,
				"NUMBEROFOUTGOINGMETHODS" : 0,
				"METHODRETURNTYPE" : "String",
				"METHODOVERRIDE" : [ "@Override" ],
				"OUTGOINGMETHOD" : [ ],
				"NUMBEROFMETHODLINES" : 1,
				"METHODPARAMETER" : [ ]
			} ]
		},
		"DwarvenCartOperator" : {
			"FIELDDETAIL" : [ ],
			"CLASSORINTERFACEDETAIL" : [ {
				"CLASSACCESSSPECIFIER" : "PUBLIC",
				"NUMBEROFMETHODCALLS" : 2,
				"EXTENDSFROM" : [ "DwarvenMineWorker" ],
				"IMPLEMENTSFROM" : [ ],
				"CLASSNAME" : "DwarvenCartOperator",
				"ISINTERFACEORNOT" : false,
				"CLASSTYPEPARAMS" : [ ],
				"ISABSTRACTORNOT" : false,
				"CLASSMODIFIERTYPE" : [ "public" ]
			} ],
			"CONSTRUCTORDETAIL" : [ ],
			"VARIABLEDETAIL" : [ ],
			"METHODDETAIL" : [ {
				"METHODNAME" : "work",
				"NUMBEROFINCOMINGMETHODS" : 0,
				"INCOMINGMETHOD" : [ ],
				"METHODMODIFIERTYPE" : [ "public" ],
				"METHODBODYLINETYPE" : [ "EXPRESSION" ],
				"NUMBEROFMETHODVARIABLES" : 0,
				"NUMBEROFOUTGOINGMETHODS" : 2,
				"METHODRETURNTYPE" : "void",
				"METHODOVERRIDE" : [ "@Override" ],
				"OUTGOINGMETHOD" : [ {
					"CALLEECLASS" : "LOGGER",
					"CALLEEMETHODNAME" : "info"
				}, {
					"CALLEECLASS" : "DwarvenCartOperator",
					"CALLEEMETHODNAME" : "name"
				} ],
				"NUMBEROFMETHODLINES" : 1,
				"METHODPARAMETER" : [ ]
			}, {
				"METHODNAME" : "name",
				"NUMBEROFINCOMINGMETHODS" : 1,
				"INCOMINGMETHOD" : [ {
					"CALLEDMETHODNAME" : "work",
					"CALLEDCLASS" : "DwarvenCartOperator"
				} ],
				"METHODMODIFIERTYPE" : [ "public" ],
				"METHODBODYLINETYPE" : [ "RETURN" ],
				"NUMBEROFMETHODVARIABLES" : 0,
				"NUMBEROFOUTGOINGMETHODS" : 0,
				"METHODRETURNTYPE" : "String",
				"METHODOVERRIDE" : [ "@Override" ],
				"OUTGOINGMETHOD" : [ ],
				"NUMBEROFMETHODLINES" : 1,
				"METHODPARAMETER" : [ ]
			} ]
		},
		"DwarvenGoldmineFacade" : {
			"FIELDDETAIL" : [ {
				"FIELDCOMMONTYPE" : "List<DwarvenMineWorker>",
				"FIELDMODIFIERTYPE" : [ "private", "final" ],
				"FIELDDECLARATION" : [ "workers" ],
				"FIELDDATATYPE" : "List<DwarvenMineWorker>",
				"FIELDACCESSSPECIFIER" : "PRIVATE"
			} ],
			"CLASSORINTERFACEDETAIL" : [ {
				"CLASSACCESSSPECIFIER" : "PUBLIC",
				"NUMBEROFMETHODCALLS" : 6,
				"EXTENDSFROM" : [ ],
				"IMPLEMENTSFROM" : [ ],
				"CLASSNAME" : "DwarvenGoldmineFacade",
				"ISINTERFACEORNOT" : false,
				"CLASSTYPEPARAMS" : [ ],
				"ISABSTRACTORNOT" : false,
				"CLASSMODIFIERTYPE" : [ "public" ]
			} ],
			"CONSTRUCTORDETAIL" : [ {
				"CONSTRUCTORMODIFIER" : [ "public" ],
				"CONSTRUCTORPARAMETER" : [ ]
			} ],
			"VARIABLEDETAIL" : [ ],
			"METHODDETAIL" : [ {
				"METHODNAME" : "startNewDay",
				"NUMBEROFINCOMINGMETHODS" : 0,
				"INCOMINGMETHOD" : [ ],
				"METHODMODIFIERTYPE" : [ "public" ],
				"METHODBODYLINETYPE" : [ "EXPRESSION" ],
				"NUMBEROFMETHODVARIABLES" : 0,
				"NUMBEROFOUTGOINGMETHODS" : 1,
				"METHODRETURNTYPE" : "void",
				"METHODOVERRIDE" : [ ],
				"OUTGOINGMETHOD" : [ {
					"CALLEECLASS" : "UNKNOWN",
					"CALLEEMETHODNAME" : "makeActions"
				} ],
				"NUMBEROFMETHODLINES" : 1,
				"METHODPARAMETER" : [ ]
			}, {
				"METHODNAME" : "digOutGold",
				"NUMBEROFINCOMINGMETHODS" : 0,
				"INCOMINGMETHOD" : [ ],
				"METHODMODIFIERTYPE" : [ "public" ],
				"METHODBODYLINETYPE" : [ "EXPRESSION" ],
				"NUMBEROFMETHODVARIABLES" : 0,
				"NUMBEROFOUTGOINGMETHODS" : 1,
				"METHODRETURNTYPE" : "void",
				"METHODOVERRIDE" : [ ],
				"OUTGOINGMETHOD" : [ {
					"CALLEECLASS" : "UNKNOWN",
					"CALLEEMETHODNAME" : "makeActions"
				} ],
				"NUMBEROFMETHODLINES" : 1,
				"METHODPARAMETER" : [ ]
			}, {
				"METHODNAME" : "endDay",
				"NUMBEROFINCOMINGMETHODS" : 0,
				"INCOMINGMETHOD" : [ ],
				"METHODMODIFIERTYPE" : [ "public" ],
				"METHODBODYLINETYPE" : [ "EXPRESSION" ],
				"NUMBEROFMETHODVARIABLES" : 0,
				"NUMBEROFOUTGOINGMETHODS" : 1,
				"METHODRETURNTYPE" : "void",
				"METHODOVERRIDE" : [ ],
				"OUTGOINGMETHOD" : [ {
					"CALLEECLASS" : "UNKNOWN",
					"CALLEEMETHODNAME" : "makeActions"
				} ],
				"NUMBEROFMETHODLINES" : 1,
				"METHODPARAMETER" : [ ]
			}, {
				"METHODNAME" : "makeActions",
				"NUMBEROFINCOMINGMETHODS" : 0,
				"INCOMINGMETHOD" : [ ],
				"METHODMODIFIERTYPE" : [ "private", "static" ],
				"METHODBODYLINETYPE" : [ "EXPRESSION" ],
				"NUMBEROFMETHODVARIABLES" : 0,
				"NUMBEROFOUTGOINGMETHODS" : 2,
				"METHODRETURNTYPE" : "void",
				"METHODOVERRIDE" : [ ],
				"OUTGOINGMETHOD" : [ {
					"CALLEECLASS" : "workers",
					"CALLEEMETHODNAME" : "forEach"
				}, {
					"CALLEECLASS" : "worker",
					"CALLEEMETHODNAME" : "action"
				} ],
				"NUMBEROFMETHODLINES" : 1,
				"METHODPARAMETER" : [ {
					"PARAMETERNAME" : "workers",
					"PARAMETERTYPE" : "Collection<DwarvenMineWorker>"
				}, {
					"PARAMETERNAME" : "actions",
					"PARAMETERTYPE" : "DwarvenMineWorker.Action..."
				} ]
			} ]
		}
	},
	"summary_NLG" : { }
}