{
	"final_summary" : "Flower.java: observer: Flower acts as a publisher for observer FlowerType, which is inherited by, which grows, which gets Memento, which sets Plant parameter of plant Memento, which tos String, which gets Name, which gets Weight, which gets Height, which gets Type, which sets FlowerType parameter of type Type, which sets int parameter of height Height, which sets int parameter of weight Weight, which gets Weight, which gets Height, which gets Type. It is a public class that extends Plant and that implements Plant. The 14 methods of Flower are growing (void), getMemento (FlowerMemento), setMemento (void), toString (String), getName (String), getWeight (int), getHeight (int), getType (FlowerType), setType (void), setHeight (void), setWeight (void), getWeight (int), getHeight (int) and getType (FlowerType). No methods call growing and growing calls 5 methods : getHeight method of class Flower, setHeight method of class Flower, setType method of class UNKNOWN, getWeight method of class Flower and setWeight method of class Flower. No methods call getMemento and getMemento calls 3 methods : getHeight method of class Flower, getWeight method of class Flower and getType method of class Flower. No methods call setMemento and setMemento calls 6 methods : setHeight method of class Flower, getType method of class FlowerMemento, setType method of class UNKNOWN, getHeight method of class FlowerMemento, setWeight method of class Flower and getWeight method of class FlowerMemento. No methods call toString and toString calls 5 methods : format method of class String, getName method of class Flower, getHeight method of class Flower, getWeight method of class Flower and getType method of class Flower. Only one method ( toString method of class Flower ) calls getName and getName calls no methods. 3 methods ( toString method of class Flower, getMemento method of class Flower and growing method of class Flower ) call getWeight and getWeight calls no methods. 3 methods ( toString method of class Flower, getMemento method of class Flower and growing method of class Flower ) call getHeight and getHeight calls no methods. 2 methods ( toString method of class Flower and getMemento method of class Flower ) call getType and getType calls no methods. No methods call setType and setType calls no methods. 2 methods ( setMemento method of class Flower and growing method of class Flower ) call setHeight and setHeight calls no methods. 2 methods ( setMemento method of class Flower and growing method of class Flower ) call setWeight and setWeight calls no methods. 3 methods ( toString method of class Flower, getMemento method of class Flower and growing method of class Flower ) call getWeight and getWeight calls no methods. 3 methods ( toString method of class Flower, getMemento method of class Flower and growing method of class Flower ) call getHeight and getHeight calls no methods. 2 methods ( toString method of class Flower and getMemento method of class Flower ) call getType and getType calls no methods.\n\n abstract_factory: Flower acts as a factory for Plant, which overrides getWeight method of Plant, getHeight method of Plant, getType method of Plant, getWeight method of Plant, getHeight method of Plant, getType method of Plant. It is a public class that extends Plant and that implements Plant. The 14 methods of Flower are growing (void), getMemento (FlowerMemento), setMemento (void), toString (String), getName (String), getWeight (int), getHeight (int), getType (FlowerType), setType (void), setHeight (void), setWeight (void), getWeight (int), getHeight (int) and getType (FlowerType). No methods call growing and growing calls 5 methods : getHeight method of class Flower, setHeight method of class Flower, setType method of class UNKNOWN, getWeight method of class Flower and setWeight method of class Flower. No methods call getMemento and getMemento calls 3 methods : getHeight method of class Flower, getWeight method of class Flower and getType method of class Flower. No methods call setMemento and setMemento calls 6 methods : setHeight method of class Flower, getType method of class FlowerMemento, setType method of class UNKNOWN, getHeight method of class FlowerMemento, setWeight method of class Flower and getWeight method of class FlowerMemento. No methods call toString and toString calls 5 methods : format method of class String, getName method of class Flower, getHeight method of class Flower, getWeight method of class Flower and getType method of class Flower. Only one method ( toString method of class Flower ) calls getName and getName calls no methods. 3 methods ( toString method of class Flower, getMemento method of class Flower and growing method of class Flower ) call getWeight and getWeight calls no methods. 3 methods ( toString method of class Flower, getMemento method of class Flower and growing method of class Flower ) call getHeight and getHeight calls no methods. 2 methods ( toString method of class Flower and getMemento method of class Flower ) call getType and getType calls no methods. No methods call setType and setType calls no methods. 2 methods ( setMemento method of class Flower and growing method of class Flower ) call setHeight and setHeight calls no methods. 2 methods ( setMemento method of class Flower and growing method of class Flower ) call setWeight and setWeight calls no methods. 3 methods ( toString method of class Flower, getMemento method of class Flower and growing method of class Flower ) call getWeight and getWeight calls no methods. 3 methods ( toString method of class Flower, getMemento method of class Flower and growing method of class Flower ) call getHeight and getHeight calls no methods. 2 methods ( toString method of class Flower and getMemento method of class Flower ) call getType and getType calls no methods.\n\n\nPlant.java: abstract_factory: Plant acts as an abstract factory for, which is inherited by Flower. It is a public interface. The 3 methods of Plant are getWeight (int), getHeight (int) and getType (FlowerType). No methods call getWeight and getWeight calls no methods. No methods call getHeight and getHeight calls no methods. No methods call getType and getType calls no methods.\n\n\nApplication.java: Application does not have any design pattern.  It is a public class. The only method of Application is main (void). No methods call main and main calls 8 methods : pop method of class stack, size method of class stack, toString method of class flower, setMemento method of class flower, add method of class stack, info method of class LOGGER, getMemento method of class flower and growing method of class flower.\n\n\n",
	"design_pattern" : [ {
		"abstract_factory" : {
			"Plant" : {
				"abstract_product" : { },
				"concrete_factory" : [ "Flower" ]
			}
		}
	}, {
		"observer" : {
			"FlowerType" : {
				"concrete_observer" : [ ],
				"publisher" : {
					"Flower" : [ ]
				}
			}
		}
	} ],
	"summary_NLG" : {
		"observer" : {
			"Flower" : [ "Flower acts as a publisher for observer FlowerType, which is inherited by, which grows, which gets Memento, which sets Plant parameter of plant Memento, which tos String, which gets Name, which gets Weight, which gets Height, which gets Type, which sets FlowerType parameter of type Type, which sets int parameter of height Height, which sets int parameter of weight Weight, which gets Weight, which gets Height, which gets Type." ],
			"FlowerType" : [ "FlowerType acts as an observer for publisher Flower, which is inherited by, which tos String." ]
		},
		"abstract_factory" : {
			"Flower" : [ "Flower acts as a factory for Plant, which overrides getWeight method of Plant, getHeight method of Plant, getType method of Plant, getWeight method of Plant, getHeight method of Plant, getType method of Plant." ],
			"Plant" : [ "Plant acts as an abstract factory for, which is inherited by Flower." ]
		}
	},
	"JamesZBL-memento" : {
		"Flower" : {
			"FIELDDETAIL" : [ {
				"FIELDCOMMONTYPE" : "FlowerType",
				"FIELDMODIFIERTYPE" : [ "private" ],
				"FIELDDECLARATION" : [ "type" ],
				"FIELDDATATYPE" : "FlowerType",
				"FIELDACCESSSPECIFIER" : "PRIVATE"
			}, {
				"FIELDCOMMONTYPE" : "String",
				"FIELDMODIFIERTYPE" : [ "private", "final" ],
				"FIELDDECLARATION" : [ "name" ],
				"FIELDDATATYPE" : "String",
				"FIELDACCESSSPECIFIER" : "PRIVATE"
			}, {
				"FIELDCOMMONTYPE" : "int",
				"FIELDMODIFIERTYPE" : [ "private" ],
				"FIELDDECLARATION" : [ "height" ],
				"FIELDDATATYPE" : "int",
				"FIELDACCESSSPECIFIER" : "PRIVATE"
			}, {
				"FIELDCOMMONTYPE" : "int",
				"FIELDMODIFIERTYPE" : [ "private" ],
				"FIELDDECLARATION" : [ "weight" ],
				"FIELDDATATYPE" : "int",
				"FIELDACCESSSPECIFIER" : "PRIVATE"
			}, {
				"FIELDCOMMONTYPE" : "FlowerType",
				"FIELDMODIFIERTYPE" : [ "private" ],
				"FIELDDECLARATION" : [ "type" ],
				"FIELDDATATYPE" : "FlowerType",
				"FIELDACCESSSPECIFIER" : "PRIVATE"
			}, {
				"FIELDCOMMONTYPE" : "int",
				"FIELDMODIFIERTYPE" : [ "private" ],
				"FIELDDECLARATION" : [ "height" ],
				"FIELDDATATYPE" : "int",
				"FIELDACCESSSPECIFIER" : "PRIVATE"
			}, {
				"FIELDCOMMONTYPE" : "int",
				"FIELDMODIFIERTYPE" : [ "private" ],
				"FIELDDECLARATION" : [ "weight" ],
				"FIELDDATATYPE" : "int",
				"FIELDACCESSSPECIFIER" : "PRIVATE"
			} ],
			"CLASSORINTERFACEDETAIL" : [ {
				"CLASSACCESSSPECIFIER" : "PUBLIC",
				"NUMBEROFMETHODCALLS" : 24,
				"EXTENDSFROM" : [ "Plant" ],
				"IMPLEMENTSFROM" : [ "Plant" ],
				"CLASSNAME" : "Flower",
				"ISINTERFACEORNOT" : false,
				"CLASSTYPEPARAMS" : [ ],
				"ISABSTRACTORNOT" : false,
				"CLASSMODIFIERTYPE" : [ "public" ]
			} ],
			"CONSTRUCTORDETAIL" : [ {
				"CONSTRUCTORMODIFIER" : [ "public" ],
				"CONSTRUCTORPARAMETER" : [ {
					"PARAMETERNAME" : "type",
					"PARAMETERTYPE" : "FlowerType"
				}, {
					"PARAMETERNAME" : "name",
					"PARAMETERTYPE" : "String"
				}, {
					"PARAMETERNAME" : "height",
					"PARAMETERTYPE" : "int"
				}, {
					"PARAMETERNAME" : "weight",
					"PARAMETERTYPE" : "int"
				} ]
			}, {
				"CONSTRUCTORMODIFIER" : [ "private" ],
				"CONSTRUCTORPARAMETER" : [ {
					"PARAMETERNAME" : "type",
					"PARAMETERTYPE" : "FlowerType"
				}, {
					"PARAMETERNAME" : "height",
					"PARAMETERTYPE" : "int"
				}, {
					"PARAMETERNAME" : "weight",
					"PARAMETERTYPE" : "int"
				} ]
			} ],
			"VARIABLEDETAIL" : [ {
				"VARIABLEDECLARATION" : [ "flowerMemento = (FlowerMemento) plant" ],
				"VARIABLECOMMONTYPE" : "FlowerMemento",
				"VARIABLEELEMENTTYPE" : "FlowerMemento"
			} ],
			"METHODDETAIL" : [ {
				"METHODNAME" : "growing",
				"NUMBEROFINCOMINGMETHODS" : 0,
				"INCOMINGMETHOD" : [ ],
				"METHODMODIFIERTYPE" : [ "public" ],
				"METHODBODYLINETYPE" : [ "EXPRESSION", "EXPRESSION", "SWITCH" ],
				"NUMBEROFMETHODVARIABLES" : 0,
				"NUMBEROFOUTGOINGMETHODS" : 10,
				"METHODRETURNTYPE" : "void",
				"METHODOVERRIDE" : [ ],
				"OUTGOINGMETHOD" : [ {
					"CALLEECLASS" : "Flower",
					"CALLEEMETHODNAME" : "setWeight"
				}, {
					"CALLEECLASS" : "Flower",
					"CALLEEMETHODNAME" : "getWeight"
				}, {
					"CALLEECLASS" : "Flower",
					"CALLEEMETHODNAME" : "setHeight"
				}, {
					"CALLEECLASS" : "Flower",
					"CALLEEMETHODNAME" : "getHeight"
				}, {
					"CALLEECLASS" : "Flower",
					"CALLEEMETHODNAME" : "setHeight"
				}, {
					"CALLEECLASS" : "Flower",
					"CALLEEMETHODNAME" : "setWeight"
				}, {
					"CALLEECLASS" : "Flower",
					"CALLEEMETHODNAME" : "setWeight"
				}, {
					"CALLEECLASS" : "Flower",
					"CALLEEMETHODNAME" : "getWeight"
				}, {
					"CALLEECLASS" : "Flower",
					"CALLEEMETHODNAME" : "setHeight"
				}, {
					"CALLEECLASS" : "Flower",
					"CALLEEMETHODNAME" : "getHeight"
				}, {
					"CALLEECLASS" : "UNKNOWN",
					"CALLEEMETHODNAME" : "setType"
				}, {
					"CALLEECLASS" : "UNKNOWN",
					"CALLEEMETHODNAME" : "setType"
				}, {
					"CALLEECLASS" : "UNKNOWN",
					"CALLEEMETHODNAME" : "setType"
				}, {
					"CALLEECLASS" : "UNKNOWN",
					"CALLEEMETHODNAME" : "setType"
				}, {
					"CALLEECLASS" : "Flower",
					"CALLEEMETHODNAME" : "setHeight"
				}, {
					"CALLEECLASS" : "Flower",
					"CALLEEMETHODNAME" : "setWeight"
				} ],
				"NUMBEROFMETHODLINES" : 3,
				"METHODPARAMETER" : [ ]
			}, {
				"METHODNAME" : "getMemento",
				"NUMBEROFINCOMINGMETHODS" : 0,
				"INCOMINGMETHOD" : [ ],
				"METHODMODIFIERTYPE" : [ ],
				"METHODBODYLINETYPE" : [ "RETURN" ],
				"NUMBEROFMETHODVARIABLES" : 0,
				"NUMBEROFOUTGOINGMETHODS" : 3,
				"METHODRETURNTYPE" : "FlowerMemento",
				"METHODOVERRIDE" : [ ],
				"OUTGOINGMETHOD" : [ {
					"CALLEECLASS" : "Flower",
					"CALLEEMETHODNAME" : "getType"
				}, {
					"CALLEECLASS" : "Flower",
					"CALLEEMETHODNAME" : "getHeight"
				}, {
					"CALLEECLASS" : "Flower",
					"CALLEEMETHODNAME" : "getWeight"
				}, {
					"CALLEECLASS" : "Flower",
					"CALLEEMETHODNAME" : "getType"
				}, {
					"CALLEECLASS" : "Flower",
					"CALLEEMETHODNAME" : "getHeight"
				}, {
					"CALLEECLASS" : "Flower",
					"CALLEEMETHODNAME" : "getWeight"
				} ],
				"NUMBEROFMETHODLINES" : 1,
				"METHODPARAMETER" : [ ]
			}, {
				"METHODNAME" : "setMemento",
				"NUMBEROFINCOMINGMETHODS" : 0,
				"INCOMINGMETHOD" : [ ],
				"METHODMODIFIERTYPE" : [ ],
				"METHODBODYLINETYPE" : [ "EXPRESSION", "EXPRESSION", "EXPRESSION", "EXPRESSION" ],
				"NUMBEROFMETHODVARIABLES" : 1,
				"NUMBEROFOUTGOINGMETHODS" : 6,
				"METHODRETURNTYPE" : "void",
				"METHODOVERRIDE" : [ ],
				"OUTGOINGMETHOD" : [ {
					"CALLEECLASS" : "UNKNOWN",
					"CALLEEMETHODNAME" : "setType"
				}, {
					"CALLEECLASS" : "FlowerMemento",
					"CALLEEMETHODNAME" : "getType"
				}, {
					"CALLEECLASS" : "Flower",
					"CALLEEMETHODNAME" : "setHeight"
				}, {
					"CALLEECLASS" : "FlowerMemento",
					"CALLEEMETHODNAME" : "getHeight"
				}, {
					"CALLEECLASS" : "Flower",
					"CALLEEMETHODNAME" : "setWeight"
				}, {
					"CALLEECLASS" : "FlowerMemento",
					"CALLEEMETHODNAME" : "getWeight"
				} ],
				"NUMBEROFMETHODLINES" : 4,
				"METHODPARAMETER" : [ {
					"PARAMETERNAME" : "plant",
					"PARAMETERTYPE" : "Plant"
				} ]
			}, {
				"METHODNAME" : "toString",
				"NUMBEROFINCOMINGMETHODS" : 0,
				"INCOMINGMETHOD" : [ ],
				"METHODMODIFIERTYPE" : [ "public" ],
				"METHODBODYLINETYPE" : [ "RETURN" ],
				"NUMBEROFMETHODVARIABLES" : 0,
				"NUMBEROFOUTGOINGMETHODS" : 5,
				"METHODRETURNTYPE" : "String",
				"METHODOVERRIDE" : [ "@Override" ],
				"OUTGOINGMETHOD" : [ {
					"CALLEECLASS" : "Flower",
					"CALLEEMETHODNAME" : "getName"
				}, {
					"CALLEECLASS" : "Flower",
					"CALLEEMETHODNAME" : "getType"
				}, {
					"CALLEECLASS" : "Flower",
					"CALLEEMETHODNAME" : "getWeight"
				}, {
					"CALLEECLASS" : "Flower",
					"CALLEEMETHODNAME" : "getHeight"
				}, {
					"CALLEECLASS" : "String",
					"CALLEEMETHODNAME" : "format"
				}, {
					"CALLEECLASS" : "Flower",
					"CALLEEMETHODNAME" : "getName"
				}, {
					"CALLEECLASS" : "Flower",
					"CALLEEMETHODNAME" : "getType"
				}, {
					"CALLEECLASS" : "Flower",
					"CALLEEMETHODNAME" : "getWeight"
				}, {
					"CALLEECLASS" : "Flower",
					"CALLEEMETHODNAME" : "getHeight"
				} ],
				"NUMBEROFMETHODLINES" : 1,
				"METHODPARAMETER" : [ ]
			}, {
				"METHODNAME" : "getName",
				"NUMBEROFINCOMINGMETHODS" : 2,
				"INCOMINGMETHOD" : [ {
					"CALLEDMETHODNAME" : "toString",
					"CALLEDCLASS" : "Flower"
				}, {
					"CALLEDMETHODNAME" : "toString",
					"CALLEDCLASS" : "Flower"
				} ],
				"METHODMODIFIERTYPE" : [ "public" ],
				"METHODBODYLINETYPE" : [ "RETURN" ],
				"NUMBEROFMETHODVARIABLES" : 0,
				"NUMBEROFOUTGOINGMETHODS" : 0,
				"METHODRETURNTYPE" : "String",
				"METHODOVERRIDE" : [ ],
				"OUTGOINGMETHOD" : [ ],
				"NUMBEROFMETHODLINES" : 1,
				"METHODPARAMETER" : [ ]
			}, {
				"METHODNAME" : "getWeight",
				"NUMBEROFINCOMINGMETHODS" : 6,
				"INCOMINGMETHOD" : [ {
					"CALLEDMETHODNAME" : "growing",
					"CALLEDCLASS" : "Flower"
				}, {
					"CALLEDMETHODNAME" : "getMemento",
					"CALLEDCLASS" : "Flower"
				}, {
					"CALLEDMETHODNAME" : "growing",
					"CALLEDCLASS" : "Flower"
				}, {
					"CALLEDMETHODNAME" : "toString",
					"CALLEDCLASS" : "Flower"
				}, {
					"CALLEDMETHODNAME" : "toString",
					"CALLEDCLASS" : "Flower"
				}, {
					"CALLEDMETHODNAME" : "getMemento",
					"CALLEDCLASS" : "Flower"
				} ],
				"METHODMODIFIERTYPE" : [ "public" ],
				"METHODBODYLINETYPE" : [ "RETURN" ],
				"NUMBEROFMETHODVARIABLES" : 0,
				"NUMBEROFOUTGOINGMETHODS" : 0,
				"METHODRETURNTYPE" : "int",
				"METHODOVERRIDE" : [ "@Override" ],
				"OUTGOINGMETHOD" : [ ],
				"NUMBEROFMETHODLINES" : 1,
				"METHODPARAMETER" : [ ]
			}, {
				"METHODNAME" : "getHeight",
				"NUMBEROFINCOMINGMETHODS" : 6,
				"INCOMINGMETHOD" : [ {
					"CALLEDMETHODNAME" : "growing",
					"CALLEDCLASS" : "Flower"
				}, {
					"CALLEDMETHODNAME" : "getMemento",
					"CALLEDCLASS" : "Flower"
				}, {
					"CALLEDMETHODNAME" : "growing",
					"CALLEDCLASS" : "Flower"
				}, {
					"CALLEDMETHODNAME" : "toString",
					"CALLEDCLASS" : "Flower"
				}, {
					"CALLEDMETHODNAME" : "toString",
					"CALLEDCLASS" : "Flower"
				}, {
					"CALLEDMETHODNAME" : "getMemento",
					"CALLEDCLASS" : "Flower"
				} ],
				"METHODMODIFIERTYPE" : [ "public" ],
				"METHODBODYLINETYPE" : [ "RETURN" ],
				"NUMBEROFMETHODVARIABLES" : 0,
				"NUMBEROFOUTGOINGMETHODS" : 0,
				"METHODRETURNTYPE" : "int",
				"METHODOVERRIDE" : [ "@Override" ],
				"OUTGOINGMETHOD" : [ ],
				"NUMBEROFMETHODLINES" : 1,
				"METHODPARAMETER" : [ ]
			}, {
				"METHODNAME" : "getType",
				"NUMBEROFINCOMINGMETHODS" : 4,
				"INCOMINGMETHOD" : [ {
					"CALLEDMETHODNAME" : "getMemento",
					"CALLEDCLASS" : "Flower"
				}, {
					"CALLEDMETHODNAME" : "toString",
					"CALLEDCLASS" : "Flower"
				}, {
					"CALLEDMETHODNAME" : "toString",
					"CALLEDCLASS" : "Flower"
				}, {
					"CALLEDMETHODNAME" : "getMemento",
					"CALLEDCLASS" : "Flower"
				} ],
				"METHODMODIFIERTYPE" : [ "public" ],
				"METHODBODYLINETYPE" : [ "RETURN" ],
				"NUMBEROFMETHODVARIABLES" : 0,
				"NUMBEROFOUTGOINGMETHODS" : 0,
				"METHODRETURNTYPE" : "FlowerType",
				"METHODOVERRIDE" : [ "@Override" ],
				"OUTGOINGMETHOD" : [ ],
				"NUMBEROFMETHODLINES" : 1,
				"METHODPARAMETER" : [ ]
			}, {
				"METHODNAME" : "setType",
				"NUMBEROFINCOMINGMETHODS" : 0,
				"INCOMINGMETHOD" : [ ],
				"METHODMODIFIERTYPE" : [ "public" ],
				"METHODBODYLINETYPE" : [ "EXPRESSION" ],
				"NUMBEROFMETHODVARIABLES" : 0,
				"NUMBEROFOUTGOINGMETHODS" : 0,
				"METHODRETURNTYPE" : "void",
				"METHODOVERRIDE" : [ ],
				"OUTGOINGMETHOD" : [ ],
				"NUMBEROFMETHODLINES" : 1,
				"METHODPARAMETER" : [ {
					"PARAMETERNAME" : "type",
					"PARAMETERTYPE" : "FlowerType"
				} ]
			}, {
				"METHODNAME" : "setHeight",
				"NUMBEROFINCOMINGMETHODS" : 5,
				"INCOMINGMETHOD" : [ {
					"CALLEDMETHODNAME" : "setMemento",
					"CALLEDCLASS" : "Flower"
				}, {
					"CALLEDMETHODNAME" : "growing",
					"CALLEDCLASS" : "Flower"
				}, {
					"CALLEDMETHODNAME" : "growing",
					"CALLEDCLASS" : "Flower"
				}, {
					"CALLEDMETHODNAME" : "growing",
					"CALLEDCLASS" : "Flower"
				}, {
					"CALLEDMETHODNAME" : "growing",
					"CALLEDCLASS" : "Flower"
				} ],
				"METHODMODIFIERTYPE" : [ "public" ],
				"METHODBODYLINETYPE" : [ "EXPRESSION" ],
				"NUMBEROFMETHODVARIABLES" : 0,
				"NUMBEROFOUTGOINGMETHODS" : 0,
				"METHODRETURNTYPE" : "void",
				"METHODOVERRIDE" : [ ],
				"OUTGOINGMETHOD" : [ ],
				"NUMBEROFMETHODLINES" : 1,
				"METHODPARAMETER" : [ {
					"PARAMETERNAME" : "height",
					"PARAMETERTYPE" : "int"
				} ]
			}, {
				"METHODNAME" : "setWeight",
				"NUMBEROFINCOMINGMETHODS" : 5,
				"INCOMINGMETHOD" : [ {
					"CALLEDMETHODNAME" : "setMemento",
					"CALLEDCLASS" : "Flower"
				}, {
					"CALLEDMETHODNAME" : "growing",
					"CALLEDCLASS" : "Flower"
				}, {
					"CALLEDMETHODNAME" : "growing",
					"CALLEDCLASS" : "Flower"
				}, {
					"CALLEDMETHODNAME" : "growing",
					"CALLEDCLASS" : "Flower"
				}, {
					"CALLEDMETHODNAME" : "growing",
					"CALLEDCLASS" : "Flower"
				} ],
				"METHODMODIFIERTYPE" : [ "public" ],
				"METHODBODYLINETYPE" : [ "EXPRESSION" ],
				"NUMBEROFMETHODVARIABLES" : 0,
				"NUMBEROFOUTGOINGMETHODS" : 0,
				"METHODRETURNTYPE" : "void",
				"METHODOVERRIDE" : [ ],
				"OUTGOINGMETHOD" : [ ],
				"NUMBEROFMETHODLINES" : 1,
				"METHODPARAMETER" : [ {
					"PARAMETERNAME" : "weight",
					"PARAMETERTYPE" : "int"
				} ]
			}, {
				"METHODNAME" : "getWeight",
				"NUMBEROFINCOMINGMETHODS" : 6,
				"INCOMINGMETHOD" : [ {
					"CALLEDMETHODNAME" : "growing",
					"CALLEDCLASS" : "Flower"
				}, {
					"CALLEDMETHODNAME" : "getMemento",
					"CALLEDCLASS" : "Flower"
				}, {
					"CALLEDMETHODNAME" : "growing",
					"CALLEDCLASS" : "Flower"
				}, {
					"CALLEDMETHODNAME" : "toString",
					"CALLEDCLASS" : "Flower"
				}, {
					"CALLEDMETHODNAME" : "toString",
					"CALLEDCLASS" : "Flower"
				}, {
					"CALLEDMETHODNAME" : "getMemento",
					"CALLEDCLASS" : "Flower"
				} ],
				"METHODMODIFIERTYPE" : [ "public" ],
				"METHODBODYLINETYPE" : [ "RETURN" ],
				"NUMBEROFMETHODVARIABLES" : 0,
				"NUMBEROFOUTGOINGMETHODS" : 0,
				"METHODRETURNTYPE" : "int",
				"METHODOVERRIDE" : [ "@Override" ],
				"OUTGOINGMETHOD" : [ ],
				"NUMBEROFMETHODLINES" : 1,
				"METHODPARAMETER" : [ ]
			}, {
				"METHODNAME" : "getHeight",
				"NUMBEROFINCOMINGMETHODS" : 6,
				"INCOMINGMETHOD" : [ {
					"CALLEDMETHODNAME" : "growing",
					"CALLEDCLASS" : "Flower"
				}, {
					"CALLEDMETHODNAME" : "getMemento",
					"CALLEDCLASS" : "Flower"
				}, {
					"CALLEDMETHODNAME" : "growing",
					"CALLEDCLASS" : "Flower"
				}, {
					"CALLEDMETHODNAME" : "toString",
					"CALLEDCLASS" : "Flower"
				}, {
					"CALLEDMETHODNAME" : "toString",
					"CALLEDCLASS" : "Flower"
				}, {
					"CALLEDMETHODNAME" : "getMemento",
					"CALLEDCLASS" : "Flower"
				} ],
				"METHODMODIFIERTYPE" : [ "public" ],
				"METHODBODYLINETYPE" : [ "RETURN" ],
				"NUMBEROFMETHODVARIABLES" : 0,
				"NUMBEROFOUTGOINGMETHODS" : 0,
				"METHODRETURNTYPE" : "int",
				"METHODOVERRIDE" : [ "@Override" ],
				"OUTGOINGMETHOD" : [ ],
				"NUMBEROFMETHODLINES" : 1,
				"METHODPARAMETER" : [ ]
			}, {
				"METHODNAME" : "getType",
				"NUMBEROFINCOMINGMETHODS" : 4,
				"INCOMINGMETHOD" : [ {
					"CALLEDMETHODNAME" : "getMemento",
					"CALLEDCLASS" : "Flower"
				}, {
					"CALLEDMETHODNAME" : "toString",
					"CALLEDCLASS" : "Flower"
				}, {
					"CALLEDMETHODNAME" : "toString",
					"CALLEDCLASS" : "Flower"
				}, {
					"CALLEDMETHODNAME" : "getMemento",
					"CALLEDCLASS" : "Flower"
				} ],
				"METHODMODIFIERTYPE" : [ "public" ],
				"METHODBODYLINETYPE" : [ "RETURN" ],
				"NUMBEROFMETHODVARIABLES" : 0,
				"NUMBEROFOUTGOINGMETHODS" : 0,
				"METHODRETURNTYPE" : "FlowerType",
				"METHODOVERRIDE" : [ "@Override" ],
				"OUTGOINGMETHOD" : [ ],
				"NUMBEROFMETHODLINES" : 1,
				"METHODPARAMETER" : [ ]
			} ]
		},
		"Plant" : {
			"FIELDDETAIL" : [ ],
			"CLASSORINTERFACEDETAIL" : [ {
				"CLASSACCESSSPECIFIER" : "PUBLIC",
				"NUMBEROFMETHODCALLS" : 0,
				"EXTENDSFROM" : [ ],
				"IMPLEMENTSFROM" : [ ],
				"CLASSNAME" : "Plant",
				"ISINTERFACEORNOT" : true,
				"CLASSTYPEPARAMS" : [ ],
				"ISABSTRACTORNOT" : false,
				"CLASSMODIFIERTYPE" : [ "public" ]
			} ],
			"CONSTRUCTORDETAIL" : [ ],
			"VARIABLEDETAIL" : [ ],
			"METHODDETAIL" : [ {
				"METHODNAME" : "getWeight",
				"NUMBEROFINCOMINGMETHODS" : 0,
				"INCOMINGMETHOD" : [ ],
				"METHODMODIFIERTYPE" : [ ],
				"METHODBODYLINETYPE" : [ ],
				"NUMBEROFMETHODVARIABLES" : 0,
				"NUMBEROFOUTGOINGMETHODS" : 0,
				"METHODRETURNTYPE" : "int",
				"METHODOVERRIDE" : [ ],
				"OUTGOINGMETHOD" : [ ],
				"NUMBEROFMETHODLINES" : 0,
				"METHODPARAMETER" : [ ]
			}, {
				"METHODNAME" : "getHeight",
				"NUMBEROFINCOMINGMETHODS" : 0,
				"INCOMINGMETHOD" : [ ],
				"METHODMODIFIERTYPE" : [ ],
				"METHODBODYLINETYPE" : [ ],
				"NUMBEROFMETHODVARIABLES" : 0,
				"NUMBEROFOUTGOINGMETHODS" : 0,
				"METHODRETURNTYPE" : "int",
				"METHODOVERRIDE" : [ ],
				"OUTGOINGMETHOD" : [ ],
				"NUMBEROFMETHODLINES" : 0,
				"METHODPARAMETER" : [ ]
			}, {
				"METHODNAME" : "getType",
				"NUMBEROFINCOMINGMETHODS" : 0,
				"INCOMINGMETHOD" : [ ],
				"METHODMODIFIERTYPE" : [ ],
				"METHODBODYLINETYPE" : [ ],
				"NUMBEROFMETHODVARIABLES" : 0,
				"NUMBEROFOUTGOINGMETHODS" : 0,
				"METHODRETURNTYPE" : "FlowerType",
				"METHODOVERRIDE" : [ ],
				"OUTGOINGMETHOD" : [ ],
				"NUMBEROFMETHODLINES" : 0,
				"METHODPARAMETER" : [ ]
			} ]
		},
		"FlowerType" : {
			"FIELDDETAIL" : [ {
				"FIELDCOMMONTYPE" : "String",
				"FIELDMODIFIERTYPE" : [ "private" ],
				"FIELDDECLARATION" : [ "name" ],
				"FIELDDATATYPE" : "String",
				"FIELDACCESSSPECIFIER" : "PRIVATE"
			} ],
			"CLASSORINTERFACEDETAIL" : [ ],
			"CONSTRUCTORDETAIL" : [ {
				"CONSTRUCTORMODIFIER" : [ ],
				"CONSTRUCTORPARAMETER" : [ {
					"PARAMETERNAME" : "name",
					"PARAMETERTYPE" : "String"
				} ]
			} ],
			"VARIABLEDETAIL" : [ ],
			"METHODDETAIL" : [ {
				"METHODNAME" : "toString",
				"NUMBEROFINCOMINGMETHODS" : 0,
				"INCOMINGMETHOD" : [ ],
				"METHODMODIFIERTYPE" : [ "public" ],
				"METHODBODYLINETYPE" : [ "RETURN" ],
				"NUMBEROFMETHODVARIABLES" : 0,
				"NUMBEROFOUTGOINGMETHODS" : 0,
				"METHODRETURNTYPE" : "String",
				"METHODOVERRIDE" : [ "@Override" ],
				"OUTGOINGMETHOD" : [ ],
				"NUMBEROFMETHODLINES" : 1,
				"METHODPARAMETER" : [ ]
			} ]
		},
		"Application" : {
			"FIELDDETAIL" : [ {
				"FIELDCOMMONTYPE" : "Logger",
				"FIELDMODIFIERTYPE" : [ "private", "static", "final" ],
				"FIELDDECLARATION" : [ "LOGGER = LoggerFactory.getLogger(Application.class)" ],
				"FIELDDATATYPE" : "Logger",
				"FIELDACCESSSPECIFIER" : "PRIVATE"
			} ],
			"CLASSORINTERFACEDETAIL" : [ {
				"CLASSACCESSSPECIFIER" : "PUBLIC",
				"NUMBEROFMETHODCALLS" : 35,
				"EXTENDSFROM" : [ ],
				"IMPLEMENTSFROM" : [ ],
				"CLASSNAME" : "Application",
				"ISINTERFACEORNOT" : false,
				"CLASSTYPEPARAMS" : [ ],
				"ISABSTRACTORNOT" : false,
				"CLASSMODIFIERTYPE" : [ "public" ]
			} ],
			"CONSTRUCTORDETAIL" : [ ],
			"VARIABLEDETAIL" : [ {
				"VARIABLEDECLARATION" : [ "stack = new Stack<>()" ],
				"VARIABLECOMMONTYPE" : "Stack<Plant>",
				"VARIABLEELEMENTTYPE" : "Stack<Plant>"
			}, {
				"VARIABLEDECLARATION" : [ "flower = new Flower(FlowerType.SEED, \"水仙花\", 1, 2)" ],
				"VARIABLECOMMONTYPE" : "Flower",
				"VARIABLEELEMENTTYPE" : "Flower"
			} ],
			"METHODDETAIL" : [ {
				"METHODNAME" : "main",
				"NUMBEROFINCOMINGMETHODS" : 0,
				"INCOMINGMETHOD" : [ ],
				"METHODMODIFIERTYPE" : [ "public", "static" ],
				"METHODBODYLINETYPE" : [ "EXPRESSION", "EXPRESSION", "EXPRESSION", "EXPRESSION", "EXPRESSION", "EXPRESSION", "EXPRESSION", "EXPRESSION", "EXPRESSION", "EXPRESSION", "EXPRESSION", "EXPRESSION", "EXPRESSION", "EXPRESSION", "EXPRESSION", "EXPRESSION", "EXPRESSION", "EXPRESSION", "EXPRESSION", "LOOP" ],
				"NUMBEROFMETHODVARIABLES" : 2,
				"NUMBEROFOUTGOINGMETHODS" : 34,
				"METHODRETURNTYPE" : "void",
				"METHODOVERRIDE" : [ ],
				"OUTGOINGMETHOD" : [ {
					"CALLEECLASS" : "stack",
					"CALLEEMETHODNAME" : "add"
				}, {
					"CALLEECLASS" : "flower",
					"CALLEEMETHODNAME" : "getMemento"
				}, {
					"CALLEECLASS" : "LOGGER",
					"CALLEEMETHODNAME" : "info"
				}, {
					"CALLEECLASS" : "flower",
					"CALLEEMETHODNAME" : "toString"
				}, {
					"CALLEECLASS" : "flower",
					"CALLEEMETHODNAME" : "growing"
				}, {
					"CALLEECLASS" : "stack",
					"CALLEEMETHODNAME" : "add"
				}, {
					"CALLEECLASS" : "flower",
					"CALLEEMETHODNAME" : "getMemento"
				}, {
					"CALLEECLASS" : "LOGGER",
					"CALLEEMETHODNAME" : "info"
				}, {
					"CALLEECLASS" : "flower",
					"CALLEEMETHODNAME" : "toString"
				}, {
					"CALLEECLASS" : "flower",
					"CALLEEMETHODNAME" : "growing"
				}, {
					"CALLEECLASS" : "stack",
					"CALLEEMETHODNAME" : "add"
				}, {
					"CALLEECLASS" : "flower",
					"CALLEEMETHODNAME" : "getMemento"
				}, {
					"CALLEECLASS" : "LOGGER",
					"CALLEEMETHODNAME" : "info"
				}, {
					"CALLEECLASS" : "flower",
					"CALLEEMETHODNAME" : "toString"
				}, {
					"CALLEECLASS" : "flower",
					"CALLEEMETHODNAME" : "growing"
				}, {
					"CALLEECLASS" : "stack",
					"CALLEEMETHODNAME" : "add"
				}, {
					"CALLEECLASS" : "flower",
					"CALLEEMETHODNAME" : "getMemento"
				}, {
					"CALLEECLASS" : "LOGGER",
					"CALLEEMETHODNAME" : "info"
				}, {
					"CALLEECLASS" : "flower",
					"CALLEEMETHODNAME" : "toString"
				}, {
					"CALLEECLASS" : "flower",
					"CALLEEMETHODNAME" : "growing"
				}, {
					"CALLEECLASS" : "stack",
					"CALLEEMETHODNAME" : "add"
				}, {
					"CALLEECLASS" : "flower",
					"CALLEEMETHODNAME" : "getMemento"
				}, {
					"CALLEECLASS" : "LOGGER",
					"CALLEEMETHODNAME" : "info"
				}, {
					"CALLEECLASS" : "flower",
					"CALLEEMETHODNAME" : "toString"
				}, {
					"CALLEECLASS" : "flower",
					"CALLEEMETHODNAME" : "growing"
				}, {
					"CALLEECLASS" : "stack",
					"CALLEEMETHODNAME" : "add"
				}, {
					"CALLEECLASS" : "flower",
					"CALLEEMETHODNAME" : "getMemento"
				}, {
					"CALLEECLASS" : "LOGGER",
					"CALLEEMETHODNAME" : "info"
				}, {
					"CALLEECLASS" : "flower",
					"CALLEEMETHODNAME" : "toString"
				}, {
					"CALLEECLASS" : "stack",
					"CALLEEMETHODNAME" : "size"
				}, {
					"CALLEECLASS" : "flower",
					"CALLEEMETHODNAME" : "setMemento"
				}, {
					"CALLEECLASS" : "stack",
					"CALLEEMETHODNAME" : "pop"
				}, {
					"CALLEECLASS" : "LOGGER",
					"CALLEEMETHODNAME" : "info"
				}, {
					"CALLEECLASS" : "flower",
					"CALLEEMETHODNAME" : "toString"
				} ],
				"NUMBEROFMETHODLINES" : 20,
				"METHODPARAMETER" : [ {
					"PARAMETERNAME" : "args",
					"PARAMETERTYPE" : "String[]"
				} ]
			} ]
		}
	}
}