{
	"final_summary" : "Variable.java: Variable does not have any design pattern.  It is a public class that extends Expression. The only method of Variable is aceptar (void). No methods call aceptar and aceptar calls only one method : visitVariable method of class v.\n\n\nSecurityControlClient.java: SecurityControlClient does not have any design pattern.  It is a public class. The only method of SecurityControlClient is main (void). No methods call main and main calls 3 methods : accept method of class p, asList method of class Arrays and println method of class PrintStream.\n\n\nConstant.java: Constant does not have any design pattern.  It is a public class that extends Expression. The only method of Constant is aceptar (void). No methods call aceptar and aceptar calls only one method : visitConstant method of class v.\n\n\nSum.java: Sum does not have any design pattern.  It is a public class that extends OpBinary. The only method of Sum is aceptar (void). No methods call aceptar and aceptar calls only one method : visitSum method of class v.\n\n\nVisitorExpression.java: VisitorExpression does not have any design pattern.  It is a public class. The 6 methods of VisitorExpression are visitVariable (void), visitConstant (void), visitOpBinary (void), visitSum (void), visitMult (void) and obtenerResultado (String). No methods call visitVariable and visitVariable calls no methods. No methods call visitConstant and visitConstant calls only one method : valueOf method of class String. No methods call visitOpBinary and visitOpBinary calls 3 methods : aceptar method of class _der, aceptar method of class _izq and obtenerResultado method of class VisitorExpression. No methods call visitSum and visitSum calls only one method : visitOpBinary method of class UNKNOWN. No methods call visitMult and visitMult calls only one method : visitOpBinary method of class UNKNOWN. Only one method ( visitOpBinary method of class VisitorExpression ) calls obtenerResultado and obtenerResultado calls no methods.\n\n\nPoliceOfficer.java: PoliceOfficer does not have any design pattern.  It is a public class. The 4 methods of PoliceOfficer are visit (boolean), checkIdentification (boolean), checkBelongings (boolean) and visit (boolean). No methods call visit and visit calls 5 methods : checkBelongings method of class UNKNOWN, getVisa method of class passenger, getBelongings method of class passenger, getPassport method of class passenger and checkIdentification method of class UNKNOWN. No methods call checkIdentification and checkIdentification calls only one method : equals method of class String. No methods call checkBelongings and checkBelongings calls only one method : contains method of class List. No methods call visit and visit calls 5 methods : checkBelongings method of class UNKNOWN, getVisa method of class passenger, getBelongings method of class passenger, getPassport method of class passenger and checkIdentification method of class UNKNOWN.\n\n\nOpBinary.java: OpBinary does not have any design pattern.  It is a public abstract class that extends Expression.\nMult.java: Mult does not have any design pattern.  It is a public class that extends OpBinary. The only method of Mult is aceptar (void). No methods call aceptar and aceptar calls only one method : visitMult method of class v.\n\n\nExpression.java: Expression does not have any design pattern.  It is a public abstract class. The only method of Expression is aceptar (void). No methods call aceptar and aceptar calls no methods.\n\n\nPassenger.java: Passenger does not have any design pattern.  It is a public interface. The only method of Passenger is accept (boolean). No methods call accept and accept calls no methods.\n\n\nInternationalPassenger.java: InternationalPassenger does not have any design pattern.  It is a public class that implements Passenger. The 4 methods of InternationalPassenger are getPassport (String), getVisa (Boolean), getBelongings (List<String>) and accept (boolean). No methods call getPassport and getPassport calls no methods. No methods call getVisa and getVisa calls no methods. No methods call getBelongings and getBelongings calls no methods. No methods call accept and accept calls only one method : visit method of class visitor.\n\n\nNationalPassenger.java: NationalPassenger does not have any design pattern.  It is a public class that implements Passenger. The 3 methods of NationalPassenger are getIdentityDocument (String), getBelongings (List<String>) and accept (boolean). No methods call getIdentityDocument and getIdentityDocument calls no methods. No methods call getBelongings and getBelongings calls no methods. No methods call accept and accept calls only one method : visit method of class visitor.\n\n\nClient.java: Client does not have any design pattern.  It is a public class. The only method of Client is main (void). No methods call main and main calls 3 methods : aceptar method of class expresion, obtenerResultado method of class expr and println method of class out.\n\n\n",
	"design_pattern" : [ ],
	"luisburgos-visitor-examples" : {
		"Variable" : {
			"FIELDDETAIL" : [ {
				"FIELDCOMMONTYPE" : "String",
				"FIELDMODIFIERTYPE" : [ ],
				"FIELDDECLARATION" : [ "_variable" ],
				"FIELDDATATYPE" : "String",
				"FIELDACCESSSPECIFIER" : "NONE"
			} ],
			"CLASSORINTERFACEDETAIL" : [ {
				"CLASSACCESSSPECIFIER" : "PUBLIC",
				"NUMBEROFMETHODCALLS" : 1,
				"EXTENDSFROM" : [ "Expression" ],
				"IMPLEMENTSFROM" : [ ],
				"CLASSNAME" : "Variable",
				"ISINTERFACEORNOT" : false,
				"CLASSTYPEPARAMS" : [ ],
				"ISABSTRACTORNOT" : false,
				"CLASSMODIFIERTYPE" : [ "public" ]
			} ],
			"CONSTRUCTORDETAIL" : [ {
				"CONSTRUCTORMODIFIER" : [ "public" ],
				"CONSTRUCTORPARAMETER" : [ {
					"PARAMETERNAME" : "variable",
					"PARAMETERTYPE" : "String"
				} ]
			} ],
			"VARIABLEDETAIL" : [ ],
			"METHODDETAIL" : [ {
				"METHODNAME" : "aceptar",
				"NUMBEROFINCOMINGMETHODS" : 0,
				"INCOMINGMETHOD" : [ ],
				"METHODMODIFIERTYPE" : [ "public" ],
				"METHODBODYLINETYPE" : [ "EXPRESSION" ],
				"NUMBEROFMETHODVARIABLES" : 0,
				"NUMBEROFOUTGOINGMETHODS" : 1,
				"METHODRETURNTYPE" : "void",
				"METHODOVERRIDE" : [ ],
				"OUTGOINGMETHOD" : [ {
					"CALLEECLASS" : "v",
					"CALLEEMETHODNAME" : "visitVariable"
				} ],
				"NUMBEROFMETHODLINES" : 1,
				"METHODPARAMETER" : [ {
					"PARAMETERNAME" : "v",
					"PARAMETERTYPE" : "VisitorExpression"
				} ]
			} ]
		},
		"SecurityControlClient" : {
			"FIELDDETAIL" : [ ],
			"CLASSORINTERFACEDETAIL" : [ {
				"CLASSACCESSSPECIFIER" : "PUBLIC",
				"NUMBEROFMETHODCALLS" : 7,
				"EXTENDSFROM" : [ ],
				"IMPLEMENTSFROM" : [ ],
				"CLASSNAME" : "SecurityControlClient",
				"ISINTERFACEORNOT" : false,
				"CLASSTYPEPARAMS" : [ ],
				"ISABSTRACTORNOT" : false,
				"CLASSMODIFIERTYPE" : [ "public" ]
			} ],
			"CONSTRUCTORDETAIL" : [ ],
			"VARIABLEDETAIL" : [ {
				"VARIABLEDECLARATION" : [ "passengers = new Passenger[] { new NationalPassenger(\"45874005H\", Arrays.asList(\"Coins\", \"Bag\", \"Sun glasses\")), new NationalPassenger(null, Collections.EMPTY_LIST), new InternationalPassenger(\"4A4585BC\", true, Arrays.asList(\"Cap\", \"False beard\", \"Gun\")), new InternationalPassenger(\"11AB8564\", false, Arrays.asList(\"Suitcase\", \"Coat\")), new InternationalPassenger(\"269LZF74\", false, Arrays.asList(\"Liquids\")) }" ],
				"VARIABLECOMMONTYPE" : "Passenger[]",
				"VARIABLEELEMENTTYPE" : "Passenger"
			}, {
				"VARIABLEDECLARATION" : [ "officer = new PoliceOfficer()" ],
				"VARIABLECOMMONTYPE" : "PoliceOfficer",
				"VARIABLEELEMENTTYPE" : "PoliceOfficer"
			}, {
				"VARIABLEDECLARATION" : [ "p" ],
				"VARIABLECOMMONTYPE" : "Passenger",
				"VARIABLEELEMENTTYPE" : "Passenger"
			} ],
			"METHODDETAIL" : [ {
				"METHODNAME" : "main",
				"NUMBEROFINCOMINGMETHODS" : 0,
				"INCOMINGMETHOD" : [ ],
				"METHODMODIFIERTYPE" : [ "public", "static" ],
				"METHODBODYLINETYPE" : [ "EXPRESSION", "EXPRESSION", "LOOP" ],
				"NUMBEROFMETHODVARIABLES" : 2,
				"NUMBEROFOUTGOINGMETHODS" : 7,
				"METHODRETURNTYPE" : "void",
				"METHODOVERRIDE" : [ ],
				"OUTGOINGMETHOD" : [ {
					"CALLEECLASS" : "Arrays",
					"CALLEEMETHODNAME" : "asList"
				}, {
					"CALLEECLASS" : "Arrays",
					"CALLEEMETHODNAME" : "asList"
				}, {
					"CALLEECLASS" : "Arrays",
					"CALLEEMETHODNAME" : "asList"
				}, {
					"CALLEECLASS" : "Arrays",
					"CALLEEMETHODNAME" : "asList"
				}, {
					"CALLEECLASS" : "p",
					"CALLEEMETHODNAME" : "accept"
				}, {
					"CALLEECLASS" : "PrintStream",
					"CALLEEMETHODNAME" : "println"
				}, {
					"CALLEECLASS" : "PrintStream",
					"CALLEEMETHODNAME" : "println"
				} ],
				"NUMBEROFMETHODLINES" : 3,
				"METHODPARAMETER" : [ {
					"PARAMETERNAME" : "args",
					"PARAMETERTYPE" : "String[]"
				} ]
			} ]
		},
		"Constant" : {
			"FIELDDETAIL" : [ {
				"FIELDCOMMONTYPE" : "int",
				"FIELDMODIFIERTYPE" : [ ],
				"FIELDDECLARATION" : [ "_valor" ],
				"FIELDDATATYPE" : "int",
				"FIELDACCESSSPECIFIER" : "NONE"
			} ],
			"CLASSORINTERFACEDETAIL" : [ {
				"CLASSACCESSSPECIFIER" : "PUBLIC",
				"NUMBEROFMETHODCALLS" : 1,
				"EXTENDSFROM" : [ "Expression" ],
				"IMPLEMENTSFROM" : [ ],
				"CLASSNAME" : "Constant",
				"ISINTERFACEORNOT" : false,
				"CLASSTYPEPARAMS" : [ ],
				"ISABSTRACTORNOT" : false,
				"CLASSMODIFIERTYPE" : [ "public" ]
			} ],
			"CONSTRUCTORDETAIL" : [ {
				"CONSTRUCTORMODIFIER" : [ "public" ],
				"CONSTRUCTORPARAMETER" : [ {
					"PARAMETERNAME" : "valor",
					"PARAMETERTYPE" : "int"
				} ]
			} ],
			"VARIABLEDETAIL" : [ ],
			"METHODDETAIL" : [ {
				"METHODNAME" : "aceptar",
				"NUMBEROFINCOMINGMETHODS" : 0,
				"INCOMINGMETHOD" : [ ],
				"METHODMODIFIERTYPE" : [ "public" ],
				"METHODBODYLINETYPE" : [ "EXPRESSION" ],
				"NUMBEROFMETHODVARIABLES" : 0,
				"NUMBEROFOUTGOINGMETHODS" : 1,
				"METHODRETURNTYPE" : "void",
				"METHODOVERRIDE" : [ ],
				"OUTGOINGMETHOD" : [ {
					"CALLEECLASS" : "v",
					"CALLEEMETHODNAME" : "visitConstant"
				} ],
				"NUMBEROFMETHODLINES" : 1,
				"METHODPARAMETER" : [ {
					"PARAMETERNAME" : "v",
					"PARAMETERTYPE" : "VisitorExpression"
				} ]
			} ]
		},
		"Sum" : {
			"FIELDDETAIL" : [ ],
			"CLASSORINTERFACEDETAIL" : [ {
				"CLASSACCESSSPECIFIER" : "PUBLIC",
				"NUMBEROFMETHODCALLS" : 1,
				"EXTENDSFROM" : [ "OpBinary" ],
				"IMPLEMENTSFROM" : [ ],
				"CLASSNAME" : "Sum",
				"ISINTERFACEORNOT" : false,
				"CLASSTYPEPARAMS" : [ ],
				"ISABSTRACTORNOT" : false,
				"CLASSMODIFIERTYPE" : [ "public" ]
			} ],
			"CONSTRUCTORDETAIL" : [ {
				"CONSTRUCTORMODIFIER" : [ "public" ],
				"CONSTRUCTORPARAMETER" : [ {
					"PARAMETERNAME" : "izq",
					"PARAMETERTYPE" : "Expression"
				}, {
					"PARAMETERNAME" : "der",
					"PARAMETERTYPE" : "Expression"
				} ]
			} ],
			"VARIABLEDETAIL" : [ ],
			"METHODDETAIL" : [ {
				"METHODNAME" : "aceptar",
				"NUMBEROFINCOMINGMETHODS" : 0,
				"INCOMINGMETHOD" : [ ],
				"METHODMODIFIERTYPE" : [ "public" ],
				"METHODBODYLINETYPE" : [ "EXPRESSION" ],
				"NUMBEROFMETHODVARIABLES" : 0,
				"NUMBEROFOUTGOINGMETHODS" : 1,
				"METHODRETURNTYPE" : "void",
				"METHODOVERRIDE" : [ ],
				"OUTGOINGMETHOD" : [ {
					"CALLEECLASS" : "v",
					"CALLEEMETHODNAME" : "visitSum"
				} ],
				"NUMBEROFMETHODLINES" : 1,
				"METHODPARAMETER" : [ {
					"PARAMETERNAME" : "v",
					"PARAMETERTYPE" : "VisitorExpression"
				} ]
			} ]
		},
		"VisitorExpression" : {
			"FIELDDETAIL" : [ {
				"FIELDCOMMONTYPE" : "String",
				"FIELDMODIFIERTYPE" : [ "private" ],
				"FIELDDECLARATION" : [ "_resultado" ],
				"FIELDDATATYPE" : "String",
				"FIELDACCESSSPECIFIER" : "PRIVATE"
			} ],
			"CLASSORINTERFACEDETAIL" : [ {
				"CLASSACCESSSPECIFIER" : "PUBLIC",
				"NUMBEROFMETHODCALLS" : 7,
				"EXTENDSFROM" : [ ],
				"IMPLEMENTSFROM" : [ ],
				"CLASSNAME" : "VisitorExpression",
				"ISINTERFACEORNOT" : false,
				"CLASSTYPEPARAMS" : [ ],
				"ISABSTRACTORNOT" : false,
				"CLASSMODIFIERTYPE" : [ "public" ]
			} ],
			"CONSTRUCTORDETAIL" : [ ],
			"VARIABLEDETAIL" : [ {
				"VARIABLEDECLARATION" : [ "pIzq = obtenerResultado()" ],
				"VARIABLECOMMONTYPE" : "String",
				"VARIABLEELEMENTTYPE" : "String"
			}, {
				"VARIABLEDECLARATION" : [ "pDer = obtenerResultado()" ],
				"VARIABLECOMMONTYPE" : "String",
				"VARIABLEELEMENTTYPE" : "String"
			} ],
			"METHODDETAIL" : [ {
				"METHODNAME" : "visitVariable",
				"NUMBEROFINCOMINGMETHODS" : 0,
				"INCOMINGMETHOD" : [ ],
				"METHODMODIFIERTYPE" : [ "public" ],
				"METHODBODYLINETYPE" : [ "EXPRESSION" ],
				"NUMBEROFMETHODVARIABLES" : 0,
				"NUMBEROFOUTGOINGMETHODS" : 0,
				"METHODRETURNTYPE" : "void",
				"METHODOVERRIDE" : [ ],
				"OUTGOINGMETHOD" : [ ],
				"NUMBEROFMETHODLINES" : 1,
				"METHODPARAMETER" : [ {
					"PARAMETERNAME" : "v",
					"PARAMETERTYPE" : "Variable"
				} ]
			}, {
				"METHODNAME" : "visitConstant",
				"NUMBEROFINCOMINGMETHODS" : 0,
				"INCOMINGMETHOD" : [ ],
				"METHODMODIFIERTYPE" : [ "public" ],
				"METHODBODYLINETYPE" : [ "EXPRESSION" ],
				"NUMBEROFMETHODVARIABLES" : 0,
				"NUMBEROFOUTGOINGMETHODS" : 1,
				"METHODRETURNTYPE" : "void",
				"METHODOVERRIDE" : [ ],
				"OUTGOINGMETHOD" : [ {
					"CALLEECLASS" : "String",
					"CALLEEMETHODNAME" : "valueOf"
				} ],
				"NUMBEROFMETHODLINES" : 1,
				"METHODPARAMETER" : [ {
					"PARAMETERNAME" : "c",
					"PARAMETERTYPE" : "Constant"
				} ]
			}, {
				"METHODNAME" : "visitOpBinary",
				"NUMBEROFINCOMINGMETHODS" : 0,
				"INCOMINGMETHOD" : [ ],
				"METHODMODIFIERTYPE" : [ "private" ],
				"METHODBODYLINETYPE" : [ "EXPRESSION", "EXPRESSION", "EXPRESSION", "EXPRESSION", "EXPRESSION" ],
				"NUMBEROFMETHODVARIABLES" : 2,
				"NUMBEROFOUTGOINGMETHODS" : 4,
				"METHODRETURNTYPE" : "void",
				"METHODOVERRIDE" : [ ],
				"OUTGOINGMETHOD" : [ {
					"CALLEECLASS" : "_izq",
					"CALLEEMETHODNAME" : "aceptar"
				}, {
					"CALLEECLASS" : "VisitorExpression",
					"CALLEEMETHODNAME" : "obtenerResultado"
				}, {
					"CALLEECLASS" : "_der",
					"CALLEEMETHODNAME" : "aceptar"
				}, {
					"CALLEECLASS" : "VisitorExpression",
					"CALLEEMETHODNAME" : "obtenerResultado"
				} ],
				"NUMBEROFMETHODLINES" : 5,
				"METHODPARAMETER" : [ {
					"PARAMETERNAME" : "op",
					"PARAMETERTYPE" : "OpBinary"
				}, {
					"PARAMETERNAME" : "pOperacion",
					"PARAMETERTYPE" : "String"
				} ]
			}, {
				"METHODNAME" : "visitSum",
				"NUMBEROFINCOMINGMETHODS" : 0,
				"INCOMINGMETHOD" : [ ],
				"METHODMODIFIERTYPE" : [ "public" ],
				"METHODBODYLINETYPE" : [ "EXPRESSION" ],
				"NUMBEROFMETHODVARIABLES" : 0,
				"NUMBEROFOUTGOINGMETHODS" : 1,
				"METHODRETURNTYPE" : "void",
				"METHODOVERRIDE" : [ ],
				"OUTGOINGMETHOD" : [ {
					"CALLEECLASS" : "UNKNOWN",
					"CALLEEMETHODNAME" : "visitOpBinary"
				} ],
				"NUMBEROFMETHODLINES" : 1,
				"METHODPARAMETER" : [ {
					"PARAMETERNAME" : "s",
					"PARAMETERTYPE" : "Sum"
				} ]
			}, {
				"METHODNAME" : "visitMult",
				"NUMBEROFINCOMINGMETHODS" : 0,
				"INCOMINGMETHOD" : [ ],
				"METHODMODIFIERTYPE" : [ "public" ],
				"METHODBODYLINETYPE" : [ "EXPRESSION" ],
				"NUMBEROFMETHODVARIABLES" : 0,
				"NUMBEROFOUTGOINGMETHODS" : 1,
				"METHODRETURNTYPE" : "void",
				"METHODOVERRIDE" : [ ],
				"OUTGOINGMETHOD" : [ {
					"CALLEECLASS" : "UNKNOWN",
					"CALLEEMETHODNAME" : "visitOpBinary"
				} ],
				"NUMBEROFMETHODLINES" : 1,
				"METHODPARAMETER" : [ {
					"PARAMETERNAME" : "m",
					"PARAMETERTYPE" : "Mult"
				} ]
			}, {
				"METHODNAME" : "obtenerResultado",
				"NUMBEROFINCOMINGMETHODS" : 2,
				"INCOMINGMETHOD" : [ {
					"CALLEDMETHODNAME" : "visitOpBinary",
					"CALLEDCLASS" : "VisitorExpression"
				}, {
					"CALLEDMETHODNAME" : "visitOpBinary",
					"CALLEDCLASS" : "VisitorExpression"
				} ],
				"METHODMODIFIERTYPE" : [ "public" ],
				"METHODBODYLINETYPE" : [ "RETURN" ],
				"NUMBEROFMETHODVARIABLES" : 0,
				"NUMBEROFOUTGOINGMETHODS" : 0,
				"METHODRETURNTYPE" : "String",
				"METHODOVERRIDE" : [ ],
				"OUTGOINGMETHOD" : [ ],
				"NUMBEROFMETHODLINES" : 1,
				"METHODPARAMETER" : [ ]
			} ]
		},
		"PoliceOfficer" : {
			"FIELDDETAIL" : [ ],
			"CLASSORINTERFACEDETAIL" : [ {
				"CLASSACCESSSPECIFIER" : "PUBLIC",
				"NUMBEROFMETHODCALLS" : 11,
				"EXTENDSFROM" : [ ],
				"IMPLEMENTSFROM" : [ ],
				"CLASSNAME" : "PoliceOfficer",
				"ISINTERFACEORNOT" : false,
				"CLASSTYPEPARAMS" : [ ],
				"ISABSTRACTORNOT" : false,
				"CLASSMODIFIERTYPE" : [ "public" ]
			} ],
			"CONSTRUCTORDETAIL" : [ ],
			"VARIABLEDETAIL" : [ {
				"VARIABLEDECLARATION" : [ "checked = false" ],
				"VARIABLECOMMONTYPE" : "boolean",
				"VARIABLEELEMENTTYPE" : "boolean"
			}, {
				"VARIABLEDECLARATION" : [ "checked = false" ],
				"VARIABLECOMMONTYPE" : "boolean",
				"VARIABLEELEMENTTYPE" : "boolean"
			} ],
			"METHODDETAIL" : [ {
				"METHODNAME" : "visit",
				"NUMBEROFINCOMINGMETHODS" : 0,
				"INCOMINGMETHOD" : [ ],
				"METHODMODIFIERTYPE" : [ "public" ],
				"METHODBODYLINETYPE" : [ "EXPRESSION", "IF", "RETURN" ],
				"NUMBEROFMETHODVARIABLES" : 1,
				"NUMBEROFOUTGOINGMETHODS" : 4,
				"METHODRETURNTYPE" : "boolean",
				"METHODOVERRIDE" : [ ],
				"OUTGOINGMETHOD" : [ {
					"CALLEECLASS" : "UNKNOWN",
					"CALLEEMETHODNAME" : "checkIdentification"
				}, {
					"CALLEECLASS" : "passenger",
					"CALLEEMETHODNAME" : "getPassport"
				}, {
					"CALLEECLASS" : "UNKNOWN",
					"CALLEEMETHODNAME" : "checkBelongings"
				}, {
					"CALLEECLASS" : "passenger",
					"CALLEEMETHODNAME" : "getBelongings"
				}, {
					"CALLEECLASS" : "passenger",
					"CALLEEMETHODNAME" : "getVisa"
				} ],
				"NUMBEROFMETHODLINES" : 3,
				"METHODPARAMETER" : [ {
					"PARAMETERNAME" : "passenger",
					"PARAMETERTYPE" : "NationalPassenger"
				} ]
			}, {
				"METHODNAME" : "checkIdentification",
				"NUMBEROFINCOMINGMETHODS" : 0,
				"INCOMINGMETHOD" : [ ],
				"METHODMODIFIERTYPE" : [ "private" ],
				"METHODBODYLINETYPE" : [ "RETURN" ],
				"NUMBEROFMETHODVARIABLES" : 0,
				"NUMBEROFOUTGOINGMETHODS" : 1,
				"METHODRETURNTYPE" : "boolean",
				"METHODOVERRIDE" : [ ],
				"OUTGOINGMETHOD" : [ {
					"CALLEECLASS" : "String",
					"CALLEEMETHODNAME" : "equals"
				} ],
				"NUMBEROFMETHODLINES" : 1,
				"METHODPARAMETER" : [ {
					"PARAMETERNAME" : "id",
					"PARAMETERTYPE" : "String"
				} ]
			}, {
				"METHODNAME" : "checkBelongings",
				"NUMBEROFINCOMINGMETHODS" : 0,
				"INCOMINGMETHOD" : [ ],
				"METHODMODIFIERTYPE" : [ "private" ],
				"METHODBODYLINETYPE" : [ "RETURN" ],
				"NUMBEROFMETHODVARIABLES" : 0,
				"NUMBEROFOUTGOINGMETHODS" : 1,
				"METHODRETURNTYPE" : "boolean",
				"METHODOVERRIDE" : [ ],
				"OUTGOINGMETHOD" : [ {
					"CALLEECLASS" : "List",
					"CALLEEMETHODNAME" : "contains"
				} ],
				"NUMBEROFMETHODLINES" : 1,
				"METHODPARAMETER" : [ {
					"PARAMETERNAME" : "belongings",
					"PARAMETERTYPE" : "List<String>"
				} ]
			}, {
				"METHODNAME" : "visit",
				"NUMBEROFINCOMINGMETHODS" : 0,
				"INCOMINGMETHOD" : [ ],
				"METHODMODIFIERTYPE" : [ "public" ],
				"METHODBODYLINETYPE" : [ "EXPRESSION", "IF", "RETURN" ],
				"NUMBEROFMETHODVARIABLES" : 1,
				"NUMBEROFOUTGOINGMETHODS" : 5,
				"METHODRETURNTYPE" : "boolean",
				"METHODOVERRIDE" : [ ],
				"OUTGOINGMETHOD" : [ {
					"CALLEECLASS" : "UNKNOWN",
					"CALLEEMETHODNAME" : "checkIdentification"
				}, {
					"CALLEECLASS" : "passenger",
					"CALLEEMETHODNAME" : "getPassport"
				}, {
					"CALLEECLASS" : "UNKNOWN",
					"CALLEEMETHODNAME" : "checkBelongings"
				}, {
					"CALLEECLASS" : "passenger",
					"CALLEEMETHODNAME" : "getBelongings"
				}, {
					"CALLEECLASS" : "passenger",
					"CALLEEMETHODNAME" : "getVisa"
				} ],
				"NUMBEROFMETHODLINES" : 3,
				"METHODPARAMETER" : [ {
					"PARAMETERNAME" : "passenger",
					"PARAMETERTYPE" : "InternationalPassenger"
				} ]
			} ]
		},
		"OpBinary" : {
			"FIELDDETAIL" : [ {
				"FIELDCOMMONTYPE" : "Expression",
				"FIELDMODIFIERTYPE" : [ ],
				"FIELDDECLARATION" : [ "_izq", "_der" ],
				"FIELDDATATYPE" : "Expression",
				"FIELDACCESSSPECIFIER" : "NONE"
			} ],
			"CLASSORINTERFACEDETAIL" : [ {
				"CLASSACCESSSPECIFIER" : "PUBLIC",
				"NUMBEROFMETHODCALLS" : 0,
				"EXTENDSFROM" : [ "Expression" ],
				"IMPLEMENTSFROM" : [ ],
				"CLASSNAME" : "OpBinary",
				"ISINTERFACEORNOT" : false,
				"CLASSTYPEPARAMS" : [ ],
				"ISABSTRACTORNOT" : true,
				"CLASSMODIFIERTYPE" : [ "public", "abstract" ]
			} ],
			"CONSTRUCTORDETAIL" : [ {
				"CONSTRUCTORMODIFIER" : [ "public" ],
				"CONSTRUCTORPARAMETER" : [ {
					"PARAMETERNAME" : "izq",
					"PARAMETERTYPE" : "Expression"
				}, {
					"PARAMETERNAME" : "der",
					"PARAMETERTYPE" : "Expression"
				} ]
			} ],
			"VARIABLEDETAIL" : [ ],
			"METHODDETAIL" : [ ]
		},
		"Mult" : {
			"FIELDDETAIL" : [ ],
			"CLASSORINTERFACEDETAIL" : [ {
				"CLASSACCESSSPECIFIER" : "PUBLIC",
				"NUMBEROFMETHODCALLS" : 1,
				"EXTENDSFROM" : [ "OpBinary" ],
				"IMPLEMENTSFROM" : [ ],
				"CLASSNAME" : "Mult",
				"ISINTERFACEORNOT" : false,
				"CLASSTYPEPARAMS" : [ ],
				"ISABSTRACTORNOT" : false,
				"CLASSMODIFIERTYPE" : [ "public" ]
			} ],
			"CONSTRUCTORDETAIL" : [ {
				"CONSTRUCTORMODIFIER" : [ "public" ],
				"CONSTRUCTORPARAMETER" : [ {
					"PARAMETERNAME" : "izq",
					"PARAMETERTYPE" : "Expression"
				}, {
					"PARAMETERNAME" : "der",
					"PARAMETERTYPE" : "Expression"
				} ]
			} ],
			"VARIABLEDETAIL" : [ ],
			"METHODDETAIL" : [ {
				"METHODNAME" : "aceptar",
				"NUMBEROFINCOMINGMETHODS" : 0,
				"INCOMINGMETHOD" : [ ],
				"METHODMODIFIERTYPE" : [ "public" ],
				"METHODBODYLINETYPE" : [ "EXPRESSION" ],
				"NUMBEROFMETHODVARIABLES" : 0,
				"NUMBEROFOUTGOINGMETHODS" : 1,
				"METHODRETURNTYPE" : "void",
				"METHODOVERRIDE" : [ ],
				"OUTGOINGMETHOD" : [ {
					"CALLEECLASS" : "v",
					"CALLEEMETHODNAME" : "visitMult"
				} ],
				"NUMBEROFMETHODLINES" : 1,
				"METHODPARAMETER" : [ {
					"PARAMETERNAME" : "v",
					"PARAMETERTYPE" : "VisitorExpression"
				} ]
			} ]
		},
		"Expression" : {
			"FIELDDETAIL" : [ ],
			"CLASSORINTERFACEDETAIL" : [ {
				"CLASSACCESSSPECIFIER" : "PUBLIC",
				"NUMBEROFMETHODCALLS" : 0,
				"EXTENDSFROM" : [ ],
				"IMPLEMENTSFROM" : [ ],
				"CLASSNAME" : "Expression",
				"ISINTERFACEORNOT" : false,
				"CLASSTYPEPARAMS" : [ ],
				"ISABSTRACTORNOT" : true,
				"CLASSMODIFIERTYPE" : [ "public", "abstract" ]
			} ],
			"CONSTRUCTORDETAIL" : [ ],
			"VARIABLEDETAIL" : [ ],
			"METHODDETAIL" : [ {
				"METHODNAME" : "aceptar",
				"NUMBEROFINCOMINGMETHODS" : 0,
				"INCOMINGMETHOD" : [ ],
				"METHODMODIFIERTYPE" : [ "abstract", "public" ],
				"METHODBODYLINETYPE" : [ ],
				"NUMBEROFMETHODVARIABLES" : 0,
				"NUMBEROFOUTGOINGMETHODS" : 0,
				"METHODRETURNTYPE" : "void",
				"METHODOVERRIDE" : [ ],
				"OUTGOINGMETHOD" : [ ],
				"NUMBEROFMETHODLINES" : 0,
				"METHODPARAMETER" : [ {
					"PARAMETERNAME" : "v",
					"PARAMETERTYPE" : "VisitorExpression"
				} ]
			} ]
		},
		"Passenger" : {
			"FIELDDETAIL" : [ ],
			"CLASSORINTERFACEDETAIL" : [ {
				"CLASSACCESSSPECIFIER" : "PUBLIC",
				"NUMBEROFMETHODCALLS" : 0,
				"EXTENDSFROM" : [ ],
				"IMPLEMENTSFROM" : [ ],
				"CLASSNAME" : "Passenger",
				"ISINTERFACEORNOT" : true,
				"CLASSTYPEPARAMS" : [ ],
				"ISABSTRACTORNOT" : false,
				"CLASSMODIFIERTYPE" : [ "public" ]
			} ],
			"CONSTRUCTORDETAIL" : [ ],
			"VARIABLEDETAIL" : [ ],
			"METHODDETAIL" : [ {
				"METHODNAME" : "accept",
				"NUMBEROFINCOMINGMETHODS" : 0,
				"INCOMINGMETHOD" : [ ],
				"METHODMODIFIERTYPE" : [ ],
				"METHODBODYLINETYPE" : [ ],
				"NUMBEROFMETHODVARIABLES" : 0,
				"NUMBEROFOUTGOINGMETHODS" : 0,
				"METHODRETURNTYPE" : "boolean",
				"METHODOVERRIDE" : [ ],
				"OUTGOINGMETHOD" : [ ],
				"NUMBEROFMETHODLINES" : 0,
				"METHODPARAMETER" : [ {
					"PARAMETERNAME" : "visitor",
					"PARAMETERTYPE" : "PoliceOfficer"
				} ]
			} ]
		},
		"InternationalPassenger" : {
			"FIELDDETAIL" : [ {
				"FIELDCOMMONTYPE" : "String",
				"FIELDMODIFIERTYPE" : [ "private" ],
				"FIELDDECLARATION" : [ "passport" ],
				"FIELDDATATYPE" : "String",
				"FIELDACCESSSPECIFIER" : "PRIVATE"
			}, {
				"FIELDCOMMONTYPE" : "Boolean",
				"FIELDMODIFIERTYPE" : [ "private" ],
				"FIELDDECLARATION" : [ "visa" ],
				"FIELDDATATYPE" : "Boolean",
				"FIELDACCESSSPECIFIER" : "PRIVATE"
			}, {
				"FIELDCOMMONTYPE" : "List<String>",
				"FIELDMODIFIERTYPE" : [ "private" ],
				"FIELDDECLARATION" : [ "belongings" ],
				"FIELDDATATYPE" : "List<String>",
				"FIELDACCESSSPECIFIER" : "PRIVATE"
			} ],
			"CLASSORINTERFACEDETAIL" : [ {
				"CLASSACCESSSPECIFIER" : "PUBLIC",
				"NUMBEROFMETHODCALLS" : 1,
				"EXTENDSFROM" : [ ],
				"IMPLEMENTSFROM" : [ "Passenger" ],
				"CLASSNAME" : "InternationalPassenger",
				"ISINTERFACEORNOT" : false,
				"CLASSTYPEPARAMS" : [ ],
				"ISABSTRACTORNOT" : false,
				"CLASSMODIFIERTYPE" : [ "public" ]
			} ],
			"CONSTRUCTORDETAIL" : [ {
				"CONSTRUCTORMODIFIER" : [ "public" ],
				"CONSTRUCTORPARAMETER" : [ {
					"PARAMETERNAME" : "passport",
					"PARAMETERTYPE" : "String"
				}, {
					"PARAMETERNAME" : "visa",
					"PARAMETERTYPE" : "Boolean"
				}, {
					"PARAMETERNAME" : "belongings",
					"PARAMETERTYPE" : "List<String>"
				} ]
			} ],
			"VARIABLEDETAIL" : [ ],
			"METHODDETAIL" : [ {
				"METHODNAME" : "getPassport",
				"NUMBEROFINCOMINGMETHODS" : 0,
				"INCOMINGMETHOD" : [ ],
				"METHODMODIFIERTYPE" : [ "public" ],
				"METHODBODYLINETYPE" : [ "RETURN" ],
				"NUMBEROFMETHODVARIABLES" : 0,
				"NUMBEROFOUTGOINGMETHODS" : 0,
				"METHODRETURNTYPE" : "String",
				"METHODOVERRIDE" : [ ],
				"OUTGOINGMETHOD" : [ ],
				"NUMBEROFMETHODLINES" : 1,
				"METHODPARAMETER" : [ ]
			}, {
				"METHODNAME" : "getVisa",
				"NUMBEROFINCOMINGMETHODS" : 0,
				"INCOMINGMETHOD" : [ ],
				"METHODMODIFIERTYPE" : [ "public" ],
				"METHODBODYLINETYPE" : [ "RETURN" ],
				"NUMBEROFMETHODVARIABLES" : 0,
				"NUMBEROFOUTGOINGMETHODS" : 0,
				"METHODRETURNTYPE" : "Boolean",
				"METHODOVERRIDE" : [ ],
				"OUTGOINGMETHOD" : [ ],
				"NUMBEROFMETHODLINES" : 1,
				"METHODPARAMETER" : [ ]
			}, {
				"METHODNAME" : "getBelongings",
				"NUMBEROFINCOMINGMETHODS" : 0,
				"INCOMINGMETHOD" : [ ],
				"METHODMODIFIERTYPE" : [ "public" ],
				"METHODBODYLINETYPE" : [ "RETURN" ],
				"NUMBEROFMETHODVARIABLES" : 0,
				"NUMBEROFOUTGOINGMETHODS" : 0,
				"METHODRETURNTYPE" : "List<String>",
				"METHODOVERRIDE" : [ ],
				"OUTGOINGMETHOD" : [ ],
				"NUMBEROFMETHODLINES" : 1,
				"METHODPARAMETER" : [ ]
			}, {
				"METHODNAME" : "accept",
				"NUMBEROFINCOMINGMETHODS" : 0,
				"INCOMINGMETHOD" : [ ],
				"METHODMODIFIERTYPE" : [ "public" ],
				"METHODBODYLINETYPE" : [ "RETURN" ],
				"NUMBEROFMETHODVARIABLES" : 0,
				"NUMBEROFOUTGOINGMETHODS" : 1,
				"METHODRETURNTYPE" : "boolean",
				"METHODOVERRIDE" : [ "@Override" ],
				"OUTGOINGMETHOD" : [ {
					"CALLEECLASS" : "visitor",
					"CALLEEMETHODNAME" : "visit"
				} ],
				"NUMBEROFMETHODLINES" : 1,
				"METHODPARAMETER" : [ {
					"PARAMETERNAME" : "visitor",
					"PARAMETERTYPE" : "PoliceOfficer"
				} ]
			} ]
		},
		"NationalPassenger" : {
			"FIELDDETAIL" : [ {
				"FIELDCOMMONTYPE" : "String",
				"FIELDMODIFIERTYPE" : [ "private" ],
				"FIELDDECLARATION" : [ "identityDocument" ],
				"FIELDDATATYPE" : "String",
				"FIELDACCESSSPECIFIER" : "PRIVATE"
			}, {
				"FIELDCOMMONTYPE" : "List<String>",
				"FIELDMODIFIERTYPE" : [ "private" ],
				"FIELDDECLARATION" : [ "belongings" ],
				"FIELDDATATYPE" : "List<String>",
				"FIELDACCESSSPECIFIER" : "PRIVATE"
			} ],
			"CLASSORINTERFACEDETAIL" : [ {
				"CLASSACCESSSPECIFIER" : "PUBLIC",
				"NUMBEROFMETHODCALLS" : 1,
				"EXTENDSFROM" : [ ],
				"IMPLEMENTSFROM" : [ "Passenger" ],
				"CLASSNAME" : "NationalPassenger",
				"ISINTERFACEORNOT" : false,
				"CLASSTYPEPARAMS" : [ ],
				"ISABSTRACTORNOT" : false,
				"CLASSMODIFIERTYPE" : [ "public" ]
			} ],
			"CONSTRUCTORDETAIL" : [ {
				"CONSTRUCTORMODIFIER" : [ "public" ],
				"CONSTRUCTORPARAMETER" : [ {
					"PARAMETERNAME" : "identityDocument",
					"PARAMETERTYPE" : "String"
				}, {
					"PARAMETERNAME" : "belongings",
					"PARAMETERTYPE" : "List<String>"
				} ]
			} ],
			"VARIABLEDETAIL" : [ ],
			"METHODDETAIL" : [ {
				"METHODNAME" : "getIdentityDocument",
				"NUMBEROFINCOMINGMETHODS" : 0,
				"INCOMINGMETHOD" : [ ],
				"METHODMODIFIERTYPE" : [ "public" ],
				"METHODBODYLINETYPE" : [ "RETURN" ],
				"NUMBEROFMETHODVARIABLES" : 0,
				"NUMBEROFOUTGOINGMETHODS" : 0,
				"METHODRETURNTYPE" : "String",
				"METHODOVERRIDE" : [ ],
				"OUTGOINGMETHOD" : [ ],
				"NUMBEROFMETHODLINES" : 1,
				"METHODPARAMETER" : [ ]
			}, {
				"METHODNAME" : "getBelongings",
				"NUMBEROFINCOMINGMETHODS" : 0,
				"INCOMINGMETHOD" : [ ],
				"METHODMODIFIERTYPE" : [ "public" ],
				"METHODBODYLINETYPE" : [ "RETURN" ],
				"NUMBEROFMETHODVARIABLES" : 0,
				"NUMBEROFOUTGOINGMETHODS" : 0,
				"METHODRETURNTYPE" : "List<String>",
				"METHODOVERRIDE" : [ ],
				"OUTGOINGMETHOD" : [ ],
				"NUMBEROFMETHODLINES" : 1,
				"METHODPARAMETER" : [ ]
			}, {
				"METHODNAME" : "accept",
				"NUMBEROFINCOMINGMETHODS" : 0,
				"INCOMINGMETHOD" : [ ],
				"METHODMODIFIERTYPE" : [ "public" ],
				"METHODBODYLINETYPE" : [ "RETURN" ],
				"NUMBEROFMETHODVARIABLES" : 0,
				"NUMBEROFOUTGOINGMETHODS" : 1,
				"METHODRETURNTYPE" : "boolean",
				"METHODOVERRIDE" : [ "@Override" ],
				"OUTGOINGMETHOD" : [ {
					"CALLEECLASS" : "visitor",
					"CALLEEMETHODNAME" : "visit"
				} ],
				"NUMBEROFMETHODLINES" : 1,
				"METHODPARAMETER" : [ {
					"PARAMETERNAME" : "visitor",
					"PARAMETERTYPE" : "PoliceOfficer"
				} ]
			} ]
		},
		"Client" : {
			"FIELDDETAIL" : [ ],
			"CLASSORINTERFACEDETAIL" : [ {
				"CLASSACCESSSPECIFIER" : "PUBLIC",
				"NUMBEROFMETHODCALLS" : 3,
				"EXTENDSFROM" : [ ],
				"IMPLEMENTSFROM" : [ ],
				"CLASSNAME" : "Client",
				"ISINTERFACEORNOT" : false,
				"CLASSTYPEPARAMS" : [ ],
				"ISABSTRACTORNOT" : false,
				"CLASSMODIFIERTYPE" : [ "public" ]
			} ],
			"CONSTRUCTORDETAIL" : [ ],
			"VARIABLEDETAIL" : [ {
				"VARIABLEDECLARATION" : [ "expresion = new Mult(new Sum(new Variable(\"a\"), new Constant(5)), new Sum(new Variable(\"b\"), new Constant(1)))" ],
				"VARIABLECOMMONTYPE" : "Expression",
				"VARIABLEELEMENTTYPE" : "Expression"
			}, {
				"VARIABLEDECLARATION" : [ "expr = new VisitorExpression()" ],
				"VARIABLECOMMONTYPE" : "VisitorExpression",
				"VARIABLEELEMENTTYPE" : "VisitorExpression"
			} ],
			"METHODDETAIL" : [ {
				"METHODNAME" : "main",
				"NUMBEROFINCOMINGMETHODS" : 0,
				"INCOMINGMETHOD" : [ ],
				"METHODMODIFIERTYPE" : [ "public", "static" ],
				"METHODBODYLINETYPE" : [ "EXPRESSION", "EXPRESSION", "EXPRESSION", "EXPRESSION" ],
				"NUMBEROFMETHODVARIABLES" : 2,
				"NUMBEROFOUTGOINGMETHODS" : 3,
				"METHODRETURNTYPE" : "void",
				"METHODOVERRIDE" : [ ],
				"OUTGOINGMETHOD" : [ {
					"CALLEECLASS" : "expresion",
					"CALLEEMETHODNAME" : "aceptar"
				}, {
					"CALLEECLASS" : "out",
					"CALLEEMETHODNAME" : "println"
				}, {
					"CALLEECLASS" : "expr",
					"CALLEEMETHODNAME" : "obtenerResultado"
				} ],
				"NUMBEROFMETHODLINES" : 4,
				"METHODPARAMETER" : [ {
					"PARAMETERNAME" : "argv",
					"PARAMETERTYPE" : "String[]"
				} ]
			} ]
		}
	},
	"summary_NLG" : { }
}