{
	"final_summary" : "ToyotaFactory.java: ToyotaFactory does not have any design pattern.  It is a public class that extends CarsFactory. The only method of ToyotaFactory is createProduct (Car). No methods call createProduct and createProduct calls only one method : equalsIgnoreCase method of class String.\n\n\nCarsFactoryTestDrive.java: CarsFactoryTestDrive does not have any design pattern.  It is a public class. The only method of CarsFactoryTestDrive is main (void). No methods call main and main calls 4 methods : createProduct method of class factory, println method of class out, getInformation method of class carCreated and println method of class PrintStream.\n\n\nEnemyShipFactory.java: abstract_factory: EnemyShipFactory acts as a factory for ShipFactory, which overrides createShip method of ShipFactory. It is a public class that extends ShipFactory and that implements ShipFactory. The only method of EnemyShipFactory is createShip (Ship). No methods call createShip and createShip calls only one method : equalsIgnoreCase method of class String.\n\n\nCamry.java: Camry does not have any design pattern.  It is a public class that extends Car.\nTsuru.java: Tsuru does not have any design pattern.  It is a public class that extends Car.\nShipTestDrive.java: ShipTestDrive does not have any design pattern.  It is a public class. The only method of ShipTestDrive is main (void). No methods call main and main calls 4 methods : toString method of class shipCreated, println method of class PrintStream, createShip method of class shipFactory and println method of class out.\n\n\nNissanFactory.java: NissanFactory does not have any design pattern.  It is a public class that extends CarsFactory. The only method of NissanFactory is createProduct (Car). No methods call createProduct and createProduct calls only one method : equalsIgnoreCase method of class String.\n\n\nRocketShip.java: abstract_factory: RocketShip acts as a product for ShipFactory, which overrides. It is a public class that extends Ship.\nCar.java: Car does not have any design pattern.  It is a public abstract class. The 7 methods of Car are getName (String), setName (void), getPrice (String), setPrice (void), getAgency (String), setAgency (void) and getInformation (String). Only one method ( getInformation method of class Car ) calls getName and getName calls no methods. No methods call setName and setName calls no methods. Only one method ( getInformation method of class Car ) calls getPrice and getPrice calls only one method : format method of class String. No methods call setPrice and setPrice calls no methods. Only one method ( getInformation method of class Car ) calls getAgency and getAgency calls no methods. No methods call setAgency and setAgency calls no methods. No methods call getInformation and getInformation calls 3 methods : getPrice method of class Car, getAgency method of class Car and getName method of class Car.\n\n\nCarsFactory.java: CarsFactory does not have any design pattern.  It is a public abstract class. The only method of CarsFactory is createProduct (Car). No methods call createProduct and createProduct calls no methods.\n\n\nVersa.java: Versa does not have any design pattern.  It is a public class that extends Car.\nShipFactory.java: abstract_factory: ShipFactory acts as an abstract factory for Ship, which is inherited by EnemyShipFactory. It is a public interface. The only method of ShipFactory is createShip (Ship). No methods call createShip and createShip calls no methods.\n\n\nShip.java: abstract_factory: Ship acts as an abstract product for Ship, which is inherited by RocketShip, UFOShip. It is a public abstract class. The 7 methods of Ship are getName (String), setName (void), getSpeed (double), setSpeed (void), getDamage (double), setDamage (void) and toString (String). Only one method ( toString method of class Ship ) calls getName and getName calls no methods. No methods call setName and setName calls no methods. Only one method ( toString method of class Ship ) calls getSpeed and getSpeed calls no methods. No methods call setSpeed and setSpeed calls no methods. Only one method ( toString method of class Ship ) calls getDamage and getDamage calls no methods. No methods call setDamage and setDamage calls no methods. No methods call toString and toString calls 4 methods : getSpeed method of class Ship, format method of class String, getName method of class Ship and getDamage method of class Ship.\n\n\nCorolla.java: Corolla does not have any design pattern.  It is a public class that extends Car.\nUFOShip.java: abstract_factory: UFOShip acts as a product for ShipFactory, which overrides. It is a public class that extends Ship.\n",
	"design_pattern" : [ {
		"abstract_factory" : {
			"ShipFactory" : {
				"abstract_product" : {
					"Ship" : [ "RocketShip", "UFOShip" ]
				},
				"concrete_factory" : [ "EnemyShipFactory" ]
			}
		}
	} ],
	"luisburgos-factory-examples" : {
		"ToyotaFactory" : {
			"FIELDDETAIL" : [ ],
			"CLASSORINTERFACEDETAIL" : [ {
				"CLASSACCESSSPECIFIER" : "PUBLIC",
				"NUMBEROFMETHODCALLS" : 2,
				"EXTENDSFROM" : [ "CarsFactory" ],
				"IMPLEMENTSFROM" : [ ],
				"CLASSNAME" : "ToyotaFactory",
				"ISINTERFACEORNOT" : false,
				"CLASSTYPEPARAMS" : [ ],
				"ISABSTRACTORNOT" : false,
				"CLASSMODIFIERTYPE" : [ "public" ]
			} ],
			"CONSTRUCTORDETAIL" : [ ],
			"VARIABLEDETAIL" : [ {
				"VARIABLEDECLARATION" : [ "car = null" ],
				"VARIABLECOMMONTYPE" : "Car",
				"VARIABLEELEMENTTYPE" : "Car"
			} ],
			"METHODDETAIL" : [ {
				"METHODNAME" : "createProduct",
				"NUMBEROFINCOMINGMETHODS" : 0,
				"INCOMINGMETHOD" : [ ],
				"METHODMODIFIERTYPE" : [ "public" ],
				"METHODBODYLINETYPE" : [ "EXPRESSION", "IF", "RETURN" ],
				"NUMBEROFMETHODVARIABLES" : 1,
				"NUMBEROFOUTGOINGMETHODS" : 2,
				"METHODRETURNTYPE" : "Car",
				"METHODOVERRIDE" : [ "@Override" ],
				"OUTGOINGMETHOD" : [ {
					"CALLEECLASS" : "String",
					"CALLEEMETHODNAME" : "equalsIgnoreCase"
				}, {
					"CALLEECLASS" : "String",
					"CALLEEMETHODNAME" : "equalsIgnoreCase"
				} ],
				"NUMBEROFMETHODLINES" : 3,
				"METHODPARAMETER" : [ {
					"PARAMETERNAME" : "productName",
					"PARAMETERTYPE" : "String"
				} ]
			} ]
		},
		"CarsFactoryTestDrive" : {
			"FIELDDETAIL" : [ ],
			"CLASSORINTERFACEDETAIL" : [ {
				"CLASSACCESSSPECIFIER" : "PUBLIC",
				"NUMBEROFMETHODCALLS" : 25,
				"EXTENDSFROM" : [ ],
				"IMPLEMENTSFROM" : [ ],
				"CLASSNAME" : "CarsFactoryTestDrive",
				"ISINTERFACEORNOT" : false,
				"CLASSTYPEPARAMS" : [ ],
				"ISABSTRACTORNOT" : false,
				"CLASSMODIFIERTYPE" : [ "public" ]
			} ],
			"CONSTRUCTORDETAIL" : [ ],
			"VARIABLEDETAIL" : [ {
				"VARIABLEDECLARATION" : [ "factory" ],
				"VARIABLECOMMONTYPE" : "CarsFactory",
				"VARIABLEELEMENTTYPE" : "CarsFactory"
			}, {
				"VARIABLEDECLARATION" : [ "carCreated" ],
				"VARIABLECOMMONTYPE" : "Car",
				"VARIABLEELEMENTTYPE" : "Car"
			} ],
			"METHODDETAIL" : [ {
				"METHODNAME" : "main",
				"NUMBEROFINCOMINGMETHODS" : 0,
				"INCOMINGMETHOD" : [ ],
				"METHODMODIFIERTYPE" : [ "public", "static" ],
				"METHODBODYLINETYPE" : [ "EXPRESSION", "EXPRESSION", "EXPRESSION", "EXPRESSION", "EXPRESSION", "IF", "EXPRESSION", "EXPRESSION", "IF", "EXPRESSION", "EXPRESSION", "EXPRESSION", "IF", "EXPRESSION", "EXPRESSION", "IF", "EXPRESSION", "EXPRESSION", "IF" ],
				"NUMBEROFMETHODVARIABLES" : 2,
				"NUMBEROFOUTGOINGMETHODS" : 25,
				"METHODRETURNTYPE" : "void",
				"METHODOVERRIDE" : [ ],
				"OUTGOINGMETHOD" : [ {
					"CALLEECLASS" : "PrintStream",
					"CALLEEMETHODNAME" : "println"
				}, {
					"CALLEECLASS" : "factory",
					"CALLEEMETHODNAME" : "createProduct"
				}, {
					"CALLEECLASS" : "out",
					"CALLEEMETHODNAME" : "println"
				}, {
					"CALLEECLASS" : "carCreated",
					"CALLEEMETHODNAME" : "getInformation"
				}, {
					"CALLEECLASS" : "PrintStream",
					"CALLEEMETHODNAME" : "println"
				}, {
					"CALLEECLASS" : "PrintStream",
					"CALLEEMETHODNAME" : "println"
				}, {
					"CALLEECLASS" : "factory",
					"CALLEEMETHODNAME" : "createProduct"
				}, {
					"CALLEECLASS" : "out",
					"CALLEEMETHODNAME" : "println"
				}, {
					"CALLEECLASS" : "carCreated",
					"CALLEEMETHODNAME" : "getInformation"
				}, {
					"CALLEECLASS" : "PrintStream",
					"CALLEEMETHODNAME" : "println"
				}, {
					"CALLEECLASS" : "PrintStream",
					"CALLEEMETHODNAME" : "println"
				}, {
					"CALLEECLASS" : "factory",
					"CALLEEMETHODNAME" : "createProduct"
				}, {
					"CALLEECLASS" : "out",
					"CALLEEMETHODNAME" : "println"
				}, {
					"CALLEECLASS" : "carCreated",
					"CALLEEMETHODNAME" : "getInformation"
				}, {
					"CALLEECLASS" : "PrintStream",
					"CALLEEMETHODNAME" : "println"
				}, {
					"CALLEECLASS" : "PrintStream",
					"CALLEEMETHODNAME" : "println"
				}, {
					"CALLEECLASS" : "factory",
					"CALLEEMETHODNAME" : "createProduct"
				}, {
					"CALLEECLASS" : "out",
					"CALLEEMETHODNAME" : "println"
				}, {
					"CALLEECLASS" : "carCreated",
					"CALLEEMETHODNAME" : "getInformation"
				}, {
					"CALLEECLASS" : "PrintStream",
					"CALLEEMETHODNAME" : "println"
				}, {
					"CALLEECLASS" : "PrintStream",
					"CALLEEMETHODNAME" : "println"
				}, {
					"CALLEECLASS" : "factory",
					"CALLEEMETHODNAME" : "createProduct"
				}, {
					"CALLEECLASS" : "out",
					"CALLEEMETHODNAME" : "println"
				}, {
					"CALLEECLASS" : "carCreated",
					"CALLEEMETHODNAME" : "getInformation"
				}, {
					"CALLEECLASS" : "PrintStream",
					"CALLEEMETHODNAME" : "println"
				} ],
				"NUMBEROFMETHODLINES" : 19,
				"METHODPARAMETER" : [ {
					"PARAMETERNAME" : "args",
					"PARAMETERTYPE" : "String[]"
				} ]
			} ]
		},
		"EnemyShipFactory" : {
			"FIELDDETAIL" : [ ],
			"CLASSORINTERFACEDETAIL" : [ {
				"CLASSACCESSSPECIFIER" : "PUBLIC",
				"NUMBEROFMETHODCALLS" : 2,
				"EXTENDSFROM" : [ "ShipFactory" ],
				"IMPLEMENTSFROM" : [ "ShipFactory" ],
				"CLASSNAME" : "EnemyShipFactory",
				"ISINTERFACEORNOT" : false,
				"CLASSTYPEPARAMS" : [ ],
				"ISABSTRACTORNOT" : false,
				"CLASSMODIFIERTYPE" : [ "public" ]
			} ],
			"CONSTRUCTORDETAIL" : [ ],
			"VARIABLEDETAIL" : [ {
				"VARIABLEDECLARATION" : [ "ship = null" ],
				"VARIABLECOMMONTYPE" : "Ship",
				"VARIABLEELEMENTTYPE" : "Ship"
			} ],
			"METHODDETAIL" : [ {
				"METHODNAME" : "createShip",
				"NUMBEROFINCOMINGMETHODS" : 0,
				"INCOMINGMETHOD" : [ ],
				"METHODMODIFIERTYPE" : [ "public" ],
				"METHODBODYLINETYPE" : [ "EXPRESSION", "IF", "RETURN" ],
				"NUMBEROFMETHODVARIABLES" : 1,
				"NUMBEROFOUTGOINGMETHODS" : 2,
				"METHODRETURNTYPE" : "Ship",
				"METHODOVERRIDE" : [ "@Override" ],
				"OUTGOINGMETHOD" : [ {
					"CALLEECLASS" : "String",
					"CALLEEMETHODNAME" : "equalsIgnoreCase"
				}, {
					"CALLEECLASS" : "String",
					"CALLEEMETHODNAME" : "equalsIgnoreCase"
				} ],
				"NUMBEROFMETHODLINES" : 3,
				"METHODPARAMETER" : [ {
					"PARAMETERNAME" : "shipType",
					"PARAMETERTYPE" : "String"
				} ]
			} ]
		},
		"Camry" : {
			"FIELDDETAIL" : [ ],
			"CLASSORINTERFACEDETAIL" : [ {
				"CLASSACCESSSPECIFIER" : "PUBLIC",
				"NUMBEROFMETHODCALLS" : 3,
				"EXTENDSFROM" : [ "Car" ],
				"IMPLEMENTSFROM" : [ ],
				"CLASSNAME" : "Camry",
				"ISINTERFACEORNOT" : false,
				"CLASSTYPEPARAMS" : [ ],
				"ISABSTRACTORNOT" : false,
				"CLASSMODIFIERTYPE" : [ "public" ]
			} ],
			"CONSTRUCTORDETAIL" : [ {
				"CONSTRUCTORMODIFIER" : [ "public" ],
				"CONSTRUCTORPARAMETER" : [ ]
			} ],
			"VARIABLEDETAIL" : [ ],
			"METHODDETAIL" : [ ]
		},
		"Tsuru" : {
			"FIELDDETAIL" : [ ],
			"CLASSORINTERFACEDETAIL" : [ {
				"CLASSACCESSSPECIFIER" : "PUBLIC",
				"NUMBEROFMETHODCALLS" : 3,
				"EXTENDSFROM" : [ "Car" ],
				"IMPLEMENTSFROM" : [ ],
				"CLASSNAME" : "Tsuru",
				"ISINTERFACEORNOT" : false,
				"CLASSTYPEPARAMS" : [ ],
				"ISABSTRACTORNOT" : false,
				"CLASSMODIFIERTYPE" : [ "public" ]
			} ],
			"CONSTRUCTORDETAIL" : [ {
				"CONSTRUCTORMODIFIER" : [ "public" ],
				"CONSTRUCTORPARAMETER" : [ ]
			} ],
			"VARIABLEDETAIL" : [ ],
			"METHODDETAIL" : [ ]
		},
		"ShipTestDrive" : {
			"FIELDDETAIL" : [ ],
			"CLASSORINTERFACEDETAIL" : [ {
				"CLASSACCESSSPECIFIER" : "PUBLIC",
				"NUMBEROFMETHODCALLS" : 10,
				"EXTENDSFROM" : [ ],
				"IMPLEMENTSFROM" : [ ],
				"CLASSNAME" : "ShipTestDrive",
				"ISINTERFACEORNOT" : false,
				"CLASSTYPEPARAMS" : [ ],
				"ISABSTRACTORNOT" : false,
				"CLASSMODIFIERTYPE" : [ "public" ]
			} ],
			"CONSTRUCTORDETAIL" : [ ],
			"VARIABLEDETAIL" : [ {
				"VARIABLEDECLARATION" : [ "shipFactory = new EnemyShipFactory()" ],
				"VARIABLECOMMONTYPE" : "ShipFactory",
				"VARIABLEELEMENTTYPE" : "ShipFactory"
			}, {
				"VARIABLEDECLARATION" : [ "shipCreated" ],
				"VARIABLECOMMONTYPE" : "Ship",
				"VARIABLEELEMENTTYPE" : "Ship"
			} ],
			"METHODDETAIL" : [ {
				"METHODNAME" : "main",
				"NUMBEROFINCOMINGMETHODS" : 0,
				"INCOMINGMETHOD" : [ ],
				"METHODMODIFIERTYPE" : [ "public", "static" ],
				"METHODBODYLINETYPE" : [ "EXPRESSION", "EXPRESSION", "EXPRESSION", "EXPRESSION", "IF", "EXPRESSION", "EXPRESSION", "IF" ],
				"NUMBEROFMETHODVARIABLES" : 2,
				"NUMBEROFOUTGOINGMETHODS" : 10,
				"METHODRETURNTYPE" : "void",
				"METHODOVERRIDE" : [ ],
				"OUTGOINGMETHOD" : [ {
					"CALLEECLASS" : "PrintStream",
					"CALLEEMETHODNAME" : "println"
				}, {
					"CALLEECLASS" : "shipFactory",
					"CALLEEMETHODNAME" : "createShip"
				}, {
					"CALLEECLASS" : "out",
					"CALLEEMETHODNAME" : "println"
				}, {
					"CALLEECLASS" : "shipCreated",
					"CALLEEMETHODNAME" : "toString"
				}, {
					"CALLEECLASS" : "PrintStream",
					"CALLEEMETHODNAME" : "println"
				}, {
					"CALLEECLASS" : "PrintStream",
					"CALLEEMETHODNAME" : "println"
				}, {
					"CALLEECLASS" : "shipFactory",
					"CALLEEMETHODNAME" : "createShip"
				}, {
					"CALLEECLASS" : "out",
					"CALLEEMETHODNAME" : "println"
				}, {
					"CALLEECLASS" : "shipCreated",
					"CALLEEMETHODNAME" : "toString"
				}, {
					"CALLEECLASS" : "PrintStream",
					"CALLEEMETHODNAME" : "println"
				} ],
				"NUMBEROFMETHODLINES" : 8,
				"METHODPARAMETER" : [ {
					"PARAMETERNAME" : "args",
					"PARAMETERTYPE" : "String[]"
				} ]
			} ]
		},
		"NissanFactory" : {
			"FIELDDETAIL" : [ ],
			"CLASSORINTERFACEDETAIL" : [ {
				"CLASSACCESSSPECIFIER" : "PUBLIC",
				"NUMBEROFMETHODCALLS" : 2,
				"EXTENDSFROM" : [ "CarsFactory" ],
				"IMPLEMENTSFROM" : [ ],
				"CLASSNAME" : "NissanFactory",
				"ISINTERFACEORNOT" : false,
				"CLASSTYPEPARAMS" : [ ],
				"ISABSTRACTORNOT" : false,
				"CLASSMODIFIERTYPE" : [ "public" ]
			} ],
			"CONSTRUCTORDETAIL" : [ ],
			"VARIABLEDETAIL" : [ {
				"VARIABLEDECLARATION" : [ "car = null" ],
				"VARIABLECOMMONTYPE" : "Car",
				"VARIABLEELEMENTTYPE" : "Car"
			} ],
			"METHODDETAIL" : [ {
				"METHODNAME" : "createProduct",
				"NUMBEROFINCOMINGMETHODS" : 0,
				"INCOMINGMETHOD" : [ ],
				"METHODMODIFIERTYPE" : [ "public" ],
				"METHODBODYLINETYPE" : [ "EXPRESSION", "IF", "RETURN" ],
				"NUMBEROFMETHODVARIABLES" : 1,
				"NUMBEROFOUTGOINGMETHODS" : 2,
				"METHODRETURNTYPE" : "Car",
				"METHODOVERRIDE" : [ "@Override" ],
				"OUTGOINGMETHOD" : [ {
					"CALLEECLASS" : "String",
					"CALLEEMETHODNAME" : "equalsIgnoreCase"
				}, {
					"CALLEECLASS" : "String",
					"CALLEEMETHODNAME" : "equalsIgnoreCase"
				} ],
				"NUMBEROFMETHODLINES" : 3,
				"METHODPARAMETER" : [ {
					"PARAMETERNAME" : "productName",
					"PARAMETERTYPE" : "String"
				} ]
			} ]
		},
		"RocketShip" : {
			"FIELDDETAIL" : [ ],
			"CLASSORINTERFACEDETAIL" : [ {
				"CLASSACCESSSPECIFIER" : "PUBLIC",
				"NUMBEROFMETHODCALLS" : 3,
				"EXTENDSFROM" : [ "Ship" ],
				"IMPLEMENTSFROM" : [ ],
				"CLASSNAME" : "RocketShip",
				"ISINTERFACEORNOT" : false,
				"CLASSTYPEPARAMS" : [ ],
				"ISABSTRACTORNOT" : false,
				"CLASSMODIFIERTYPE" : [ "public" ]
			} ],
			"CONSTRUCTORDETAIL" : [ {
				"CONSTRUCTORMODIFIER" : [ "public" ],
				"CONSTRUCTORPARAMETER" : [ ]
			} ],
			"VARIABLEDETAIL" : [ ],
			"METHODDETAIL" : [ ]
		},
		"Car" : {
			"FIELDDETAIL" : [ {
				"FIELDCOMMONTYPE" : "String",
				"FIELDMODIFIERTYPE" : [ "private" ],
				"FIELDDECLARATION" : [ "agency" ],
				"FIELDDATATYPE" : "String",
				"FIELDACCESSSPECIFIER" : "PRIVATE"
			}, {
				"FIELDCOMMONTYPE" : "String",
				"FIELDMODIFIERTYPE" : [ "private" ],
				"FIELDDECLARATION" : [ "name" ],
				"FIELDDATATYPE" : "String",
				"FIELDACCESSSPECIFIER" : "PRIVATE"
			}, {
				"FIELDCOMMONTYPE" : "double",
				"FIELDMODIFIERTYPE" : [ "private" ],
				"FIELDDECLARATION" : [ "price" ],
				"FIELDDATATYPE" : "double",
				"FIELDACCESSSPECIFIER" : "PRIVATE"
			} ],
			"CLASSORINTERFACEDETAIL" : [ {
				"CLASSACCESSSPECIFIER" : "PUBLIC",
				"NUMBEROFMETHODCALLS" : 4,
				"EXTENDSFROM" : [ ],
				"IMPLEMENTSFROM" : [ ],
				"CLASSNAME" : "Car",
				"ISINTERFACEORNOT" : false,
				"CLASSTYPEPARAMS" : [ ],
				"ISABSTRACTORNOT" : true,
				"CLASSMODIFIERTYPE" : [ "public", "abstract" ]
			} ],
			"CONSTRUCTORDETAIL" : [ {
				"CONSTRUCTORMODIFIER" : [ "public" ],
				"CONSTRUCTORPARAMETER" : [ ]
			} ],
			"VARIABLEDETAIL" : [ ],
			"METHODDETAIL" : [ {
				"METHODNAME" : "getName",
				"NUMBEROFINCOMINGMETHODS" : 2,
				"INCOMINGMETHOD" : [ {
					"CALLEDMETHODNAME" : "getInformation",
					"CALLEDCLASS" : "Car"
				}, {
					"CALLEDMETHODNAME" : "getInformation",
					"CALLEDCLASS" : "Car"
				} ],
				"METHODMODIFIERTYPE" : [ "public" ],
				"METHODBODYLINETYPE" : [ "RETURN" ],
				"NUMBEROFMETHODVARIABLES" : 0,
				"NUMBEROFOUTGOINGMETHODS" : 0,
				"METHODRETURNTYPE" : "String",
				"METHODOVERRIDE" : [ ],
				"OUTGOINGMETHOD" : [ ],
				"NUMBEROFMETHODLINES" : 1,
				"METHODPARAMETER" : [ ]
			}, {
				"METHODNAME" : "setName",
				"NUMBEROFINCOMINGMETHODS" : 0,
				"INCOMINGMETHOD" : [ ],
				"METHODMODIFIERTYPE" : [ "public" ],
				"METHODBODYLINETYPE" : [ "EXPRESSION" ],
				"NUMBEROFMETHODVARIABLES" : 0,
				"NUMBEROFOUTGOINGMETHODS" : 0,
				"METHODRETURNTYPE" : "void",
				"METHODOVERRIDE" : [ ],
				"OUTGOINGMETHOD" : [ ],
				"NUMBEROFMETHODLINES" : 1,
				"METHODPARAMETER" : [ {
					"PARAMETERNAME" : "name",
					"PARAMETERTYPE" : "String"
				} ]
			}, {
				"METHODNAME" : "getPrice",
				"NUMBEROFINCOMINGMETHODS" : 2,
				"INCOMINGMETHOD" : [ {
					"CALLEDMETHODNAME" : "getInformation",
					"CALLEDCLASS" : "Car"
				}, {
					"CALLEDMETHODNAME" : "getInformation",
					"CALLEDCLASS" : "Car"
				} ],
				"METHODMODIFIERTYPE" : [ "public" ],
				"METHODBODYLINETYPE" : [ "RETURN" ],
				"NUMBEROFMETHODVARIABLES" : 0,
				"NUMBEROFOUTGOINGMETHODS" : 1,
				"METHODRETURNTYPE" : "String",
				"METHODOVERRIDE" : [ ],
				"OUTGOINGMETHOD" : [ {
					"CALLEECLASS" : "String",
					"CALLEEMETHODNAME" : "format"
				} ],
				"NUMBEROFMETHODLINES" : 1,
				"METHODPARAMETER" : [ ]
			}, {
				"METHODNAME" : "setPrice",
				"NUMBEROFINCOMINGMETHODS" : 0,
				"INCOMINGMETHOD" : [ ],
				"METHODMODIFIERTYPE" : [ "public" ],
				"METHODBODYLINETYPE" : [ "EXPRESSION" ],
				"NUMBEROFMETHODVARIABLES" : 0,
				"NUMBEROFOUTGOINGMETHODS" : 0,
				"METHODRETURNTYPE" : "void",
				"METHODOVERRIDE" : [ ],
				"OUTGOINGMETHOD" : [ ],
				"NUMBEROFMETHODLINES" : 1,
				"METHODPARAMETER" : [ {
					"PARAMETERNAME" : "price",
					"PARAMETERTYPE" : "double"
				} ]
			}, {
				"METHODNAME" : "getAgency",
				"NUMBEROFINCOMINGMETHODS" : 2,
				"INCOMINGMETHOD" : [ {
					"CALLEDMETHODNAME" : "getInformation",
					"CALLEDCLASS" : "Car"
				}, {
					"CALLEDMETHODNAME" : "getInformation",
					"CALLEDCLASS" : "Car"
				} ],
				"METHODMODIFIERTYPE" : [ "public" ],
				"METHODBODYLINETYPE" : [ "RETURN" ],
				"NUMBEROFMETHODVARIABLES" : 0,
				"NUMBEROFOUTGOINGMETHODS" : 0,
				"METHODRETURNTYPE" : "String",
				"METHODOVERRIDE" : [ ],
				"OUTGOINGMETHOD" : [ ],
				"NUMBEROFMETHODLINES" : 1,
				"METHODPARAMETER" : [ ]
			}, {
				"METHODNAME" : "setAgency",
				"NUMBEROFINCOMINGMETHODS" : 0,
				"INCOMINGMETHOD" : [ ],
				"METHODMODIFIERTYPE" : [ "public" ],
				"METHODBODYLINETYPE" : [ "EXPRESSION" ],
				"NUMBEROFMETHODVARIABLES" : 0,
				"NUMBEROFOUTGOINGMETHODS" : 0,
				"METHODRETURNTYPE" : "void",
				"METHODOVERRIDE" : [ ],
				"OUTGOINGMETHOD" : [ ],
				"NUMBEROFMETHODLINES" : 1,
				"METHODPARAMETER" : [ {
					"PARAMETERNAME" : "agency",
					"PARAMETERTYPE" : "String"
				} ]
			}, {
				"METHODNAME" : "getInformation",
				"NUMBEROFINCOMINGMETHODS" : 0,
				"INCOMINGMETHOD" : [ ],
				"METHODMODIFIERTYPE" : [ "public" ],
				"METHODBODYLINETYPE" : [ "RETURN" ],
				"NUMBEROFMETHODVARIABLES" : 0,
				"NUMBEROFOUTGOINGMETHODS" : 3,
				"METHODRETURNTYPE" : "String",
				"METHODOVERRIDE" : [ ],
				"OUTGOINGMETHOD" : [ {
					"CALLEECLASS" : "Car",
					"CALLEEMETHODNAME" : "getAgency"
				}, {
					"CALLEECLASS" : "Car",
					"CALLEEMETHODNAME" : "getName"
				}, {
					"CALLEECLASS" : "Car",
					"CALLEEMETHODNAME" : "getPrice"
				}, {
					"CALLEECLASS" : "Car",
					"CALLEEMETHODNAME" : "getAgency"
				}, {
					"CALLEECLASS" : "Car",
					"CALLEEMETHODNAME" : "getName"
				}, {
					"CALLEECLASS" : "Car",
					"CALLEEMETHODNAME" : "getPrice"
				} ],
				"NUMBEROFMETHODLINES" : 1,
				"METHODPARAMETER" : [ ]
			} ]
		},
		"CarsFactory" : {
			"FIELDDETAIL" : [ ],
			"CLASSORINTERFACEDETAIL" : [ {
				"CLASSACCESSSPECIFIER" : "PUBLIC",
				"NUMBEROFMETHODCALLS" : 0,
				"EXTENDSFROM" : [ ],
				"IMPLEMENTSFROM" : [ ],
				"CLASSNAME" : "CarsFactory",
				"ISINTERFACEORNOT" : false,
				"CLASSTYPEPARAMS" : [ ],
				"ISABSTRACTORNOT" : true,
				"CLASSMODIFIERTYPE" : [ "public", "abstract" ]
			} ],
			"CONSTRUCTORDETAIL" : [ ],
			"VARIABLEDETAIL" : [ ],
			"METHODDETAIL" : [ {
				"METHODNAME" : "createProduct",
				"NUMBEROFINCOMINGMETHODS" : 0,
				"INCOMINGMETHOD" : [ ],
				"METHODMODIFIERTYPE" : [ "public", "abstract" ],
				"METHODBODYLINETYPE" : [ ],
				"NUMBEROFMETHODVARIABLES" : 0,
				"NUMBEROFOUTGOINGMETHODS" : 0,
				"METHODRETURNTYPE" : "Car",
				"METHODOVERRIDE" : [ ],
				"OUTGOINGMETHOD" : [ ],
				"NUMBEROFMETHODLINES" : 0,
				"METHODPARAMETER" : [ {
					"PARAMETERNAME" : "productName",
					"PARAMETERTYPE" : "String"
				} ]
			} ]
		},
		"Versa" : {
			"FIELDDETAIL" : [ ],
			"CLASSORINTERFACEDETAIL" : [ {
				"CLASSACCESSSPECIFIER" : "PUBLIC",
				"NUMBEROFMETHODCALLS" : 3,
				"EXTENDSFROM" : [ "Car" ],
				"IMPLEMENTSFROM" : [ ],
				"CLASSNAME" : "Versa",
				"ISINTERFACEORNOT" : false,
				"CLASSTYPEPARAMS" : [ ],
				"ISABSTRACTORNOT" : false,
				"CLASSMODIFIERTYPE" : [ "public" ]
			} ],
			"CONSTRUCTORDETAIL" : [ {
				"CONSTRUCTORMODIFIER" : [ "public" ],
				"CONSTRUCTORPARAMETER" : [ ]
			} ],
			"VARIABLEDETAIL" : [ ],
			"METHODDETAIL" : [ ]
		},
		"ShipFactory" : {
			"FIELDDETAIL" : [ ],
			"CLASSORINTERFACEDETAIL" : [ {
				"CLASSACCESSSPECIFIER" : "PUBLIC",
				"NUMBEROFMETHODCALLS" : 0,
				"EXTENDSFROM" : [ ],
				"IMPLEMENTSFROM" : [ ],
				"CLASSNAME" : "ShipFactory",
				"ISINTERFACEORNOT" : true,
				"CLASSTYPEPARAMS" : [ ],
				"ISABSTRACTORNOT" : false,
				"CLASSMODIFIERTYPE" : [ "public" ]
			} ],
			"CONSTRUCTORDETAIL" : [ ],
			"VARIABLEDETAIL" : [ ],
			"METHODDETAIL" : [ {
				"METHODNAME" : "createShip",
				"NUMBEROFINCOMINGMETHODS" : 0,
				"INCOMINGMETHOD" : [ ],
				"METHODMODIFIERTYPE" : [ "public" ],
				"METHODBODYLINETYPE" : [ ],
				"NUMBEROFMETHODVARIABLES" : 0,
				"NUMBEROFOUTGOINGMETHODS" : 0,
				"METHODRETURNTYPE" : "Ship",
				"METHODOVERRIDE" : [ ],
				"OUTGOINGMETHOD" : [ ],
				"NUMBEROFMETHODLINES" : 0,
				"METHODPARAMETER" : [ {
					"PARAMETERNAME" : "shipType",
					"PARAMETERTYPE" : "String"
				} ]
			} ]
		},
		"Ship" : {
			"FIELDDETAIL" : [ {
				"FIELDCOMMONTYPE" : "String",
				"FIELDMODIFIERTYPE" : [ "private" ],
				"FIELDDECLARATION" : [ "name" ],
				"FIELDDATATYPE" : "String",
				"FIELDACCESSSPECIFIER" : "PRIVATE"
			}, {
				"FIELDCOMMONTYPE" : "double",
				"FIELDMODIFIERTYPE" : [ "private" ],
				"FIELDDECLARATION" : [ "speed" ],
				"FIELDDATATYPE" : "double",
				"FIELDACCESSSPECIFIER" : "PRIVATE"
			}, {
				"FIELDCOMMONTYPE" : "double",
				"FIELDMODIFIERTYPE" : [ "private" ],
				"FIELDDECLARATION" : [ "damage" ],
				"FIELDDATATYPE" : "double",
				"FIELDACCESSSPECIFIER" : "PRIVATE"
			} ],
			"CLASSORINTERFACEDETAIL" : [ {
				"CLASSACCESSSPECIFIER" : "PUBLIC",
				"NUMBEROFMETHODCALLS" : 5,
				"EXTENDSFROM" : [ ],
				"IMPLEMENTSFROM" : [ ],
				"CLASSNAME" : "Ship",
				"ISINTERFACEORNOT" : false,
				"CLASSTYPEPARAMS" : [ ],
				"ISABSTRACTORNOT" : true,
				"CLASSMODIFIERTYPE" : [ "public", "abstract" ]
			} ],
			"CONSTRUCTORDETAIL" : [ {
				"CONSTRUCTORMODIFIER" : [ "public" ],
				"CONSTRUCTORPARAMETER" : [ ]
			} ],
			"VARIABLEDETAIL" : [ ],
			"METHODDETAIL" : [ {
				"METHODNAME" : "getName",
				"NUMBEROFINCOMINGMETHODS" : 2,
				"INCOMINGMETHOD" : [ {
					"CALLEDMETHODNAME" : "toString",
					"CALLEDCLASS" : "Ship"
				}, {
					"CALLEDMETHODNAME" : "toString",
					"CALLEDCLASS" : "Ship"
				} ],
				"METHODMODIFIERTYPE" : [ "public" ],
				"METHODBODYLINETYPE" : [ "RETURN" ],
				"NUMBEROFMETHODVARIABLES" : 0,
				"NUMBEROFOUTGOINGMETHODS" : 0,
				"METHODRETURNTYPE" : "String",
				"METHODOVERRIDE" : [ ],
				"OUTGOINGMETHOD" : [ ],
				"NUMBEROFMETHODLINES" : 1,
				"METHODPARAMETER" : [ ]
			}, {
				"METHODNAME" : "setName",
				"NUMBEROFINCOMINGMETHODS" : 0,
				"INCOMINGMETHOD" : [ ],
				"METHODMODIFIERTYPE" : [ "public" ],
				"METHODBODYLINETYPE" : [ "EXPRESSION" ],
				"NUMBEROFMETHODVARIABLES" : 0,
				"NUMBEROFOUTGOINGMETHODS" : 0,
				"METHODRETURNTYPE" : "void",
				"METHODOVERRIDE" : [ ],
				"OUTGOINGMETHOD" : [ ],
				"NUMBEROFMETHODLINES" : 1,
				"METHODPARAMETER" : [ {
					"PARAMETERNAME" : "name",
					"PARAMETERTYPE" : "String"
				} ]
			}, {
				"METHODNAME" : "getSpeed",
				"NUMBEROFINCOMINGMETHODS" : 2,
				"INCOMINGMETHOD" : [ {
					"CALLEDMETHODNAME" : "toString",
					"CALLEDCLASS" : "Ship"
				}, {
					"CALLEDMETHODNAME" : "toString",
					"CALLEDCLASS" : "Ship"
				} ],
				"METHODMODIFIERTYPE" : [ "public" ],
				"METHODBODYLINETYPE" : [ "RETURN" ],
				"NUMBEROFMETHODVARIABLES" : 0,
				"NUMBEROFOUTGOINGMETHODS" : 0,
				"METHODRETURNTYPE" : "double",
				"METHODOVERRIDE" : [ ],
				"OUTGOINGMETHOD" : [ ],
				"NUMBEROFMETHODLINES" : 1,
				"METHODPARAMETER" : [ ]
			}, {
				"METHODNAME" : "setSpeed",
				"NUMBEROFINCOMINGMETHODS" : 0,
				"INCOMINGMETHOD" : [ ],
				"METHODMODIFIERTYPE" : [ "public" ],
				"METHODBODYLINETYPE" : [ "EXPRESSION" ],
				"NUMBEROFMETHODVARIABLES" : 0,
				"NUMBEROFOUTGOINGMETHODS" : 0,
				"METHODRETURNTYPE" : "void",
				"METHODOVERRIDE" : [ ],
				"OUTGOINGMETHOD" : [ ],
				"NUMBEROFMETHODLINES" : 1,
				"METHODPARAMETER" : [ {
					"PARAMETERNAME" : "speed",
					"PARAMETERTYPE" : "double"
				} ]
			}, {
				"METHODNAME" : "getDamage",
				"NUMBEROFINCOMINGMETHODS" : 2,
				"INCOMINGMETHOD" : [ {
					"CALLEDMETHODNAME" : "toString",
					"CALLEDCLASS" : "Ship"
				}, {
					"CALLEDMETHODNAME" : "toString",
					"CALLEDCLASS" : "Ship"
				} ],
				"METHODMODIFIERTYPE" : [ "public" ],
				"METHODBODYLINETYPE" : [ "RETURN" ],
				"NUMBEROFMETHODVARIABLES" : 0,
				"NUMBEROFOUTGOINGMETHODS" : 0,
				"METHODRETURNTYPE" : "double",
				"METHODOVERRIDE" : [ ],
				"OUTGOINGMETHOD" : [ ],
				"NUMBEROFMETHODLINES" : 1,
				"METHODPARAMETER" : [ ]
			}, {
				"METHODNAME" : "setDamage",
				"NUMBEROFINCOMINGMETHODS" : 0,
				"INCOMINGMETHOD" : [ ],
				"METHODMODIFIERTYPE" : [ "public" ],
				"METHODBODYLINETYPE" : [ "EXPRESSION" ],
				"NUMBEROFMETHODVARIABLES" : 0,
				"NUMBEROFOUTGOINGMETHODS" : 0,
				"METHODRETURNTYPE" : "void",
				"METHODOVERRIDE" : [ ],
				"OUTGOINGMETHOD" : [ ],
				"NUMBEROFMETHODLINES" : 1,
				"METHODPARAMETER" : [ {
					"PARAMETERNAME" : "damage",
					"PARAMETERTYPE" : "double"
				} ]
			}, {
				"METHODNAME" : "toString",
				"NUMBEROFINCOMINGMETHODS" : 0,
				"INCOMINGMETHOD" : [ ],
				"METHODMODIFIERTYPE" : [ "public" ],
				"METHODBODYLINETYPE" : [ "RETURN" ],
				"NUMBEROFMETHODVARIABLES" : 0,
				"NUMBEROFOUTGOINGMETHODS" : 5,
				"METHODRETURNTYPE" : "String",
				"METHODOVERRIDE" : [ "@Override" ],
				"OUTGOINGMETHOD" : [ {
					"CALLEECLASS" : "Ship",
					"CALLEEMETHODNAME" : "getName"
				}, {
					"CALLEECLASS" : "String",
					"CALLEEMETHODNAME" : "format"
				}, {
					"CALLEECLASS" : "Ship",
					"CALLEEMETHODNAME" : "getDamage"
				}, {
					"CALLEECLASS" : "String",
					"CALLEEMETHODNAME" : "format"
				}, {
					"CALLEECLASS" : "Ship",
					"CALLEEMETHODNAME" : "getSpeed"
				}, {
					"CALLEECLASS" : "Ship",
					"CALLEEMETHODNAME" : "getName"
				}, {
					"CALLEECLASS" : "Ship",
					"CALLEEMETHODNAME" : "getDamage"
				}, {
					"CALLEECLASS" : "Ship",
					"CALLEEMETHODNAME" : "getSpeed"
				} ],
				"NUMBEROFMETHODLINES" : 1,
				"METHODPARAMETER" : [ ]
			} ]
		},
		"Corolla" : {
			"FIELDDETAIL" : [ ],
			"CLASSORINTERFACEDETAIL" : [ {
				"CLASSACCESSSPECIFIER" : "PUBLIC",
				"NUMBEROFMETHODCALLS" : 3,
				"EXTENDSFROM" : [ "Car" ],
				"IMPLEMENTSFROM" : [ ],
				"CLASSNAME" : "Corolla",
				"ISINTERFACEORNOT" : false,
				"CLASSTYPEPARAMS" : [ ],
				"ISABSTRACTORNOT" : false,
				"CLASSMODIFIERTYPE" : [ "public" ]
			} ],
			"CONSTRUCTORDETAIL" : [ {
				"CONSTRUCTORMODIFIER" : [ "public" ],
				"CONSTRUCTORPARAMETER" : [ ]
			} ],
			"VARIABLEDETAIL" : [ ],
			"METHODDETAIL" : [ ]
		},
		"UFOShip" : {
			"FIELDDETAIL" : [ ],
			"CLASSORINTERFACEDETAIL" : [ {
				"CLASSACCESSSPECIFIER" : "PUBLIC",
				"NUMBEROFMETHODCALLS" : 3,
				"EXTENDSFROM" : [ "Ship" ],
				"IMPLEMENTSFROM" : [ ],
				"CLASSNAME" : "UFOShip",
				"ISINTERFACEORNOT" : false,
				"CLASSTYPEPARAMS" : [ ],
				"ISABSTRACTORNOT" : false,
				"CLASSMODIFIERTYPE" : [ "public" ]
			} ],
			"CONSTRUCTORDETAIL" : [ {
				"CONSTRUCTORMODIFIER" : [ "public" ],
				"CONSTRUCTORPARAMETER" : [ ]
			} ],
			"VARIABLEDETAIL" : [ ],
			"METHODDETAIL" : [ ]
		}
	},
	"summary_NLG" : {
		"abstract_factory" : {
			"RocketShip" : [ "RocketShip acts as a product for ShipFactory, which overrides." ],
			"EnemyShipFactory" : [ "EnemyShipFactory acts as a factory for ShipFactory, which overrides createShip method of ShipFactory." ],
			"ShipFactory" : [ "ShipFactory acts as an abstract factory for Ship, which is inherited by EnemyShipFactory." ],
			"Ship" : [ "Ship acts as an abstract product for Ship, which is inherited by RocketShip, UFOShip." ],
			"UFOShip" : [ "UFOShip acts as a product for ShipFactory, which overrides." ]
		}
	}
}