{
	"luisburgos-factory-pattern" : {
		"FactoryTestDrive" : {
			"FIELDDETAIL" : [ ],
			"CLASSORINTERFACEDETAIL" : [ {
				"CLASSACCESSSPECIFIER" : "PUBLIC",
				"NUMBEROFMETHODCALLS" : 8,
				"EXTENDSFROM" : [ ],
				"IMPLEMENTSFROM" : [ ],
				"CLASSNAME" : "FactoryTestDrive",
				"ISINTERFACEORNOT" : false,
				"CLASSTYPEPARAMS" : [ ],
				"ISABSTRACTORNOT" : false,
				"CLASSMODIFIERTYPE" : [ "public" ]
			} ],
			"CONSTRUCTORDETAIL" : [ ],
			"VARIABLEDETAIL" : [ {
				"VARIABLEDECLARATION" : [ "factory" ],
				"VARIABLECOMMONTYPE" : "Factory",
				"VARIABLEELEMENTTYPE" : "Factory"
			}, {
				"VARIABLEDECLARATION" : [ "productCreated" ],
				"VARIABLECOMMONTYPE" : "Product",
				"VARIABLEELEMENTTYPE" : "Product"
			} ],
			"METHODDETAIL" : [ {
				"METHODNAME" : "main",
				"NUMBEROFINCOMINGMETHODS" : 0,
				"INCOMINGMETHOD" : [ ],
				"METHODMODIFIERTYPE" : [ "public", "static" ],
				"METHODBODYLINETYPE" : [ "EXPRESSION", "EXPRESSION", "EXPRESSION", "EXPRESSION", "IF", "EXPRESSION", "EXPRESSION", "IF" ],
				"NUMBEROFMETHODVARIABLES" : 2,
				"NUMBEROFOUTGOINGMETHODS" : 8,
				"METHODRETURNTYPE" : "void",
				"METHODOVERRIDE" : [ ],
				"OUTGOINGMETHOD" : [ {
					"CALLEECLASS" : "factory",
					"CALLEEMETHODNAME" : "createProduct"
				}, {
					"CALLEECLASS" : "out",
					"CALLEEMETHODNAME" : "println"
				}, {
					"CALLEECLASS" : "productCreated",
					"CALLEEMETHODNAME" : "getInformation"
				}, {
					"CALLEECLASS" : "PrintStream",
					"CALLEEMETHODNAME" : "println"
				}, {
					"CALLEECLASS" : "factory",
					"CALLEEMETHODNAME" : "createProduct"
				}, {
					"CALLEECLASS" : "out",
					"CALLEEMETHODNAME" : "println"
				}, {
					"CALLEECLASS" : "productCreated",
					"CALLEEMETHODNAME" : "getInformation"
				}, {
					"CALLEECLASS" : "PrintStream",
					"CALLEEMETHODNAME" : "println"
				} ],
				"NUMBEROFMETHODLINES" : 8,
				"METHODPARAMETER" : [ {
					"PARAMETERNAME" : "args",
					"PARAMETERTYPE" : "String[]"
				} ]
			} ]
		},
		"ConcreteProductOne" : {
			"FIELDDETAIL" : [ ],
			"CLASSORINTERFACEDETAIL" : [ {
				"CLASSACCESSSPECIFIER" : "PUBLIC",
				"NUMBEROFMETHODCALLS" : 6,
				"EXTENDSFROM" : [ "Product" ],
				"IMPLEMENTSFROM" : [ ],
				"CLASSNAME" : "ConcreteProductOne",
				"ISINTERFACEORNOT" : false,
				"CLASSTYPEPARAMS" : [ ],
				"ISABSTRACTORNOT" : false,
				"CLASSMODIFIERTYPE" : [ "public" ]
			} ],
			"CONSTRUCTORDETAIL" : [ {
				"CONSTRUCTORMODIFIER" : [ "public" ],
				"CONSTRUCTORPARAMETER" : [ {
					"PARAMETERNAME" : "name",
					"PARAMETERTYPE" : "String"
				}, {
					"PARAMETERNAME" : "description",
					"PARAMETERTYPE" : "String"
				} ]
			}, {
				"CONSTRUCTORMODIFIER" : [ "public" ],
				"CONSTRUCTORPARAMETER" : [ ]
			} ],
			"VARIABLEDETAIL" : [ ],
			"METHODDETAIL" : [ {
				"METHODNAME" : "getInformation",
				"NUMBEROFINCOMINGMETHODS" : 0,
				"INCOMINGMETHOD" : [ ],
				"METHODMODIFIERTYPE" : [ "public" ],
				"METHODBODYLINETYPE" : [ "RETURN" ],
				"NUMBEROFMETHODVARIABLES" : 0,
				"NUMBEROFOUTGOINGMETHODS" : 2,
				"METHODRETURNTYPE" : "String",
				"METHODOVERRIDE" : [ "@Override" ],
				"OUTGOINGMETHOD" : [ {
					"CALLEECLASS" : "UNKNOWN",
					"CALLEEMETHODNAME" : "getName"
				}, {
					"CALLEECLASS" : "UNKNOWN",
					"CALLEEMETHODNAME" : "getDescription"
				} ],
				"NUMBEROFMETHODLINES" : 1,
				"METHODPARAMETER" : [ ]
			} ]
		},
		"ConcreteProductTwo" : {
			"FIELDDETAIL" : [ ],
			"CLASSORINTERFACEDETAIL" : [ {
				"CLASSACCESSSPECIFIER" : "PUBLIC",
				"NUMBEROFMETHODCALLS" : 6,
				"EXTENDSFROM" : [ "Product" ],
				"IMPLEMENTSFROM" : [ ],
				"CLASSNAME" : "ConcreteProductTwo",
				"ISINTERFACEORNOT" : false,
				"CLASSTYPEPARAMS" : [ ],
				"ISABSTRACTORNOT" : false,
				"CLASSMODIFIERTYPE" : [ "public" ]
			} ],
			"CONSTRUCTORDETAIL" : [ {
				"CONSTRUCTORMODIFIER" : [ "public" ],
				"CONSTRUCTORPARAMETER" : [ {
					"PARAMETERNAME" : "name",
					"PARAMETERTYPE" : "String"
				}, {
					"PARAMETERNAME" : "description",
					"PARAMETERTYPE" : "String"
				} ]
			}, {
				"CONSTRUCTORMODIFIER" : [ "public" ],
				"CONSTRUCTORPARAMETER" : [ ]
			} ],
			"VARIABLEDETAIL" : [ ],
			"METHODDETAIL" : [ {
				"METHODNAME" : "getInformation",
				"NUMBEROFINCOMINGMETHODS" : 0,
				"INCOMINGMETHOD" : [ ],
				"METHODMODIFIERTYPE" : [ "public" ],
				"METHODBODYLINETYPE" : [ "RETURN" ],
				"NUMBEROFMETHODVARIABLES" : 0,
				"NUMBEROFOUTGOINGMETHODS" : 2,
				"METHODRETURNTYPE" : "String",
				"METHODOVERRIDE" : [ "@Override" ],
				"OUTGOINGMETHOD" : [ {
					"CALLEECLASS" : "UNKNOWN",
					"CALLEEMETHODNAME" : "getName"
				}, {
					"CALLEECLASS" : "UNKNOWN",
					"CALLEEMETHODNAME" : "getDescription"
				} ],
				"NUMBEROFMETHODLINES" : 1,
				"METHODPARAMETER" : [ ]
			} ]
		},
		"ConcreteFactoryTwo" : {
			"FIELDDETAIL" : [ ],
			"CLASSORINTERFACEDETAIL" : [ {
				"CLASSACCESSSPECIFIER" : "PUBLIC",
				"NUMBEROFMETHODCALLS" : 0,
				"EXTENDSFROM" : [ "Factory" ],
				"IMPLEMENTSFROM" : [ ],
				"CLASSNAME" : "ConcreteFactoryTwo",
				"ISINTERFACEORNOT" : false,
				"CLASSTYPEPARAMS" : [ ],
				"ISABSTRACTORNOT" : false,
				"CLASSMODIFIERTYPE" : [ "public" ]
			} ],
			"CONSTRUCTORDETAIL" : [ ],
			"VARIABLEDETAIL" : [ ],
			"METHODDETAIL" : [ {
				"METHODNAME" : "createProduct",
				"NUMBEROFINCOMINGMETHODS" : 0,
				"INCOMINGMETHOD" : [ ],
				"METHODMODIFIERTYPE" : [ "public" ],
				"METHODBODYLINETYPE" : [ "RETURN" ],
				"NUMBEROFMETHODVARIABLES" : 0,
				"NUMBEROFOUTGOINGMETHODS" : 0,
				"METHODRETURNTYPE" : "Product",
				"METHODOVERRIDE" : [ "@Override" ],
				"OUTGOINGMETHOD" : [ ],
				"NUMBEROFMETHODLINES" : 1,
				"METHODPARAMETER" : [ {
					"PARAMETERNAME" : "productType",
					"PARAMETERTYPE" : "String"
				} ]
			} ]
		},
		"Factory" : {
			"FIELDDETAIL" : [ ],
			"CLASSORINTERFACEDETAIL" : [ {
				"CLASSACCESSSPECIFIER" : "PUBLIC",
				"NUMBEROFMETHODCALLS" : 0,
				"EXTENDSFROM" : [ ],
				"IMPLEMENTSFROM" : [ ],
				"CLASSNAME" : "Factory",
				"ISINTERFACEORNOT" : false,
				"CLASSTYPEPARAMS" : [ ],
				"ISABSTRACTORNOT" : true,
				"CLASSMODIFIERTYPE" : [ "public", "abstract" ]
			} ],
			"CONSTRUCTORDETAIL" : [ ],
			"VARIABLEDETAIL" : [ ],
			"METHODDETAIL" : [ {
				"METHODNAME" : "createProduct",
				"NUMBEROFINCOMINGMETHODS" : 0,
				"INCOMINGMETHOD" : [ ],
				"METHODMODIFIERTYPE" : [ "public", "abstract" ],
				"METHODBODYLINETYPE" : [ ],
				"NUMBEROFMETHODVARIABLES" : 0,
				"NUMBEROFOUTGOINGMETHODS" : 0,
				"METHODRETURNTYPE" : "Product",
				"METHODOVERRIDE" : [ ],
				"OUTGOINGMETHOD" : [ ],
				"NUMBEROFMETHODLINES" : 0,
				"METHODPARAMETER" : [ {
					"PARAMETERNAME" : "productType",
					"PARAMETERTYPE" : "String"
				} ]
			} ]
		},
		"Product" : {
			"FIELDDETAIL" : [ {
				"FIELDCOMMONTYPE" : "String",
				"FIELDMODIFIERTYPE" : [ "private" ],
				"FIELDDECLARATION" : [ "name" ],
				"FIELDDATATYPE" : "String",
				"FIELDACCESSSPECIFIER" : "PRIVATE"
			}, {
				"FIELDCOMMONTYPE" : "String",
				"FIELDMODIFIERTYPE" : [ "private" ],
				"FIELDDECLARATION" : [ "description" ],
				"FIELDDATATYPE" : "String",
				"FIELDACCESSSPECIFIER" : "PRIVATE"
			} ],
			"CLASSORINTERFACEDETAIL" : [ {
				"CLASSACCESSSPECIFIER" : "PUBLIC",
				"NUMBEROFMETHODCALLS" : 0,
				"EXTENDSFROM" : [ ],
				"IMPLEMENTSFROM" : [ ],
				"CLASSNAME" : "Product",
				"ISINTERFACEORNOT" : false,
				"CLASSTYPEPARAMS" : [ ],
				"ISABSTRACTORNOT" : true,
				"CLASSMODIFIERTYPE" : [ "public", "abstract" ]
			} ],
			"CONSTRUCTORDETAIL" : [ {
				"CONSTRUCTORMODIFIER" : [ "public" ],
				"CONSTRUCTORPARAMETER" : [ ]
			} ],
			"VARIABLEDETAIL" : [ ],
			"METHODDETAIL" : [ {
				"METHODNAME" : "getName",
				"NUMBEROFINCOMINGMETHODS" : 0,
				"INCOMINGMETHOD" : [ ],
				"METHODMODIFIERTYPE" : [ "public" ],
				"METHODBODYLINETYPE" : [ "RETURN" ],
				"NUMBEROFMETHODVARIABLES" : 0,
				"NUMBEROFOUTGOINGMETHODS" : 0,
				"METHODRETURNTYPE" : "String",
				"METHODOVERRIDE" : [ ],
				"OUTGOINGMETHOD" : [ ],
				"NUMBEROFMETHODLINES" : 1,
				"METHODPARAMETER" : [ ]
			}, {
				"METHODNAME" : "setName",
				"NUMBEROFINCOMINGMETHODS" : 0,
				"INCOMINGMETHOD" : [ ],
				"METHODMODIFIERTYPE" : [ "public" ],
				"METHODBODYLINETYPE" : [ "EXPRESSION" ],
				"NUMBEROFMETHODVARIABLES" : 0,
				"NUMBEROFOUTGOINGMETHODS" : 0,
				"METHODRETURNTYPE" : "void",
				"METHODOVERRIDE" : [ ],
				"OUTGOINGMETHOD" : [ ],
				"NUMBEROFMETHODLINES" : 1,
				"METHODPARAMETER" : [ {
					"PARAMETERNAME" : "name",
					"PARAMETERTYPE" : "String"
				} ]
			}, {
				"METHODNAME" : "getDescription",
				"NUMBEROFINCOMINGMETHODS" : 0,
				"INCOMINGMETHOD" : [ ],
				"METHODMODIFIERTYPE" : [ "public" ],
				"METHODBODYLINETYPE" : [ "RETURN" ],
				"NUMBEROFMETHODVARIABLES" : 0,
				"NUMBEROFOUTGOINGMETHODS" : 0,
				"METHODRETURNTYPE" : "String",
				"METHODOVERRIDE" : [ ],
				"OUTGOINGMETHOD" : [ ],
				"NUMBEROFMETHODLINES" : 1,
				"METHODPARAMETER" : [ ]
			}, {
				"METHODNAME" : "setDescription",
				"NUMBEROFINCOMINGMETHODS" : 0,
				"INCOMINGMETHOD" : [ ],
				"METHODMODIFIERTYPE" : [ "public" ],
				"METHODBODYLINETYPE" : [ "EXPRESSION" ],
				"NUMBEROFMETHODVARIABLES" : 0,
				"NUMBEROFOUTGOINGMETHODS" : 0,
				"METHODRETURNTYPE" : "void",
				"METHODOVERRIDE" : [ ],
				"OUTGOINGMETHOD" : [ ],
				"NUMBEROFMETHODLINES" : 1,
				"METHODPARAMETER" : [ {
					"PARAMETERNAME" : "description",
					"PARAMETERTYPE" : "String"
				} ]
			}, {
				"METHODNAME" : "getInformation",
				"NUMBEROFINCOMINGMETHODS" : 0,
				"INCOMINGMETHOD" : [ ],
				"METHODMODIFIERTYPE" : [ "public", "abstract" ],
				"METHODBODYLINETYPE" : [ ],
				"NUMBEROFMETHODVARIABLES" : 0,
				"NUMBEROFOUTGOINGMETHODS" : 0,
				"METHODRETURNTYPE" : "String",
				"METHODOVERRIDE" : [ ],
				"OUTGOINGMETHOD" : [ ],
				"NUMBEROFMETHODLINES" : 0,
				"METHODPARAMETER" : [ ]
			} ]
		},
		"ConcreteFactoryOne" : {
			"FIELDDETAIL" : [ ],
			"CLASSORINTERFACEDETAIL" : [ {
				"CLASSACCESSSPECIFIER" : "PUBLIC",
				"NUMBEROFMETHODCALLS" : 0,
				"EXTENDSFROM" : [ "Factory" ],
				"IMPLEMENTSFROM" : [ ],
				"CLASSNAME" : "ConcreteFactoryOne",
				"ISINTERFACEORNOT" : false,
				"CLASSTYPEPARAMS" : [ ],
				"ISABSTRACTORNOT" : false,
				"CLASSMODIFIERTYPE" : [ "public" ]
			} ],
			"CONSTRUCTORDETAIL" : [ ],
			"VARIABLEDETAIL" : [ ],
			"METHODDETAIL" : [ {
				"METHODNAME" : "createProduct",
				"NUMBEROFINCOMINGMETHODS" : 0,
				"INCOMINGMETHOD" : [ ],
				"METHODMODIFIERTYPE" : [ "public" ],
				"METHODBODYLINETYPE" : [ "RETURN" ],
				"NUMBEROFMETHODVARIABLES" : 0,
				"NUMBEROFOUTGOINGMETHODS" : 0,
				"METHODRETURNTYPE" : "Product",
				"METHODOVERRIDE" : [ "@Override" ],
				"OUTGOINGMETHOD" : [ ],
				"NUMBEROFMETHODLINES" : 1,
				"METHODPARAMETER" : [ {
					"PARAMETERNAME" : "productType",
					"PARAMETERTYPE" : "String"
				} ]
			} ]
		}
	},
	"final_summary" : "FactoryTestDrive.java: FactoryTestDrive does not have any design pattern.  It is a public class. The only method of FactoryTestDrive is main (void). No methods call main and main calls 4 methods : getInformation method of class productCreated, createProduct method of class factory, println method of class out and println method of class PrintStream.\n\n\nConcreteProductOne.java: ConcreteProductOne does not have any design pattern.  It is a public class that extends Product. The only method of ConcreteProductOne is getInformation (String). No methods call getInformation and getInformation calls 2 methods : getDescription method of class UNKNOWN and getName method of class UNKNOWN.\n\n\nConcreteProductTwo.java: ConcreteProductTwo does not have any design pattern.  It is a public class that extends Product. The only method of ConcreteProductTwo is getInformation (String). No methods call getInformation and getInformation calls 2 methods : getDescription method of class UNKNOWN and getName method of class UNKNOWN.\n\n\nConcreteFactoryTwo.java: ConcreteFactoryTwo does not have any design pattern.  It is a public class that extends Factory. The only method of ConcreteFactoryTwo is createProduct (Product). No methods call createProduct and createProduct calls no methods.\n\n\nFactory.java: Factory does not have any design pattern.  It is a public abstract class. The only method of Factory is createProduct (Product). No methods call createProduct and createProduct calls no methods.\n\n\nProduct.java: Product does not have any design pattern.  It is a public abstract class. The 5 methods of Product are getName (String), setName (void), getDescription (String), setDescription (void) and getInformation (String). No methods call getName and getName calls no methods. No methods call setName and setName calls no methods. No methods call getDescription and getDescription calls no methods. No methods call setDescription and setDescription calls no methods. No methods call getInformation and getInformation calls no methods.\n\n\nConcreteFactoryOne.java: ConcreteFactoryOne does not have any design pattern.  It is a public class that extends Factory. The only method of ConcreteFactoryOne is createProduct (Product). No methods call createProduct and createProduct calls no methods.\n\n\n",
	"design_pattern" : [ ],
	"summary_NLG" : { }
}