{
	"final_summary" : "Decorator.java: Decorator does not have any design pattern.  It is a public class that extends Component. The 3 methods of Decorator are operation (void), operation (void) and addedBehavior (void). No methods call operation and operation calls only one method : operation method of class component. No methods call operation and operation calls only one method : operation method of class component. No methods call addedBehavior and addedBehavior calls no methods.\n\n\nChanger.java: decorator: Changer acts as a decorator for component Transform, which is inherited by Airplane, Robot. It is a public class that extends Transform and that implements Transform. The only method of Changer is move (void). No methods call move and move calls only one method : move method of class Transform.\n\n facade: Changer acts as a facade for subsystem Transform, which move calls move method of Transform. It is a public class that extends Transform and that implements Transform. The only method of Changer is move (void). No methods call move and move calls only one method : move method of class Transform.\n\n\nAirplane.java: decorator: Airplane acts as a decorator for decorator Changer. It is a public class that extends Changer. The only method of Airplane is fly (void). No methods call fly and fly calls only one method : println method of class PrintStream.\n\n\nCar.java: decorator: Car acts as a component for decorator Changer. It is a public final class that extends Transform and that implements Transform. The only method of Car is move (void). No methods call move and move calls only one method : println method of class PrintStream.\n\n\nAdvancedCipher.java: decorator: AdvancedCipher acts as a decorator for decorator CipherDecorator. It is a public class that extends CipherDecorator. The 2 methods of AdvancedCipher are encrypt (String) and mod (String). No methods call encrypt and encrypt calls 2 methods : encrypt method of class CipherDecorator and mod method of class AdvancedCipher. Only one method ( encrypt method of class AdvancedCipher ) calls mod and mod calls 3 methods : valueOf method of class String, charAt method of class String and length method of class String.\n\n\nCipher.java: decorator: Cipher acts as a component for CipherDecorator, which is inherited by SimpleCipher. It is a public interface. The only method of Cipher is encrypt (String). 2 methods ( encrypt method of class CipherDecorator and main method of class Client ) call encrypt and encrypt calls no methods.\n\n\nClient.java: Client does not have any design pattern.  It is a public class. The only method of Client is main (void). No methods call main and main calls 2 methods : encrypt method of class Cipher and println method of class PrintStream.\n\n\nTransform.java: decorator: Transform acts as a component for Changer, which is inherited by Car. It is a public interface. The only method of Transform is move (void). Only one method ( move method of class Changer ) calls move and move calls no methods.\n\n facade: Transform acts as a subsystem for facade Changer, which move method of Changer calls move. It is a public interface. The only method of Transform is move (void). Only one method ( move method of class Changer ) calls move and move calls no methods.\n\n\nCipherDecorator.java: decorator: CipherDecorator acts as a decorator for component Cipher, which is inherited by AdvancedCipher, ComplexCipher. It is a public class that extends Cipher and that implements Cipher. The only method of CipherDecorator is encrypt (String). 2 methods ( encrypt method of class ComplexCipher and encrypt method of class AdvancedCipher ) call encrypt and encrypt calls only one method : encrypt method of class Cipher.\n\n\nRobot.java: decorator: Robot acts as a decorator for decorator Changer. It is a public class that extends Changer. The only method of Robot is say (void). No methods call say and say calls only one method : println method of class PrintStream.\n\n\nSimpleCipher.java: decorator: SimpleCipher acts as a component for decorator CipherDecorator. It is a public final class that extends Cipher and that implements Cipher. The only method of SimpleCipher is encrypt (String). No methods call encrypt and encrypt calls 2 methods : charAt method of class String and length method of class String.\n\n\nComplexCipher.java: decorator: ComplexCipher acts as a decorator for decorator CipherDecorator. It is a public class that extends CipherDecorator. The 2 methods of ComplexCipher are encrypt (String) and reverse (String). No methods call encrypt and encrypt calls 2 methods : reverse method of class ComplexCipher and encrypt method of class CipherDecorator. Only one method ( encrypt method of class ComplexCipher ) calls reverse and reverse calls 2 methods : length method of class String and substring method of class String.\n\n\n",
	"design_pattern" : [ {
		"decorator" : {
			"Changer" : {
				"component" : {
					"Transform" : {
						"concrete_component" : [ "Car" ]
					}
				},
				"concrete_decorator" : [ "Airplane", "Robot" ]
			},
			"CipherDecorator" : {
				"component" : {
					"Cipher" : {
						"concrete_component" : [ "SimpleCipher" ]
					}
				},
				"concrete_decorator" : [ "AdvancedCipher", "ComplexCipher" ]
			}
		}
	}, {
		"facade" : {
			"Changer" : [ "Transform" ]
		}
	} ],
	"quanke-Chapter 13 Decorator" : {
		"Decorator" : {
			"FIELDDETAIL" : [ {
				"FIELDCOMMONTYPE" : "Component",
				"FIELDMODIFIERTYPE" : [ "private" ],
				"FIELDDECLARATION" : [ "component" ],
				"FIELDDATATYPE" : "Component",
				"FIELDACCESSSPECIFIER" : "PRIVATE"
			} ],
			"CLASSORINTERFACEDETAIL" : [ {
				"CLASSACCESSSPECIFIER" : "PUBLIC",
				"NUMBEROFMETHODCALLS" : 1,
				"EXTENDSFROM" : [ "Component" ],
				"IMPLEMENTSFROM" : [ ],
				"CLASSNAME" : "Decorator",
				"ISINTERFACEORNOT" : false,
				"CLASSTYPEPARAMS" : [ ],
				"ISABSTRACTORNOT" : false,
				"CLASSMODIFIERTYPE" : [ "public" ]
			}, {
				"CLASSACCESSSPECIFIER" : "PUBLIC",
				"NUMBEROFMETHODCALLS" : 2,
				"EXTENDSFROM" : [ "Decorator" ],
				"IMPLEMENTSFROM" : [ ],
				"CLASSNAME" : "ConcreteDecorator",
				"ISINTERFACEORNOT" : false,
				"CLASSTYPEPARAMS" : [ ],
				"ISABSTRACTORNOT" : false,
				"CLASSMODIFIERTYPE" : [ "public" ]
			} ],
			"CONSTRUCTORDETAIL" : [ {
				"CONSTRUCTORMODIFIER" : [ "public" ],
				"CONSTRUCTORPARAMETER" : [ {
					"PARAMETERNAME" : "component",
					"PARAMETERTYPE" : "Component"
				} ]
			}, {
				"CONSTRUCTORMODIFIER" : [ "public" ],
				"CONSTRUCTORPARAMETER" : [ {
					"PARAMETERNAME" : "component",
					"PARAMETERTYPE" : "Component"
				} ]
			} ],
			"VARIABLEDETAIL" : [ ],
			"METHODDETAIL" : [ {
				"METHODNAME" : "operation",
				"NUMBEROFINCOMINGMETHODS" : 0,
				"INCOMINGMETHOD" : [ ],
				"METHODMODIFIERTYPE" : [ "public" ],
				"METHODBODYLINETYPE" : [ "EXPRESSION" ],
				"NUMBEROFMETHODVARIABLES" : 0,
				"NUMBEROFOUTGOINGMETHODS" : 1,
				"METHODRETURNTYPE" : "void",
				"METHODOVERRIDE" : [ ],
				"OUTGOINGMETHOD" : [ {
					"CALLEECLASS" : "component",
					"CALLEEMETHODNAME" : "operation"
				} ],
				"NUMBEROFMETHODLINES" : 1,
				"METHODPARAMETER" : [ ]
			}, {
				"METHODNAME" : "operation",
				"NUMBEROFINCOMINGMETHODS" : 0,
				"INCOMINGMETHOD" : [ ],
				"METHODMODIFIERTYPE" : [ "public" ],
				"METHODBODYLINETYPE" : [ "EXPRESSION", "EXPRESSION" ],
				"NUMBEROFMETHODVARIABLES" : 0,
				"NUMBEROFOUTGOINGMETHODS" : 2,
				"METHODRETURNTYPE" : "void",
				"METHODOVERRIDE" : [ ],
				"OUTGOINGMETHOD" : [ {
					"CALLEECLASS" : "component",
					"CALLEEMETHODNAME" : "operation"
				} ],
				"NUMBEROFMETHODLINES" : 2,
				"METHODPARAMETER" : [ ]
			}, {
				"METHODNAME" : "addedBehavior",
				"NUMBEROFINCOMINGMETHODS" : 0,
				"INCOMINGMETHOD" : [ ],
				"METHODMODIFIERTYPE" : [ "public" ],
				"METHODBODYLINETYPE" : [ ],
				"NUMBEROFMETHODVARIABLES" : 0,
				"NUMBEROFOUTGOINGMETHODS" : 0,
				"METHODRETURNTYPE" : "void",
				"METHODOVERRIDE" : [ ],
				"OUTGOINGMETHOD" : [ ],
				"NUMBEROFMETHODLINES" : 0,
				"METHODPARAMETER" : [ ]
			} ]
		},
		"Changer" : {
			"FIELDDETAIL" : [ {
				"FIELDCOMMONTYPE" : "Transform",
				"FIELDMODIFIERTYPE" : [ "private" ],
				"FIELDDECLARATION" : [ "transform" ],
				"FIELDDATATYPE" : "Transform",
				"FIELDACCESSSPECIFIER" : "PRIVATE"
			} ],
			"CLASSORINTERFACEDETAIL" : [ {
				"CLASSACCESSSPECIFIER" : "PUBLIC",
				"NUMBEROFMETHODCALLS" : 1,
				"EXTENDSFROM" : [ "Transform" ],
				"IMPLEMENTSFROM" : [ "Transform" ],
				"CLASSNAME" : "Changer",
				"ISINTERFACEORNOT" : false,
				"CLASSTYPEPARAMS" : [ ],
				"ISABSTRACTORNOT" : false,
				"CLASSMODIFIERTYPE" : [ "public" ]
			} ],
			"CONSTRUCTORDETAIL" : [ {
				"CONSTRUCTORMODIFIER" : [ "public" ],
				"CONSTRUCTORPARAMETER" : [ {
					"PARAMETERNAME" : "transform",
					"PARAMETERTYPE" : "Transform"
				} ]
			} ],
			"VARIABLEDETAIL" : [ ],
			"METHODDETAIL" : [ {
				"METHODNAME" : "move",
				"NUMBEROFINCOMINGMETHODS" : 0,
				"INCOMINGMETHOD" : [ ],
				"METHODMODIFIERTYPE" : [ "public" ],
				"METHODBODYLINETYPE" : [ "EXPRESSION" ],
				"NUMBEROFMETHODVARIABLES" : 0,
				"NUMBEROFOUTGOINGMETHODS" : 1,
				"METHODRETURNTYPE" : "void",
				"METHODOVERRIDE" : [ ],
				"OUTGOINGMETHOD" : [ {
					"CALLEECLASS" : "Transform",
					"CALLEEMETHODNAME" : "move"
				}, {
					"CALLEECLASS" : "Transform",
					"CALLEEMETHODNAME" : "move"
				} ],
				"NUMBEROFMETHODLINES" : 1,
				"METHODPARAMETER" : [ ]
			} ]
		},
		"Airplane" : {
			"FIELDDETAIL" : [ ],
			"CLASSORINTERFACEDETAIL" : [ {
				"CLASSACCESSSPECIFIER" : "PUBLIC",
				"NUMBEROFMETHODCALLS" : 2,
				"EXTENDSFROM" : [ "Changer" ],
				"IMPLEMENTSFROM" : [ ],
				"CLASSNAME" : "Airplane",
				"ISINTERFACEORNOT" : false,
				"CLASSTYPEPARAMS" : [ ],
				"ISABSTRACTORNOT" : false,
				"CLASSMODIFIERTYPE" : [ "public" ]
			} ],
			"CONSTRUCTORDETAIL" : [ {
				"CONSTRUCTORMODIFIER" : [ "public" ],
				"CONSTRUCTORPARAMETER" : [ {
					"PARAMETERNAME" : "transform",
					"PARAMETERTYPE" : "Transform"
				} ]
			} ],
			"VARIABLEDETAIL" : [ ],
			"METHODDETAIL" : [ {
				"METHODNAME" : "fly",
				"NUMBEROFINCOMINGMETHODS" : 0,
				"INCOMINGMETHOD" : [ ],
				"METHODMODIFIERTYPE" : [ "public" ],
				"METHODBODYLINETYPE" : [ "EXPRESSION" ],
				"NUMBEROFMETHODVARIABLES" : 0,
				"NUMBEROFOUTGOINGMETHODS" : 1,
				"METHODRETURNTYPE" : "void",
				"METHODOVERRIDE" : [ ],
				"OUTGOINGMETHOD" : [ {
					"CALLEECLASS" : "PrintStream",
					"CALLEEMETHODNAME" : "println"
				} ],
				"NUMBEROFMETHODLINES" : 1,
				"METHODPARAMETER" : [ ]
			} ]
		},
		"Car" : {
			"FIELDDETAIL" : [ ],
			"CLASSORINTERFACEDETAIL" : [ {
				"CLASSACCESSSPECIFIER" : "PUBLIC",
				"NUMBEROFMETHODCALLS" : 2,
				"EXTENDSFROM" : [ "Transform" ],
				"IMPLEMENTSFROM" : [ "Transform" ],
				"CLASSNAME" : "Car",
				"ISINTERFACEORNOT" : false,
				"CLASSTYPEPARAMS" : [ ],
				"ISABSTRACTORNOT" : false,
				"CLASSMODIFIERTYPE" : [ "public", "final" ]
			} ],
			"CONSTRUCTORDETAIL" : [ {
				"CONSTRUCTORMODIFIER" : [ "public" ],
				"CONSTRUCTORPARAMETER" : [ ]
			} ],
			"VARIABLEDETAIL" : [ ],
			"METHODDETAIL" : [ {
				"METHODNAME" : "move",
				"NUMBEROFINCOMINGMETHODS" : 0,
				"INCOMINGMETHOD" : [ ],
				"METHODMODIFIERTYPE" : [ "public" ],
				"METHODBODYLINETYPE" : [ "EXPRESSION" ],
				"NUMBEROFMETHODVARIABLES" : 0,
				"NUMBEROFOUTGOINGMETHODS" : 1,
				"METHODRETURNTYPE" : "void",
				"METHODOVERRIDE" : [ ],
				"OUTGOINGMETHOD" : [ {
					"CALLEECLASS" : "PrintStream",
					"CALLEEMETHODNAME" : "println"
				} ],
				"NUMBEROFMETHODLINES" : 1,
				"METHODPARAMETER" : [ ]
			} ]
		},
		"AdvancedCipher" : {
			"FIELDDETAIL" : [ ],
			"CLASSORINTERFACEDETAIL" : [ {
				"CLASSACCESSSPECIFIER" : "PUBLIC",
				"NUMBEROFMETHODCALLS" : 5,
				"EXTENDSFROM" : [ "CipherDecorator" ],
				"IMPLEMENTSFROM" : [ ],
				"CLASSNAME" : "AdvancedCipher",
				"ISINTERFACEORNOT" : false,
				"CLASSTYPEPARAMS" : [ ],
				"ISABSTRACTORNOT" : false,
				"CLASSMODIFIERTYPE" : [ "public" ]
			} ],
			"CONSTRUCTORDETAIL" : [ {
				"CONSTRUCTORMODIFIER" : [ "public" ],
				"CONSTRUCTORPARAMETER" : [ {
					"PARAMETERNAME" : "cipher",
					"PARAMETERTYPE" : "Cipher"
				} ]
			} ],
			"VARIABLEDETAIL" : [ {
				"VARIABLEDECLARATION" : [ "result = super.encrypt(plainText)" ],
				"VARIABLECOMMONTYPE" : "String",
				"VARIABLEELEMENTTYPE" : "String"
			}, {
				"VARIABLEDECLARATION" : [ "str = \"\"" ],
				"VARIABLECOMMONTYPE" : "String",
				"VARIABLEELEMENTTYPE" : "String"
			}, {
				"VARIABLEDECLARATION" : [ "c = String.valueOf(text.charAt(i) % 6)" ],
				"VARIABLECOMMONTYPE" : "String",
				"VARIABLEELEMENTTYPE" : "String"
			}, {
				"VARIABLEDECLARATION" : [ "i = 0" ],
				"VARIABLECOMMONTYPE" : "int",
				"VARIABLEELEMENTTYPE" : "int"
			} ],
			"METHODDETAIL" : [ {
				"METHODNAME" : "encrypt",
				"NUMBEROFINCOMINGMETHODS" : 0,
				"INCOMINGMETHOD" : [ ],
				"METHODMODIFIERTYPE" : [ "public" ],
				"METHODBODYLINETYPE" : [ "EXPRESSION", "EXPRESSION", "RETURN" ],
				"NUMBEROFMETHODVARIABLES" : 1,
				"NUMBEROFOUTGOINGMETHODS" : 2,
				"METHODRETURNTYPE" : "String",
				"METHODOVERRIDE" : [ ],
				"OUTGOINGMETHOD" : [ {
					"CALLEECLASS" : "CipherDecorator",
					"CALLEEMETHODNAME" : "encrypt"
				}, {
					"CALLEECLASS" : "AdvancedCipher",
					"CALLEEMETHODNAME" : "mod"
				}, {
					"CALLEECLASS" : "CipherDecorator",
					"CALLEEMETHODNAME" : "encrypt"
				}, {
					"CALLEECLASS" : "AdvancedCipher",
					"CALLEEMETHODNAME" : "mod"
				} ],
				"NUMBEROFMETHODLINES" : 3,
				"METHODPARAMETER" : [ {
					"PARAMETERNAME" : "plainText",
					"PARAMETERTYPE" : "String"
				} ]
			}, {
				"METHODNAME" : "mod",
				"NUMBEROFINCOMINGMETHODS" : 2,
				"INCOMINGMETHOD" : [ {
					"CALLEDMETHODNAME" : "encrypt",
					"CALLEDCLASS" : "AdvancedCipher"
				}, {
					"CALLEDMETHODNAME" : "encrypt",
					"CALLEDCLASS" : "AdvancedCipher"
				} ],
				"METHODMODIFIERTYPE" : [ "public" ],
				"METHODBODYLINETYPE" : [ "EXPRESSION", "LOOP", "RETURN" ],
				"NUMBEROFMETHODVARIABLES" : 1,
				"NUMBEROFOUTGOINGMETHODS" : 3,
				"METHODRETURNTYPE" : "String",
				"METHODOVERRIDE" : [ ],
				"OUTGOINGMETHOD" : [ {
					"CALLEECLASS" : "String",
					"CALLEEMETHODNAME" : "length"
				}, {
					"CALLEECLASS" : "String",
					"CALLEEMETHODNAME" : "valueOf"
				}, {
					"CALLEECLASS" : "String",
					"CALLEEMETHODNAME" : "charAt"
				} ],
				"NUMBEROFMETHODLINES" : 3,
				"METHODPARAMETER" : [ {
					"PARAMETERNAME" : "text",
					"PARAMETERTYPE" : "String"
				} ]
			} ]
		},
		"Cipher" : {
			"FIELDDETAIL" : [ ],
			"CLASSORINTERFACEDETAIL" : [ {
				"CLASSACCESSSPECIFIER" : "PUBLIC",
				"NUMBEROFMETHODCALLS" : 0,
				"EXTENDSFROM" : [ ],
				"IMPLEMENTSFROM" : [ ],
				"CLASSNAME" : "Cipher",
				"ISINTERFACEORNOT" : true,
				"CLASSTYPEPARAMS" : [ ],
				"ISABSTRACTORNOT" : false,
				"CLASSMODIFIERTYPE" : [ "public" ]
			} ],
			"CONSTRUCTORDETAIL" : [ ],
			"VARIABLEDETAIL" : [ ],
			"METHODDETAIL" : [ {
				"METHODNAME" : "encrypt",
				"NUMBEROFINCOMINGMETHODS" : 14,
				"INCOMINGMETHOD" : [ {
					"CALLEDMETHODNAME" : "main",
					"CALLEDCLASS" : "Client"
				}, {
					"CALLEDMETHODNAME" : "main",
					"CALLEDCLASS" : "Client"
				}, {
					"CALLEDMETHODNAME" : "main",
					"CALLEDCLASS" : "Client"
				}, {
					"CALLEDMETHODNAME" : "main",
					"CALLEDCLASS" : "Client"
				}, {
					"CALLEDMETHODNAME" : "main",
					"CALLEDCLASS" : "Client"
				}, {
					"CALLEDMETHODNAME" : "main",
					"CALLEDCLASS" : "Client"
				}, {
					"CALLEDMETHODNAME" : "encrypt",
					"CALLEDCLASS" : "CipherDecorator"
				}, {
					"CALLEDMETHODNAME" : "encrypt",
					"CALLEDCLASS" : "CipherDecorator"
				}, {
					"CALLEDMETHODNAME" : "main",
					"CALLEDCLASS" : "Client"
				}, {
					"CALLEDMETHODNAME" : "main",
					"CALLEDCLASS" : "Client"
				}, {
					"CALLEDMETHODNAME" : "main",
					"CALLEDCLASS" : "Client"
				}, {
					"CALLEDMETHODNAME" : "main",
					"CALLEDCLASS" : "Client"
				}, {
					"CALLEDMETHODNAME" : "main",
					"CALLEDCLASS" : "Client"
				}, {
					"CALLEDMETHODNAME" : "main",
					"CALLEDCLASS" : "Client"
				} ],
				"METHODMODIFIERTYPE" : [ "public" ],
				"METHODBODYLINETYPE" : [ ],
				"NUMBEROFMETHODVARIABLES" : 0,
				"NUMBEROFOUTGOINGMETHODS" : 0,
				"METHODRETURNTYPE" : "String",
				"METHODOVERRIDE" : [ ],
				"OUTGOINGMETHOD" : [ ],
				"NUMBEROFMETHODLINES" : 0,
				"METHODPARAMETER" : [ {
					"PARAMETERNAME" : "plainText",
					"PARAMETERTYPE" : "String"
				} ]
			} ]
		},
		"Client" : {
			"FIELDDETAIL" : [ ],
			"CLASSORINTERFACEDETAIL" : [ {
				"CLASSACCESSSPECIFIER" : "PUBLIC",
				"NUMBEROFMETHODCALLS" : 9,
				"EXTENDSFROM" : [ ],
				"IMPLEMENTSFROM" : [ ],
				"CLASSNAME" : "Client",
				"ISINTERFACEORNOT" : false,
				"CLASSTYPEPARAMS" : [ ],
				"ISABSTRACTORNOT" : false,
				"CLASSMODIFIERTYPE" : [ "public" ]
			} ],
			"CONSTRUCTORDETAIL" : [ ],
			"VARIABLEDETAIL" : [ {
				"VARIABLEDECLARATION" : [ "password = \"sunnyLiu\"" ],
				"VARIABLECOMMONTYPE" : "String",
				"VARIABLEELEMENTTYPE" : "String"
			}, {
				"VARIABLEDECLARATION" : [ "cpassword" ],
				"VARIABLECOMMONTYPE" : "String",
				"VARIABLEELEMENTTYPE" : "String"
			}, {
				"VARIABLEDECLARATION" : [ "sc", "ac", "cc" ],
				"VARIABLECOMMONTYPE" : "Cipher",
				"VARIABLEELEMENTTYPE" : "Cipher"
			} ],
			"METHODDETAIL" : [ {
				"METHODNAME" : "main",
				"NUMBEROFINCOMINGMETHODS" : 0,
				"INCOMINGMETHOD" : [ ],
				"METHODMODIFIERTYPE" : [ "public", "static" ],
				"METHODBODYLINETYPE" : [ "EXPRESSION", "EXPRESSION", "EXPRESSION", "EXPRESSION", "EXPRESSION", "EXPRESSION", "EXPRESSION", "EXPRESSION", "EXPRESSION", "EXPRESSION", "EXPRESSION", "EXPRESSION", "EXPRESSION", "EXPRESSION", "EXPRESSION" ],
				"NUMBEROFMETHODVARIABLES" : 5,
				"NUMBEROFOUTGOINGMETHODS" : 9,
				"METHODRETURNTYPE" : "void",
				"METHODOVERRIDE" : [ ],
				"OUTGOINGMETHOD" : [ {
					"CALLEECLASS" : "Cipher",
					"CALLEEMETHODNAME" : "encrypt"
				}, {
					"CALLEECLASS" : "PrintStream",
					"CALLEEMETHODNAME" : "println"
				}, {
					"CALLEECLASS" : "PrintStream",
					"CALLEEMETHODNAME" : "println"
				}, {
					"CALLEECLASS" : "Cipher",
					"CALLEEMETHODNAME" : "encrypt"
				}, {
					"CALLEECLASS" : "PrintStream",
					"CALLEEMETHODNAME" : "println"
				}, {
					"CALLEECLASS" : "PrintStream",
					"CALLEEMETHODNAME" : "println"
				}, {
					"CALLEECLASS" : "Cipher",
					"CALLEEMETHODNAME" : "encrypt"
				}, {
					"CALLEECLASS" : "PrintStream",
					"CALLEEMETHODNAME" : "println"
				}, {
					"CALLEECLASS" : "PrintStream",
					"CALLEEMETHODNAME" : "println"
				}, {
					"CALLEECLASS" : "Cipher",
					"CALLEEMETHODNAME" : "encrypt"
				}, {
					"CALLEECLASS" : "PrintStream",
					"CALLEEMETHODNAME" : "println"
				}, {
					"CALLEECLASS" : "PrintStream",
					"CALLEEMETHODNAME" : "println"
				}, {
					"CALLEECLASS" : "Cipher",
					"CALLEEMETHODNAME" : "encrypt"
				}, {
					"CALLEECLASS" : "PrintStream",
					"CALLEEMETHODNAME" : "println"
				}, {
					"CALLEECLASS" : "PrintStream",
					"CALLEEMETHODNAME" : "println"
				}, {
					"CALLEECLASS" : "Cipher",
					"CALLEEMETHODNAME" : "encrypt"
				}, {
					"CALLEECLASS" : "PrintStream",
					"CALLEEMETHODNAME" : "println"
				}, {
					"CALLEECLASS" : "PrintStream",
					"CALLEEMETHODNAME" : "println"
				}, {
					"CALLEECLASS" : "Cipher",
					"CALLEEMETHODNAME" : "encrypt"
				}, {
					"CALLEECLASS" : "Cipher",
					"CALLEEMETHODNAME" : "encrypt"
				}, {
					"CALLEECLASS" : "Cipher",
					"CALLEEMETHODNAME" : "encrypt"
				}, {
					"CALLEECLASS" : "Cipher",
					"CALLEEMETHODNAME" : "encrypt"
				}, {
					"CALLEECLASS" : "Cipher",
					"CALLEEMETHODNAME" : "encrypt"
				}, {
					"CALLEECLASS" : "Cipher",
					"CALLEEMETHODNAME" : "encrypt"
				} ],
				"NUMBEROFMETHODLINES" : 15,
				"METHODPARAMETER" : [ {
					"PARAMETERNAME" : "args",
					"PARAMETERTYPE" : "String[]"
				} ]
			} ]
		},
		"Transform" : {
			"FIELDDETAIL" : [ ],
			"CLASSORINTERFACEDETAIL" : [ {
				"CLASSACCESSSPECIFIER" : "PUBLIC",
				"NUMBEROFMETHODCALLS" : 0,
				"EXTENDSFROM" : [ ],
				"IMPLEMENTSFROM" : [ ],
				"CLASSNAME" : "Transform",
				"ISINTERFACEORNOT" : true,
				"CLASSTYPEPARAMS" : [ ],
				"ISABSTRACTORNOT" : false,
				"CLASSMODIFIERTYPE" : [ "public" ]
			} ],
			"CONSTRUCTORDETAIL" : [ ],
			"VARIABLEDETAIL" : [ ],
			"METHODDETAIL" : [ {
				"METHODNAME" : "move",
				"NUMBEROFINCOMINGMETHODS" : 2,
				"INCOMINGMETHOD" : [ {
					"CALLEDMETHODNAME" : "move",
					"CALLEDCLASS" : "Changer"
				}, {
					"CALLEDMETHODNAME" : "move",
					"CALLEDCLASS" : "Changer"
				} ],
				"METHODMODIFIERTYPE" : [ "public" ],
				"METHODBODYLINETYPE" : [ ],
				"NUMBEROFMETHODVARIABLES" : 0,
				"NUMBEROFOUTGOINGMETHODS" : 0,
				"METHODRETURNTYPE" : "void",
				"METHODOVERRIDE" : [ ],
				"OUTGOINGMETHOD" : [ ],
				"NUMBEROFMETHODLINES" : 0,
				"METHODPARAMETER" : [ ]
			} ]
		},
		"CipherDecorator" : {
			"FIELDDETAIL" : [ {
				"FIELDCOMMONTYPE" : "Cipher",
				"FIELDMODIFIERTYPE" : [ "private" ],
				"FIELDDECLARATION" : [ "cipher" ],
				"FIELDDATATYPE" : "Cipher",
				"FIELDACCESSSPECIFIER" : "PRIVATE"
			} ],
			"CLASSORINTERFACEDETAIL" : [ {
				"CLASSACCESSSPECIFIER" : "PUBLIC",
				"NUMBEROFMETHODCALLS" : 1,
				"EXTENDSFROM" : [ "Cipher" ],
				"IMPLEMENTSFROM" : [ "Cipher" ],
				"CLASSNAME" : "CipherDecorator",
				"ISINTERFACEORNOT" : false,
				"CLASSTYPEPARAMS" : [ ],
				"ISABSTRACTORNOT" : false,
				"CLASSMODIFIERTYPE" : [ "public" ]
			} ],
			"CONSTRUCTORDETAIL" : [ {
				"CONSTRUCTORMODIFIER" : [ "public" ],
				"CONSTRUCTORPARAMETER" : [ {
					"PARAMETERNAME" : "cipher",
					"PARAMETERTYPE" : "Cipher"
				} ]
			} ],
			"VARIABLEDETAIL" : [ ],
			"METHODDETAIL" : [ {
				"METHODNAME" : "encrypt",
				"NUMBEROFINCOMINGMETHODS" : 4,
				"INCOMINGMETHOD" : [ {
					"CALLEDMETHODNAME" : "encrypt",
					"CALLEDCLASS" : "ComplexCipher"
				}, {
					"CALLEDMETHODNAME" : "encrypt",
					"CALLEDCLASS" : "AdvancedCipher"
				}, {
					"CALLEDMETHODNAME" : "encrypt",
					"CALLEDCLASS" : "AdvancedCipher"
				}, {
					"CALLEDMETHODNAME" : "encrypt",
					"CALLEDCLASS" : "ComplexCipher"
				} ],
				"METHODMODIFIERTYPE" : [ "public" ],
				"METHODBODYLINETYPE" : [ "RETURN" ],
				"NUMBEROFMETHODVARIABLES" : 0,
				"NUMBEROFOUTGOINGMETHODS" : 1,
				"METHODRETURNTYPE" : "String",
				"METHODOVERRIDE" : [ ],
				"OUTGOINGMETHOD" : [ {
					"CALLEECLASS" : "Cipher",
					"CALLEEMETHODNAME" : "encrypt"
				}, {
					"CALLEECLASS" : "Cipher",
					"CALLEEMETHODNAME" : "encrypt"
				} ],
				"NUMBEROFMETHODLINES" : 1,
				"METHODPARAMETER" : [ {
					"PARAMETERNAME" : "plainText",
					"PARAMETERTYPE" : "String"
				} ]
			} ]
		},
		"Robot" : {
			"FIELDDETAIL" : [ ],
			"CLASSORINTERFACEDETAIL" : [ {
				"CLASSACCESSSPECIFIER" : "PUBLIC",
				"NUMBEROFMETHODCALLS" : 2,
				"EXTENDSFROM" : [ "Changer" ],
				"IMPLEMENTSFROM" : [ ],
				"CLASSNAME" : "Robot",
				"ISINTERFACEORNOT" : false,
				"CLASSTYPEPARAMS" : [ ],
				"ISABSTRACTORNOT" : false,
				"CLASSMODIFIERTYPE" : [ "public" ]
			} ],
			"CONSTRUCTORDETAIL" : [ {
				"CONSTRUCTORMODIFIER" : [ "public" ],
				"CONSTRUCTORPARAMETER" : [ {
					"PARAMETERNAME" : "transform",
					"PARAMETERTYPE" : "Transform"
				} ]
			} ],
			"VARIABLEDETAIL" : [ ],
			"METHODDETAIL" : [ {
				"METHODNAME" : "say",
				"NUMBEROFINCOMINGMETHODS" : 0,
				"INCOMINGMETHOD" : [ ],
				"METHODMODIFIERTYPE" : [ "public" ],
				"METHODBODYLINETYPE" : [ "EXPRESSION" ],
				"NUMBEROFMETHODVARIABLES" : 0,
				"NUMBEROFOUTGOINGMETHODS" : 1,
				"METHODRETURNTYPE" : "void",
				"METHODOVERRIDE" : [ ],
				"OUTGOINGMETHOD" : [ {
					"CALLEECLASS" : "PrintStream",
					"CALLEEMETHODNAME" : "println"
				} ],
				"NUMBEROFMETHODLINES" : 1,
				"METHODPARAMETER" : [ ]
			} ]
		},
		"SimpleCipher" : {
			"FIELDDETAIL" : [ ],
			"CLASSORINTERFACEDETAIL" : [ {
				"CLASSACCESSSPECIFIER" : "PUBLIC",
				"NUMBEROFMETHODCALLS" : 2,
				"EXTENDSFROM" : [ "Cipher" ],
				"IMPLEMENTSFROM" : [ "Cipher" ],
				"CLASSNAME" : "SimpleCipher",
				"ISINTERFACEORNOT" : false,
				"CLASSTYPEPARAMS" : [ ],
				"ISABSTRACTORNOT" : false,
				"CLASSMODIFIERTYPE" : [ "public", "final" ]
			} ],
			"CONSTRUCTORDETAIL" : [ ],
			"VARIABLEDETAIL" : [ {
				"VARIABLEDECLARATION" : [ "str = \"\"" ],
				"VARIABLECOMMONTYPE" : "String",
				"VARIABLEELEMENTTYPE" : "String"
			}, {
				"VARIABLEDECLARATION" : [ "c = plainText.charAt(i)" ],
				"VARIABLECOMMONTYPE" : "char",
				"VARIABLEELEMENTTYPE" : "char"
			}, {
				"VARIABLEDECLARATION" : [ "i = 0" ],
				"VARIABLECOMMONTYPE" : "int",
				"VARIABLEELEMENTTYPE" : "int"
			} ],
			"METHODDETAIL" : [ {
				"METHODNAME" : "encrypt",
				"NUMBEROFINCOMINGMETHODS" : 0,
				"INCOMINGMETHOD" : [ ],
				"METHODMODIFIERTYPE" : [ "public" ],
				"METHODBODYLINETYPE" : [ "EXPRESSION", "LOOP", "RETURN" ],
				"NUMBEROFMETHODVARIABLES" : 1,
				"NUMBEROFOUTGOINGMETHODS" : 2,
				"METHODRETURNTYPE" : "String",
				"METHODOVERRIDE" : [ ],
				"OUTGOINGMETHOD" : [ {
					"CALLEECLASS" : "String",
					"CALLEEMETHODNAME" : "length"
				}, {
					"CALLEECLASS" : "String",
					"CALLEEMETHODNAME" : "charAt"
				} ],
				"NUMBEROFMETHODLINES" : 3,
				"METHODPARAMETER" : [ {
					"PARAMETERNAME" : "plainText",
					"PARAMETERTYPE" : "String"
				} ]
			} ]
		},
		"ComplexCipher" : {
			"FIELDDETAIL" : [ ],
			"CLASSORINTERFACEDETAIL" : [ {
				"CLASSACCESSSPECIFIER" : "PUBLIC",
				"NUMBEROFMETHODCALLS" : 4,
				"EXTENDSFROM" : [ "CipherDecorator" ],
				"IMPLEMENTSFROM" : [ ],
				"CLASSNAME" : "ComplexCipher",
				"ISINTERFACEORNOT" : false,
				"CLASSTYPEPARAMS" : [ ],
				"ISABSTRACTORNOT" : false,
				"CLASSMODIFIERTYPE" : [ "public" ]
			} ],
			"CONSTRUCTORDETAIL" : [ {
				"CONSTRUCTORMODIFIER" : [ "public" ],
				"CONSTRUCTORPARAMETER" : [ {
					"PARAMETERNAME" : "cipher",
					"PARAMETERTYPE" : "Cipher"
				} ]
			} ],
			"VARIABLEDETAIL" : [ {
				"VARIABLEDECLARATION" : [ "result = super.encrypt(plainText)" ],
				"VARIABLECOMMONTYPE" : "String",
				"VARIABLEELEMENTTYPE" : "String"
			}, {
				"VARIABLEDECLARATION" : [ "str = \"\"" ],
				"VARIABLECOMMONTYPE" : "String",
				"VARIABLEELEMENTTYPE" : "String"
			}, {
				"VARIABLEDECLARATION" : [ "i = text.length()" ],
				"VARIABLECOMMONTYPE" : "int",
				"VARIABLEELEMENTTYPE" : "int"
			} ],
			"METHODDETAIL" : [ {
				"METHODNAME" : "encrypt",
				"NUMBEROFINCOMINGMETHODS" : 0,
				"INCOMINGMETHOD" : [ ],
				"METHODMODIFIERTYPE" : [ "public" ],
				"METHODBODYLINETYPE" : [ "EXPRESSION", "EXPRESSION", "RETURN" ],
				"NUMBEROFMETHODVARIABLES" : 1,
				"NUMBEROFOUTGOINGMETHODS" : 2,
				"METHODRETURNTYPE" : "String",
				"METHODOVERRIDE" : [ ],
				"OUTGOINGMETHOD" : [ {
					"CALLEECLASS" : "CipherDecorator",
					"CALLEEMETHODNAME" : "encrypt"
				}, {
					"CALLEECLASS" : "ComplexCipher",
					"CALLEEMETHODNAME" : "reverse"
				}, {
					"CALLEECLASS" : "CipherDecorator",
					"CALLEEMETHODNAME" : "encrypt"
				}, {
					"CALLEECLASS" : "ComplexCipher",
					"CALLEEMETHODNAME" : "reverse"
				} ],
				"NUMBEROFMETHODLINES" : 3,
				"METHODPARAMETER" : [ {
					"PARAMETERNAME" : "plainText",
					"PARAMETERTYPE" : "String"
				} ]
			}, {
				"METHODNAME" : "reverse",
				"NUMBEROFINCOMINGMETHODS" : 2,
				"INCOMINGMETHOD" : [ {
					"CALLEDMETHODNAME" : "encrypt",
					"CALLEDCLASS" : "ComplexCipher"
				}, {
					"CALLEDMETHODNAME" : "encrypt",
					"CALLEDCLASS" : "ComplexCipher"
				} ],
				"METHODMODIFIERTYPE" : [ "public" ],
				"METHODBODYLINETYPE" : [ "EXPRESSION", "LOOP", "RETURN" ],
				"NUMBEROFMETHODVARIABLES" : 1,
				"NUMBEROFOUTGOINGMETHODS" : 2,
				"METHODRETURNTYPE" : "String",
				"METHODOVERRIDE" : [ ],
				"OUTGOINGMETHOD" : [ {
					"CALLEECLASS" : "String",
					"CALLEEMETHODNAME" : "length"
				}, {
					"CALLEECLASS" : "String",
					"CALLEEMETHODNAME" : "substring"
				} ],
				"NUMBEROFMETHODLINES" : 3,
				"METHODPARAMETER" : [ {
					"PARAMETERNAME" : "text",
					"PARAMETERTYPE" : "String"
				} ]
			} ]
		}
	},
	"summary_NLG" : {
		"decorator" : {
			"Changer" : [ "Changer acts as a decorator for component Transform, which is inherited by Airplane, Robot." ],
			"Airplane" : [ "Airplane acts as a decorator for decorator Changer." ],
			"Car" : [ "Car acts as a component for decorator Changer." ],
			"AdvancedCipher" : [ "AdvancedCipher acts as a decorator for decorator CipherDecorator." ],
			"Cipher" : [ "Cipher acts as a component for CipherDecorator, which is inherited by SimpleCipher." ],
			"Transform" : [ "Transform acts as a component for Changer, which is inherited by Car." ],
			"CipherDecorator" : [ "CipherDecorator acts as a decorator for component Cipher, which is inherited by AdvancedCipher, ComplexCipher." ],
			"Robot" : [ "Robot acts as a decorator for decorator Changer." ],
			"SimpleCipher" : [ "SimpleCipher acts as a component for decorator CipherDecorator." ],
			"ComplexCipher" : [ "ComplexCipher acts as a decorator for decorator CipherDecorator." ]
		},
		"facade" : {
			"Changer" : [ "Changer acts as a facade for subsystem Transform, which move calls move method of Transform." ],
			"Transform" : [ "Transform acts as a subsystem for facade Changer, which move method of Changer calls move." ]
		}
	}
}